number,value,datetime_start,datetime_complete,duration,params_alpha,params_booster,params_colsample_bytree,params_eta,params_gamma,params_grow_policy,params_lambda,params_max_depth,params_min_child_weight,params_n_estimators,params_normalize_type,params_rate_drop,params_sample_type,params_skip_drop,params_subsample,state
0,-0.09720143688264415,2024-03-19 13:05:00.687161,2024-03-19 13:05:14.164625,0 days 00:00:13.477464,0.884391820997658,gbtree,0.8274705826067179,1.7410437501641237e-07,1.0332023192485298e-08,lossguide,0.831005638003509,7,2,240,,,,,0.5479552219487949,COMPLETE
1,-0.09722379035165796,2024-03-19 13:05:14.165621,2024-03-19 13:05:19.969198,0 days 00:00:05.803577,0.018982439625423397,gbtree,0.30165300423014624,3.433211039342732e-08,0.0015982355342413594,depthwise,0.0036167140856654388,9,3,160,,,,,0.8842757918739361,COMPLETE
2,0.083678141620582,2024-03-19 13:05:19.970200,2024-03-19 13:06:09.709300,0 days 00:00:49.739100,1.6312454859668965e-08,dart,0.5462103883563493,0.001404774287812316,3.7441330787959444e-08,depthwise,1.2933750634612203e-05,11,5,200,forest,1.2951346364372359e-05,uniform,2.5564602260846867e-07,0.2112694760082274,COMPLETE
3,0.16270346574578926,2024-03-19 13:06:09.711303,2024-03-19 13:06:35.568821,0 days 00:00:25.857518,3.7295325714848485e-08,dart,0.5946694863521635,0.004805176393163505,1.0042072186226016e-08,depthwise,0.0113779762023287,5,9,160,forest,1.8144520843910903e-05,uniform,8.097690443671749e-07,0.778521624381699,COMPLETE
4,0.5144771982805143,2024-03-19 13:06:35.569811,2024-03-19 13:06:59.825806,0 days 00:00:24.255995,1.6609197543167756e-06,dart,0.48996678240849506,0.07172641810397055,0.6033339984283038,depthwise,0.00044688103812530293,9,6,140,tree,2.7465999227751213e-05,uniform,0.01106861628804095,0.6111988931036698,COMPLETE
5,0.30492467309545324,2024-03-19 13:06:59.828047,2024-03-19 13:07:48.041768,0 days 00:00:48.213721,0.057281523959418185,dart,0.7207073823997427,0.08527691353008618,0.6911967149226281,lossguide,0.00011280075298868978,5,9,260,forest,0.2897844247715742,weighted,2.9910340983654368e-06,0.7322017896271356,COMPLETE
6,0.466040728816178,2024-03-19 13:07:48.042770,2024-03-19 13:08:15.065116,0 days 00:00:27.022346,0.00018079355337239421,dart,0.9888160887865538,0.36538877847545503,0.0004041543527821255,lossguide,0.0002503997478959908,5,6,160,forest,0.0003618998373373352,weighted,2.0139613283566013e-06,0.7828225278767842,COMPLETE
7,-0.09716167151903084,2024-03-19 13:08:15.067763,2024-03-19 13:08:22.193491,0 days 00:00:07.125728,0.007959121001042313,gbtree,0.9737942829317188,7.067456431810996e-07,0.43970205813101554,depthwise,1.587639904942014e-05,11,5,100,,,,,0.25641300647576143,COMPLETE
8,-0.09262013673426876,2024-03-19 13:08:22.194491,2024-03-19 13:08:25.212651,0 days 00:00:03.018160,7.4112087023549e-08,gbtree,0.663936101354366,6.214692233521189e-05,1.1107600821537518e-08,depthwise,4.016134782792631e-08,3,8,200,,,,,0.8805857392188938,COMPLETE
9,-0.09721391006138122,2024-03-19 13:08:25.214656,2024-03-19 13:08:31.455689,0 days 00:00:06.241033,0.005882233734543851,gbtree,0.6460382994025158,1.37567641945112e-07,0.020015620741892684,depthwise,2.6401051894929895e-05,5,5,220,,,,,0.5487244509174953,COMPLETE
10,-0.09244590026127283,2024-03-19 13:08:31.456691,2024-03-19 13:10:04.765252,0 days 00:01:33.308561,2.690348697719824e-06,dart,0.35910145723589737,2.229322783071658e-05,3.355351343858616e-06,lossguide,1.1095641239450518e-07,9,7,300,tree,1.2599350034778683e-08,uniform,0.10197725530325422,0.3839076498869469,COMPLETE
11,0.23198592871735552,2024-03-19 13:10:04.767270,2024-03-19 13:10:21.540752,0 days 00:00:16.773482,5.731850849549299e-05,dart,0.44075448201119377,0.7443256138014772,5.2752454856383555e-05,lossguide,0.00151039112760547,7,6,120,tree,0.0031937729304013012,weighted,0.004834535344056686,0.6695285869846166,COMPLETE
12,0.492055302609302,2024-03-19 13:10:21.541754,2024-03-19 13:10:49.465959,0 days 00:00:27.924205,2.5691205689384618e-05,dart,0.9777227278773841,0.030107958253461287,0.008811910161164479,lossguide,0.08675548667571847,9,7,140,tree,0.0004961994449390785,weighted,0.00034655219843397403,0.9677659825559985,COMPLETE
13,0.39783129322364474,2024-03-19 13:10:49.466960,2024-03-19 13:11:08.490721,0 days 00:00:19.023761,2.04940883113737e-06,dart,0.4821707877710471,0.012887268641098173,0.024198936819398144,lossguide,0.22185459206075822,9,10,120,tree,7.144489578756893e-07,uniform,0.0007431482005968963,0.9925404478033004,COMPLETE
14,0.5022002986880862,2024-03-19 13:11:08.492715,2024-03-19 13:11:36.894032,0 days 00:00:28.401317,3.077460073181829e-06,dart,0.7434011086418728,0.039109128586223896,0.029249009811006563,depthwise,0.02376422973497501,9,7,140,tree,0.006311150686842488,weighted,0.496816715002605,0.4408993769842149,COMPLETE
15,-0.016104809060984458,2024-03-19 13:11:36.896028,2024-03-19 13:12:26.384088,0 days 00:00:49.488060,6.849592925621292e-07,dart,0.7945000275607845,0.0007375897788340967,0.11370258391583067,depthwise,1.2259199901435275e-06,11,4,180,tree,0.05725107545577819,weighted,0.5395406797148901,0.4445040995669738,COMPLETE
16,-0.08053325976608114,2024-03-19 13:12:26.386113,2024-03-19 13:12:38.188093,0 days 00:00:11.801980,0.0003087275047212458,dart,0.24446121294412676,0.0003175954332119487,0.13407715360027186,depthwise,0.02368031617526523,7,7,100,tree,0.008420238931332034,uniform,0.022809568343546555,0.43426183145220143,COMPLETE
17,-0.0962020658173897,2024-03-19 13:12:38.190818,2024-03-19 13:13:06.670478,0 days 00:00:28.479660,3.3637927587484947e-07,dart,0.8667054051151,8.8657487985494e-06,0.0025588651822952414,depthwise,0.0008760920571178528,9,8,140,tree,8.894089317719893e-07,weighted,0.47232531563597163,0.344124822110792,COMPLETE
18,0.5221358945998089,2024-03-19 13:13:06.672480,2024-03-19 13:13:50.125648,0 days 00:00:43.453168,9.060081743457951e-06,dart,0.42356896480293216,0.12575683416948483,3.102229817037945e-05,depthwise,0.025212861000565908,11,4,180,tree,0.006744367881043388,uniform,0.007921561983912079,0.613287978048465,COMPLETE
19,0.40298002181153914,2024-03-19 13:13:50.127656,2024-03-19 13:14:33.947163,0 days 00:00:43.819507,1.6867861548158468e-05,dart,0.40979780807460126,0.29718393438215446,1.342882772925391e-05,depthwise,2.6925991475399414e-06,11,3,180,tree,4.175972391360184e-05,uniform,1.2305118086494187e-08,0.6166036294172335,COMPLETE
20,0.36043072587203584,2024-03-19 13:14:33.949156,2024-03-19 13:16:05.967931,0 days 00:01:32.018775,0.0008667745149993061,dart,0.5031398869000164,0.0037833455346118496,4.147093458461251e-07,depthwise,0.00036690298243645804,11,4,260,tree,1.2684512737297961e-06,uniform,0.0032667391815970966,0.5550538634594719,COMPLETE
21,0.5165025032771509,2024-03-19 13:16:05.968932,2024-03-19 13:16:32.073241,0 days 00:00:26.104309,4.014018567163689e-06,dart,0.37747340895880377,0.06948611545960749,0.00017724871823533364,depthwise,0.017678397676827648,9,6,140,tree,0.006699236208877565,uniform,0.02537659453276356,0.4835100979678738,COMPLETE
22,0.4990573404151413,2024-03-19 13:16:32.074257,2024-03-19 13:17:11.372971,0 days 00:00:39.298714,2.3535059596880557e-07,dart,0.36929036541706806,0.07951876067810602,8.340566786102384e-05,depthwise,0.004698683649806633,9,6,180,tree,0.043656368771596274,uniform,3.9179195445190263e-05,0.6341912562864291,COMPLETE
23,0.35930858473749855,2024-03-19 13:17:11.373973,2024-03-19 13:17:20.588181,0 days 00:00:09.214208,9.570064934612673e-06,dart,0.2841198689901995,0.13334852530700694,1.9213185983075484e-06,depthwise,0.09520057500984291,11,4,120,tree,0.8412453293285778,uniform,0.017601585194221944,0.49129010840087584,COMPLETE
24,0.06731870517374436,2024-03-19 13:17:20.589201,2024-03-19 13:17:51.443060,0 days 00:00:30.853859,6.3157605013880515e-06,dart,0.539753219767957,0.8916024580537648,0.0006139640001840191,depthwise,0.3883099661527565,7,5,160,tree,0.0005897438778743589,uniform,4.3559478319821916e-05,0.7112907213068896,COMPLETE
25,0.4031932352241787,2024-03-19 13:17:51.444062,2024-03-19 13:18:46.272742,0 days 00:00:54.828680,7.361287886027737e-07,dart,0.22012497454210253,0.009454784357741592,1.912495016644626e-05,depthwise,0.00223487767617663,9,2,220,tree,0.0019871446144687746,uniform,0.06725380972831174,0.5093191432993238,COMPLETE
26,0.5056179527087925,2024-03-19 13:18:46.273744,2024-03-19 13:18:53.591482,0 days 00:00:07.317738,0.0009196049555432653,gbtree,0.3512714059566409,0.02386326855937775,5.514669953999715e-07,depthwise,0.059037866628359144,11,3,140,,,,,0.6160354168763496,COMPLETE
27,0.04073416824872518,2024-03-19 13:18:53.592484,2024-03-19 13:19:31.567132,0 days 00:00:37.974648,7.532578078135073e-05,dart,0.4468743239213531,0.0025921556550725345,0.00027655672971240493,depthwise,0.008990494956747254,9,6,180,tree,0.04133358001999823,uniform,0.002569965882023747,0.32513170090013255,COMPLETE
28,-0.07228743089857523,2024-03-19 13:19:31.568134,2024-03-19 13:19:53.866069,0 days 00:00:22.297935,1.0463545986239407e-06,dart,0.409306150212032,0.0002378894515324909,1.5464499364988958e-05,depthwise,0.0004292389517766122,11,4,120,forest,0.00018604758947926122,uniform,0.00030001995631831214,0.6731568774696668,COMPLETE
29,0.49047879858288806,2024-03-19 13:19:53.867125,2024-03-19 13:19:58.191901,0 days 00:00:04.324776,8.219044222120296e-08,gbtree,0.5964699074179288,0.1910017430817836,0.004198889241247559,depthwise,8.952354148725758e-05,7,2,100,,,,,0.5798783214005394,COMPLETE
30,-0.09689512474422698,2024-03-19 13:19:58.193896,2024-03-19 13:20:53.844252,0 days 00:00:55.650356,2.88425168726891e-05,dart,0.30822478354238525,2.210424192199247e-06,1.317355148296813e-07,depthwise,0.8280511500022628,9,8,220,tree,4.2456449108089335e-06,uniform,0.02247285771739672,0.49641471757068434,COMPLETE
31,0.501810053408407,2024-03-19 13:20:53.845255,2024-03-19 13:21:01.302977,0 days 00:00:07.457722,0.000423844100254264,gbtree,0.3561763309866215,0.022761203537093988,2.89714027093417e-06,depthwise,0.04555398079051715,11,3,140,,,,,0.6031726806275374,COMPLETE
32,0.5291318754180312,2024-03-19 13:21:01.304969,2024-03-19 13:21:07.984317,0 days 00:00:06.679348,0.0015559448516690316,gbtree,0.32844684553330755,0.05730404051068026,7.837352872981901e-07,depthwise,0.14491952006055236,11,3,140,,,,,0.6527949695155351,COMPLETE
33,0.5316884343026596,2024-03-19 13:21:07.985316,2024-03-19 13:21:14.430480,0 days 00:00:06.445164,0.9773376475662754,gbtree,0.27493976494693917,0.0937636948156869,5.969015448445646e-07,depthwise,0.3244262977872368,11,2,160,,,,,0.7575872669594547,COMPLETE
34,0.2838399210106968,2024-03-19 13:21:14.431481,2024-03-19 13:21:19.728073,0 days 00:00:05.296592,0.5008229312127285,gbtree,0.20041348409006263,0.005891882654326184,9.861703834833912e-08,depthwise,0.28242348944716217,11,2,160,,,,,0.8101715973713177,COMPLETE
35,0.021748272733109662,2024-03-19 13:21:19.728801,2024-03-19 13:21:27.244083,0 days 00:00:07.515282,0.7253897939283737,gbtree,0.3062656084500505,0.0010867194199344987,3.947868619473409e-07,depthwise,0.9977784764810825,11,2,160,,,,,0.6806709076986666,COMPLETE
36,-0.09722379878901584,2024-03-19 13:21:27.245085,2024-03-19 13:21:35.194218,0 days 00:00:07.949133,0.11506456056272969,gbtree,0.2527303681925046,1.953103775058427e-08,6.551289488907381e-06,depthwise,0.009656072606825494,11,3,200,,,,,0.7396773654811533,COMPLETE
37,0.4470931875730984,2024-03-19 13:21:35.196213,2024-03-19 13:21:42.207816,0 days 00:00:07.011603,0.0030409843622087027,gbtree,0.29125327095351405,0.3111558465129743,1.2585196564405044e-06,depthwise,0.11883940799492221,11,4,180,,,,,0.8720344744070518,COMPLETE
38,0.5299206228982192,2024-03-19 13:21:42.208808,2024-03-19 13:21:50.706615,0 days 00:00:08.497807,0.025563696351187024,gbtree,0.40463127138117694,0.08033207752329317,0.0001558063675578724,lossguide,0.03055502608820223,11,2,160,,,,,0.8084689368271517,COMPLETE
39,0.4045460133323412,2024-03-19 13:21:50.708621,2024-03-19 13:21:53.547571,0 days 00:00:02.838950,0.04930571819201695,gbtree,0.5395748801914728,0.6284768051790871,4.1996083169544336e-08,lossguide,0.3442784389813825,3,2,200,,,,,0.8389606076939359,COMPLETE
40,0.5257622103449162,2024-03-19 13:21:53.547571,2024-03-19 13:22:02.667470,0 days 00:00:09.119899,0.24593582664063365,gbtree,0.44357828741093386,0.12849952875632337,5.3201602014682253e-05,lossguide,0.04559619633580902,11,3,160,,,,,0.7587814402404405,COMPLETE
41,0.5180065102098638,2024-03-19 13:22:02.669474,2024-03-19 13:22:11.977429,0 days 00:00:09.307955,0.2200162419321365,gbtree,0.4558883937624611,0.14268927499579448,4.505493405091389e-05,lossguide,0.005921782552356783,11,3,160,,,,,0.7658526440438599,COMPLETE
42,0.5374998039465478,2024-03-19 13:22:11.979431,2024-03-19 13:22:18.825621,0 days 00:00:06.846190,0.022647098352801976,gbtree,0.32416487002575567,0.04761809417515216,2.9425848964621378e-05,lossguide,0.03491234214731558,11,2,160,,,,,0.943758800471719,COMPLETE
43,0.4748006746846246,2024-03-19 13:22:18.827623,2024-03-19 13:22:26.143694,0 days 00:00:07.316071,0.018725018617470845,gbtree,0.3250407904841407,0.01253661946829387,0.0010298667900788252,lossguide,0.1765579942547568,11,2,160,,,,,0.9133742641781021,COMPLETE
44,0.526585898180587,2024-03-19 13:22:26.145689,2024-03-19 13:22:30.708946,0 days 00:00:04.563257,0.025982112486581194,gbtree,0.2596375165862881,0.0434955440727425,0.0001637228697304065,lossguide,0.05005600808857826,11,2,120,,,,,0.9277522691490625,COMPLETE
45,0.5240862040115756,2024-03-19 13:22:30.710371,2024-03-19 13:22:35.046875,0 days 00:00:04.336504,0.015132337599537806,gbtree,0.24749526343637585,0.041694865523836847,0.0001689038831455965,lossguide,0.3384137671291802,11,2,120,,,,,0.9580277779923712,COMPLETE
46,0.03963752011620543,2024-03-19 13:22:35.048949,2024-03-19 13:22:39.086505,0 days 00:00:04.037556,0.0032175901294592747,gbtree,0.26504036388879065,0.001850678401049504,6.604040398497801e-06,lossguide,0.0022174666332960124,11,2,100,,,,,0.9137588609253969,COMPLETE
47,0.28187660704528594,2024-03-19 13:22:39.087505,2024-03-19 13:22:43.506416,0 days 00:00:04.418911,0.051140518199785864,gbtree,0.3319516084670181,0.007184230440648828,1.0096103562594804e-06,lossguide,0.6941909800761452,9,2,120,,,,,0.81612104622591,COMPLETE
48,0.46333873524133384,2024-03-19 13:22:43.508410,2024-03-19 13:22:48.596457,0 days 00:00:05.088047,0.009657018639897248,gbtree,0.3888044215714851,0.056651009321955666,1.5103875147660808e-07,lossguide,0.12815160966791223,5,3,300,,,,,0.9320713696782252,COMPLETE
49,0.3878613040706559,2024-03-19 13:22:48.597862,2024-03-19 13:22:53.427771,0 days 00:00:04.829909,0.030601453301565173,gbtree,0.22850760874282297,0.4353971582307948,6.932768231925318e-06,lossguide,0.042049300188652265,11,3,140,,,,,0.8495693933946753,COMPLETE
50,0.5175826380580102,2024-03-19 13:22:53.429766,2024-03-19 13:23:01.593314,0 days 00:00:08.163548,0.0030325085896279707,gbtree,0.2703098013352759,0.018469922079307092,0.0005929798325052956,lossguide,0.0009574007244862234,11,2,200,,,,,0.8055761791499474,COMPLETE
51,0.4629741262335399,2024-03-19 13:23:01.594777,2024-03-19 13:23:09.059909,0 days 00:00:07.465132,0.1874221538364786,gbtree,0.34097964887899734,0.26876613846709546,9.099296011098415e-05,lossguide,0.048638438907165744,11,3,160,,,,,0.7690312545128801,COMPLETE
52,0.5435521338634308,2024-03-19 13:23:09.062034,2024-03-19 13:23:17.559252,0 days 00:00:08.497218,0.24825744797184043,gbtree,0.478933786617421,0.046913985778759874,0.0014697182110218973,lossguide,0.01477255795919847,11,3,160,,,,,0.9945003599093135,COMPLETE
53,0.5391321455331197,2024-03-19 13:23:17.560244,2024-03-19 13:23:25.454634,0 days 00:00:07.894390,0.44001464726229583,gbtree,0.5021918845974577,0.04606418552255352,0.009383949890083388,lossguide,0.013378616446779533,11,2,140,,,,,0.9927019680766234,COMPLETE
54,0.25970194050141304,2024-03-19 13:23:25.455637,2024-03-19 13:23:33.458485,0 days 00:00:08.002848,0.9095997092308499,gbtree,0.4930821837625293,0.004387292044855923,0.005759421175781203,lossguide,0.011375160608437664,11,3,140,,,,,0.9987666044867998,COMPLETE
55,0.3109308397652636,2024-03-19 13:23:33.459487,2024-03-19 13:23:37.246961,0 days 00:00:03.787474,0.12092058022451847,gbtree,0.511636648300033,0.013074403166837894,0.0017041366861665335,lossguide,0.003983918863304767,5,2,180,,,,,0.9646548479226423,COMPLETE
56,-0.09134509319359974,2024-03-19 13:23:37.247963,2024-03-19 13:23:44.334434,0 days 00:00:07.086471,0.3702538279451513,gbtree,0.5810386760030785,4.959626470861311e-05,0.058677650659876464,lossguide,0.018950030407582096,9,5,140,,,,,0.8808275979242397,COMPLETE
57,-0.09719053864677729,2024-03-19 13:23:44.335437,2024-03-19 13:23:53.542462,0 days 00:00:09.207025,0.09549604414808595,gbtree,0.47668514969282133,2.193139424982265e-07,0.00780564458205768,lossguide,0.00011551774907542896,11,3,160,,,,,0.9771422093931297,COMPLETE
58,-0.03818215034517323,2024-03-19 13:23:53.543464,2024-03-19 13:24:00.163264,0 days 00:00:06.619800,0.396394972542731,gbtree,0.3950942266083458,0.0004993810123675324,0.0024656293455304797,lossguide,1.5426371383133388e-08,9,4,160,,,,,0.7129395706886212,COMPLETE
59,0.5315200514422511,2024-03-19 13:24:00.164267,2024-03-19 13:24:07.417506,0 days 00:00:07.253239,0.006701524505267122,gbtree,0.42491495956682246,0.08537928675779308,1.595507291762853e-08,lossguide,0.022119851965032803,11,2,140,,,,,0.9477289473859831,COMPLETE
60,0.39508149464282616,2024-03-19 13:24:07.419500,2024-03-19 13:24:16.490303,0 days 00:00:09.070803,0.06760653484893904,gbtree,0.4188141567009694,0.48196057834037853,2.3892627872624954e-08,lossguide,0.02091967174774088,11,2,180,,,,,0.9497631792589195,COMPLETE
61,0.5356427359757939,2024-03-19 13:24:16.492985,2024-03-19 13:24:24.467378,0 days 00:00:07.974393,0.006815747317165912,gbtree,0.4679324404681076,0.07348234473413787,0.012756342391640616,lossguide,0.08548265221304828,11,2,140,,,,,0.9061557859877598,COMPLETE
62,0.5273516222392656,2024-03-19 13:24:24.468380,2024-03-19 13:24:33.736763,0 days 00:00:09.268383,0.005935725877372562,gbtree,0.5745355688231082,0.11062529834424867,0.016005432232808446,lossguide,0.006589525294654875,11,2,140,,,,,0.9010974055743252,COMPLETE
63,0.5151316749189166,2024-03-19 13:24:33.738802,2024-03-19 13:24:40.888172,0 days 00:00:07.149370,0.16013852937918988,gbtree,0.4561167562719672,0.02594359214869946,0.31167489157645867,lossguide,0.08890198558905145,11,2,120,,,,,0.8549646203763993,COMPLETE
64,0.4858550190933887,2024-03-19 13:24:40.889175,2024-03-19 13:24:56.969600,0 days 00:00:16.080425,0.009868730870065665,gbtree,0.523429437738355,0.22941139919372142,0.013286135193374883,lossguide,0.029304628289861204,11,2,280,,,,,0.9963945016348316,COMPLETE
65,0.5406364639679178,2024-03-19 13:24:56.972580,2024-03-19 13:25:05.096947,0 days 00:00:08.124367,0.032808672628297134,gbtree,0.6306203407955189,0.07587682003801027,0.0009907759747040154,lossguide,0.01613304971368318,9,2,160,,,,,0.9461258197411495,COMPLETE
66,0.22311965707503215,2024-03-19 13:25:05.098019,2024-03-19 13:25:11.301514,0 days 00:00:06.203495,0.5451819899706516,gbtree,0.6312107623832399,0.9732125457477446,0.03577313292620912,lossguide,0.0022717583012260975,9,3,120,,,,,0.943339672931023,COMPLETE
67,0.5182952397171879,2024-03-19 13:25:11.304329,2024-03-19 13:25:18.782105,0 days 00:00:07.477776,0.056622016248918564,gbtree,0.6346077366105939,0.036875473616714526,0.0015029480750149728,lossguide,3.4105621411114393e-06,9,2,140,,,,,0.8930268081436668,COMPLETE
68,0.47406275667868886,2024-03-19 13:25:18.784099,2024-03-19 13:25:26.397885,0 days 00:00:07.613786,1.0397806908300004e-08,gbtree,0.4730110718316808,0.013946508556868423,0.004698963071380218,lossguide,0.08337834333853981,9,2,180,,,,,0.9773439872999415,COMPLETE
69,0.5111107804075795,2024-03-19 13:25:26.399878,2024-03-19 13:25:36.702824,0 days 00:00:10.302946,0.2764180655544377,gbtree,0.697467611686439,0.17639770612297812,1.365973197224517e-08,lossguide,1.6917231064293235e-07,11,3,140,,,,,0.9295858659366157,COMPLETE
70,0.5154960883644455,2024-03-19 13:25:36.703827,2024-03-19 13:25:43.112594,0 days 00:00:06.408767,0.85570976966489,gbtree,0.6763014861221095,0.07582374509533661,0.0004627627465002361,lossguide,0.012046093265765199,7,2,160,,,,,0.8634772335982833,COMPLETE
71,0.5371083798520371,2024-03-19 13:25:43.113594,2024-03-19 13:25:51.588915,0 days 00:00:08.475321,0.030244956724595113,gbtree,0.4299607171546901,0.08971723383602877,0.0031766229693388106,lossguide,0.47593278152327456,11,2,160,,,,,0.8980151063681712,COMPLETE
72,0.5387460000951794,2024-03-19 13:25:51.589913,2024-03-19 13:26:00.229999,0 days 00:00:08.640086,0.013451371930257023,gbtree,0.5455321289058395,0.0408195195899151,0.0011564414780037223,lossguide,0.6189659007240454,11,2,140,,,,,0.9745493175954663,COMPLETE
73,0.5306089973368767,2024-03-19 13:26:00.232002,2024-03-19 13:26:11.959034,0 days 00:00:11.727032,0.0133734228718373,gbtree,0.5640570117635754,0.02163558049813324,0.0011187928566876414,lossguide,0.47465884287537186,11,2,180,,,,,0.9778158235232562,COMPLETE
74,0.4252618293290274,2024-03-19 13:26:11.960034,2024-03-19 13:26:23.607912,0 days 00:00:11.647878,0.0369134187640395,gbtree,0.6220629331392907,0.007888983377171945,0.00030937246153976,lossguide,0.23660282665242932,11,3,160,,,,,0.9054961754214669,COMPLETE
75,0.20959939866740607,2024-03-19 13:26:23.608927,2024-03-19 13:26:33.338913,0 days 00:00:09.729986,0.10372693551973232,gbtree,0.5588370813863366,0.0031484646464061523,0.0026913566970822957,lossguide,0.6196604598999783,11,10,160,,,,,0.9647308944603468,COMPLETE
76,0.5295475976256738,2024-03-19 13:26:33.339915,2024-03-19 13:26:44.260744,0 days 00:00:10.920829,0.001459149411484244,gbtree,0.7637573096314141,0.036315591617718045,0.010006536343465586,lossguide,0.23096540181371156,11,2,140,,,,,0.9988404682533585,COMPLETE
