number,values_0,values_1,datetime_start,datetime_complete,duration,params_criterion,params_max_depth,params_max_features,params_max_leaf_nodes,params_n_estimators,system_attrs_nsga2:generation,state
0,0.4530361291994689,0.3432433842677066,2024-03-16 13:14:54.050393,2024-03-16 14:33:09.725815,0 days 01:18:15.675422,absolute_error,15,,400,320,0,COMPLETE
1,0.4836151352893519,0.32274074762551114,2024-03-16 14:33:09.726818,2024-03-16 14:34:15.600061,0 days 00:01:05.873243,friedman_mse,13,,700,320,0,COMPLETE
2,0.508871602118021,0.3073021742250709,2024-03-16 14:34:15.601048,2024-03-16 14:35:44.518601,0 days 00:01:28.917553,squared_error,17,,1000,360,0,COMPLETE
3,0.5084662961625953,0.30755425972163997,2024-03-16 14:35:44.519604,2024-03-16 14:37:02.648741,0 days 00:01:18.129137,squared_error,17,,1000,320,0,COMPLETE
4,0.4349792812063934,0.35234421405365596,2024-03-16 14:37:02.650749,2024-03-16 14:37:35.560792,0 days 00:00:32.910043,squared_error,15,,200,220,0,COMPLETE
5,0.43288383554375665,0.3570318300271777,2024-03-16 14:37:35.561794,2024-03-16 14:44:14.580950,0 days 00:06:39.019156,absolute_error,13,sqrt,800,360,0,COMPLETE
6,0.385799444427266,0.38342924564358016,2024-03-16 14:44:14.581950,2024-03-16 14:44:53.245059,0 days 00:00:38.663109,friedman_mse,15,,100,320,0,COMPLETE
7,0.45663839609096535,0.34173393074553216,2024-03-16 14:44:53.247060,2024-03-16 14:49:03.221790,0 days 00:04:09.974730,absolute_error,15,sqrt,1000,220,0,COMPLETE
8,0.3855010991943251,0.3836702384105815,2024-03-16 14:49:03.222792,2024-03-16 14:49:32.129817,0 days 00:00:28.907025,squared_error,17,,100,240,0,COMPLETE
9,0.43136844436107447,0.3544373815690018,2024-03-16 14:49:32.130820,2024-03-16 14:49:36.399400,0 days 00:00:04.268580,friedman_mse,19,sqrt,400,240,0,COMPLETE
10,0.4829449035138511,0.32241765114299115,2024-03-16 14:49:36.400403,2024-03-16 14:49:43.934533,0 days 00:00:07.534130,friedman_mse,19,sqrt,900,320,0,COMPLETE
11,0.4765540840281979,0.32660728021333674,2024-03-16 14:49:43.935536,2024-03-16 14:50:20.837955,0 days 00:00:36.902419,friedman_mse,17,,400,200,0,COMPLETE
12,0.4604951830465523,0.33638154500033357,2024-03-16 14:50:20.838957,2024-03-16 14:51:11.021149,0 days 00:00:50.182192,friedman_mse,15,,300,300,0,COMPLETE
13,0.43543262525495996,0.35483497096401906,2024-03-16 14:51:11.023151,2024-03-16 16:00:39.648993,0 days 01:09:28.625842,absolute_error,15,,300,280,0,COMPLETE
14,0.4575064062773442,0.338326616627525,2024-03-16 16:00:39.650605,2024-03-16 16:01:33.914541,0 days 00:00:54.263936,squared_error,13,,300,320,0,COMPLETE
15,0.4027385454300901,0.37714139592029017,2024-03-16 16:01:33.915545,2024-03-16 16:06:22.706092,0 days 00:04:48.790547,absolute_error,15,sqrt,400,260,0,COMPLETE
16,0.43135497375945187,0.3544753158680559,2024-03-16 16:06:22.708465,2024-03-16 16:06:26.701418,0 days 00:00:03.992953,squared_error,19,sqrt,400,220,0,COMPLETE
17,0.3233036067648757,0.4220172783828896,2024-03-16 16:06:26.703412,2024-03-16 16:06:30.870033,0 days 00:00:04.166621,friedman_mse,17,sqrt,100,300,0,COMPLETE
18,0.42956393395422154,0.35956029665923495,2024-03-16 16:06:30.872028,2024-03-16 16:10:59.367609,0 days 00:04:28.495581,absolute_error,15,sqrt,600,240,0,COMPLETE
19,0.4046283471476032,0.3761773300163873,2024-03-16 16:10:59.369612,2024-03-16 16:15:03.158656,0 days 00:04:03.789044,absolute_error,19,sqrt,400,220,0,COMPLETE
20,0.4211815737609269,0.3652933263419978,2024-03-16 16:15:03.160649,2024-03-16 16:19:30.902903,0 days 00:04:27.742254,absolute_error,19,sqrt,500,240,0,COMPLETE
21,0.43550055956667,0.3520115772880452,2024-03-16 16:19:30.904855,2024-03-16 16:20:21.361413,0 days 00:00:50.456558,squared_error,15,,200,340,0,COMPLETE
22,0.4810224543993663,0.32355403743798217,2024-03-16 16:20:21.361944,2024-03-16 16:20:29.089205,0 days 00:00:07.727261,squared_error,15,sqrt,1000,300,0,COMPLETE
23,0.4581899822894373,0.33771452252938616,2024-03-16 16:20:29.090208,2024-03-16 16:20:35.160585,0 days 00:00:06.070377,friedman_mse,17,sqrt,600,300,0,COMPLETE
24,0.4400737249300196,0.3522988782679038,2024-03-16 16:20:35.161600,2024-03-16 16:25:26.573575,0 days 00:04:51.411975,absolute_error,13,sqrt,1000,260,0,COMPLETE
25,0.48532130081517744,0.3213564068719066,2024-03-16 16:25:26.574822,2024-03-16 16:26:32.763245,0 days 00:01:06.188423,friedman_mse,15,,500,340,0,COMPLETE
26,0.3233253659138115,0.42208982771908554,2024-03-16 16:26:32.765620,2024-03-16 16:26:35.237386,0 days 00:00:02.471766,friedman_mse,15,sqrt,100,200,0,COMPLETE
27,0.3230870485177574,0.4221856590417642,2024-03-16 16:26:35.238390,2024-03-16 16:26:39.886292,0 days 00:00:04.647902,squared_error,15,sqrt,100,340,0,COMPLETE
28,0.4299077681739488,0.35523161337302994,2024-03-16 16:26:39.888298,2024-03-16 16:26:45.811182,0 days 00:00:05.922884,friedman_mse,15,sqrt,400,340,0,COMPLETE
29,0.4099541547374497,0.3677369249764779,2024-03-16 16:26:45.812181,2024-03-16 16:26:51.248800,0 days 00:00:05.436619,friedman_mse,19,sqrt,300,340,0,COMPLETE
30,0.5020981807183441,0.31143035395933816,2024-03-16 16:26:51.250803,2024-03-16 16:28:15.641549,0 days 00:01:24.390746,friedman_mse,15,,1000,360,0,COMPLETE
31,0.4325211331391537,0.35652702398780267,2024-03-16 16:28:15.643880,2024-03-16 17:54:41.295081,0 days 01:26:25.651201,absolute_error,13,,300,340,0,COMPLETE
32,0.49869071774650875,0.31345893839152444,2024-03-16 17:54:41.296277,2024-03-16 17:55:59.071508,0 days 00:01:17.775231,squared_error,15,,800,340,0,COMPLETE
33,0.3783150528263413,0.38747156430841184,2024-03-16 17:55:59.073017,2024-03-16 17:56:05.426502,0 days 00:00:06.353485,squared_error,15,sqrt,200,320,0,COMPLETE
34,0.38586456919980705,0.3834464191635789,2024-03-16 17:56:05.428498,2024-03-16 17:56:41.540048,0 days 00:00:36.111550,squared_error,19,,100,300,0,COMPLETE
35,0.32315726858175803,0.4221425502994459,2024-03-16 17:56:41.541051,2024-03-16 17:56:45.840155,0 days 00:00:04.299104,squared_error,17,sqrt,100,360,0,COMPLETE
36,0.4647142997404212,0.3367028677559417,2024-03-16 17:56:45.842157,2024-03-16 18:02:25.558198,0 days 00:05:39.716041,absolute_error,19,sqrt,1000,300,0,COMPLETE
37,0.4363958401481723,0.35425686825863745,2024-03-16 18:02:25.559200,2024-03-16 19:26:38.535699,0 days 01:24:12.976499,absolute_error,17,,300,320,0,COMPLETE
38,0.4834329244330601,0.32286162285172515,2024-03-16 19:26:38.535699,2024-03-16 19:27:49.269444,0 days 00:01:10.733745,friedman_mse,13,,700,300,0,COMPLETE
39,0.4865973051712082,0.32011133969004246,2024-03-16 19:27:49.270446,2024-03-16 19:27:57.350623,0 days 00:00:08.080177,friedman_mse,17,sqrt,1000,220,0,COMPLETE
40,0.5033340486810871,0.31051888413355133,2024-03-16 19:27:57.352143,2024-03-16 19:28:59.844664,0 days 00:01:02.492521,squared_error,17,,800,240,0,COMPLETE
41,0.4754575324693592,0.3269468020929004,2024-03-16 19:28:59.844664,2024-03-16 19:29:06.207892,0 days 00:00:06.363228,squared_error,17,sqrt,800,240,0,COMPLETE
42,0.40715529677281,0.37332724466289224,2024-03-16 19:29:06.207892,2024-03-16 20:27:08.016833,0 days 00:58:01.808941,absolute_error,15,,200,220,0,COMPLETE
43,0.47007291369539106,0.3306990892985389,2024-03-16 20:27:08.018363,2024-03-16 20:27:58.606635,0 days 00:00:50.588272,friedman_mse,13,,400,240,0,COMPLETE
44,0.3783821584975705,0.38758271183986975,2024-03-16 20:27:58.607638,2024-03-16 20:28:03.994403,0 days 00:00:05.386765,squared_error,17,sqrt,200,200,0,COMPLETE
45,0.4961680534382393,0.3153342795240973,2024-03-16 20:28:03.994403,2024-03-16 21:34:01.168932,0 days 01:05:57.174529,absolute_error,19,,1000,240,0,COMPLETE
46,0.4960159559235934,0.315036265220454,2024-03-16 21:34:01.168932,2024-03-16 21:35:25.976939,0 days 00:01:24.808007,squared_error,15,,700,340,0,COMPLETE
47,0.44556165226525496,0.34905618617806644,2024-03-16 21:35:25.976939,2024-03-16 21:39:55.028736,0 days 00:04:29.051797,absolute_error,15,sqrt,800,220,0,COMPLETE
48,0.40686715706792087,0.369602671407165,2024-03-16 21:39:55.029728,2024-03-16 21:40:00.848592,0 days 00:00:05.818864,squared_error,13,sqrt,300,320,0,COMPLETE
49,0.495786677229885,0.3150134121116125,2024-03-16 21:40:00.849592,2024-03-16 21:41:13.198172,0 days 00:01:12.348580,squared_error,19,,600,300,0,COMPLETE
50,0.49866837723496255,0.3134591392163648,2024-03-16 21:41:13.198172,2024-03-16 21:42:38.509003,0 days 00:01:25.310831,friedman_mse,15,,800,340,1,COMPLETE
51,0.4803267917146501,0.32392067509752115,2024-03-16 21:42:38.509003,2024-03-16 21:42:47.173547,0 days 00:00:08.664544,friedman_mse,15,sqrt,1000,320,1,COMPLETE
52,0.4312630337444661,0.35448390593952755,2024-03-16 21:42:47.173547,2024-03-16 21:42:53.191534,0 days 00:00:06.017987,squared_error,19,sqrt,400,300,1,COMPLETE
53,0.47096082710246473,0.32969684271976096,2024-03-16 21:42:53.191534,2024-03-16 21:42:59.228550,0 days 00:00:06.037016,friedman_mse,15,sqrt,800,240,1,COMPLETE
54,0.5033340486810871,0.31051888413355133,2024-03-16 21:42:59.228550,2024-03-16 21:44:01.895681,0 days 00:01:02.667131,squared_error,17,,800,240,1,COMPLETE
55,0.4607211581246141,0.33623831359475187,2024-03-16 21:44:01.897250,2024-03-16 21:45:07.427061,0 days 00:01:05.529811,friedman_mse,15,,300,340,1,COMPLETE
56,0.464199977076346,0.335845642240738,2024-03-16 21:45:07.427061,2024-03-16 23:18:45.098017,0 days 01:33:37.670956,absolute_error,15,,500,360,1,COMPLETE
57,0.5073096659806741,0.30834844015045376,2024-03-16 23:18:45.098017,2024-03-16 23:19:37.789993,0 days 00:00:52.691976,squared_error,17,,1000,200,1,COMPLETE
58,0.38623582411944335,0.3831613262156505,2024-03-16 23:19:37.789993,2024-03-16 23:20:21.571223,0 days 00:00:43.781230,squared_error,13,,100,340,1,COMPLETE
59,0.43522643932746236,0.35491735108279004,2024-03-16 23:20:21.571223,2024-03-17 00:43:00.993449,0 days 01:22:39.422226,absolute_error,15,,300,300,1,COMPLETE
60,0.47537795077013384,0.32727592939840183,2024-03-17 00:43:00.994468,2024-03-17 00:43:44.939449,0 days 00:00:43.944981,friedman_mse,15,,400,220,1,COMPLETE
61,0.48262049941257834,0.3240514752426223,2024-03-17 00:43:44.940452,2024-03-17 01:44:52.768736,0 days 01:01:07.828284,absolute_error,15,,900,240,1,COMPLETE
62,0.49519680742613037,0.31547314733223447,2024-03-17 01:44:52.770750,2024-03-17 01:45:47.398936,0 days 00:00:54.628186,friedman_mse,15,,700,240,1,COMPLETE
63,0.460526675275381,0.33636935472646284,2024-03-17 01:45:47.398936,2024-03-17 01:46:40.248005,0 days 00:00:52.849069,squared_error,15,,300,300,1,COMPLETE
64,0.5085144508250125,0.3075165019556813,2024-03-17 01:46:40.248005,2024-03-17 01:47:59.653999,0 days 00:01:19.405994,friedman_mse,17,,1000,320,1,COMPLETE
65,0.32375597143232354,0.42185175144168063,2024-03-17 01:47:59.656012,2024-03-17 01:48:02.187566,0 days 00:00:02.531554,friedman_mse,19,sqrt,100,200,1,COMPLETE
66,0.42971908400675957,0.35539405213061104,2024-03-17 01:48:02.187566,2024-03-17 01:48:08.018948,0 days 00:00:05.831382,squared_error,15,sqrt,400,320,1,COMPLETE
67,0.464248371454593,0.3338750361022844,2024-03-17 01:48:08.018948,2024-03-17 01:48:15.276459,0 days 00:00:07.257511,friedman_mse,15,sqrt,700,340,1,COMPLETE
68,0.4863210167038178,0.32030244730245794,2024-03-17 01:48:15.276459,2024-03-17 01:48:20.905646,0 days 00:00:05.629187,squared_error,17,sqrt,1000,220,1,COMPLETE
69,0.4932472624927164,0.31709120190530726,2024-03-17 01:48:20.905646,2024-03-17 03:20:33.394232,0 days 01:32:12.488586,absolute_error,17,,1000,360,1,COMPLETE
70,0.44556165226525496,0.34905618617806644,2024-03-17 03:20:33.394232,2024-03-17 03:24:46.909168,0 days 00:04:13.514936,absolute_error,15,sqrt,800,220,1,COMPLETE
71,0.38588529997946075,0.3833847992563226,2024-03-17 03:24:46.911495,2024-03-17 03:25:27.839995,0 days 00:00:40.928500,squared_error,19,,100,320,1,COMPLETE
72,0.43115329766749005,0.35453460495537165,2024-03-17 03:25:27.839995,2024-03-17 03:25:33.943130,0 days 00:00:06.103135,squared_error,19,sqrt,400,340,1,COMPLETE
73,0.48388766392518734,0.32257672617999106,2024-03-17 03:25:33.943130,2024-03-17 03:26:42.886097,0 days 00:01:08.942967,squared_error,13,,700,340,1,COMPLETE
74,0.4546800493242862,0.3424324788023013,2024-03-17 03:26:42.886097,2024-03-17 04:37:19.713794,0 days 01:10:36.827697,absolute_error,19,,400,280,1,COMPLETE
75,0.4349792812063934,0.35234421405365596,2024-03-17 04:37:19.713794,2024-03-17 04:37:56.676005,0 days 00:00:36.962211,squared_error,15,,200,220,1,COMPLETE
76,0.4048727205246805,0.3760221866358713,2024-03-17 04:37:56.676005,2024-03-17 04:42:27.624780,0 days 00:04:30.948775,absolute_error,19,sqrt,400,240,1,COMPLETE
77,0.5036949951250355,0.31027901439389416,2024-03-17 04:42:27.624780,2024-03-17 04:43:32.372866,0 days 00:01:04.748086,squared_error,17,,800,280,1,COMPLETE
78,0.486158268047547,0.3204315972393198,2024-03-17 04:43:32.375390,2024-03-17 04:43:39.845287,0 days 00:00:07.469897,friedman_mse,17,sqrt,1000,300,1,COMPLETE
79,0.3770472133277168,0.3882605265980411,2024-03-17 04:43:39.845287,2024-03-17 04:43:45.085369,0 days 00:00:05.240082,squared_error,13,sqrt,200,320,1,COMPLETE
80,0.46319010934878957,0.33668335253209997,2024-03-17 04:43:45.085369,2024-03-17 06:04:03.414555,0 days 01:20:18.329186,absolute_error,13,,700,320,1,COMPLETE
81,0.4955310025219973,0.31527809959479697,2024-03-17 06:04:03.414555,2024-03-17 06:04:59.028291,0 days 00:00:55.613736,friedman_mse,15,,700,260,1,COMPLETE
82,0.4765787798577401,0.32662967296448736,2024-03-17 06:04:59.030305,2024-03-17 06:05:38.413604,0 days 00:00:39.383299,squared_error,17,,400,200,1,COMPLETE
83,0.4336938072998211,0.35696406225565175,2024-03-17 06:05:38.413604,2024-03-17 06:12:03.466206,0 days 00:06:25.052602,absolute_error,19,sqrt,600,340,1,COMPLETE
84,0.4604951830465523,0.33638154500033357,2024-03-17 06:12:03.466206,2024-03-17 06:12:55.082145,0 days 00:00:51.615939,friedman_mse,15,,300,300,1,COMPLETE
85,0.46096548470010373,0.33611159774438076,2024-03-17 06:12:55.082145,2024-03-17 06:13:34.579404,0 days 00:00:39.497259,friedman_mse,17,,300,220,1,COMPLETE
86,0.4070722195942988,0.36944238744021646,2024-03-17 06:13:34.579404,2024-03-17 06:13:39.440039,0 days 00:00:04.860635,squared_error,13,sqrt,300,300,1,COMPLETE
87,0.4577528909713938,0.33817055820805947,2024-03-17 06:13:39.442547,2024-03-17 06:14:36.841831,0 days 00:00:57.399284,squared_error,13,,300,340,1,COMPLETE
88,0.4312630337444661,0.35448390593952755,2024-03-17 06:14:36.844869,2024-03-17 06:14:42.275210,0 days 00:00:05.430341,squared_error,19,sqrt,400,300,1,COMPLETE
89,0.4539718924191877,0.3428636912482128,2024-03-17 06:14:42.275210,2024-03-17 07:20:09.987473,0 days 01:05:27.712263,absolute_error,17,,400,260,1,COMPLETE
90,0.46380943808011954,0.3341412072043348,2024-03-17 07:20:09.987473,2024-03-17 07:20:20.367920,0 days 00:00:10.380447,friedman_mse,13,sqrt,1000,340,1,COMPLETE
91,0.502217406276103,0.3113918873693526,2024-03-17 07:20:20.368922,2024-03-17 07:21:47.664413,0 days 00:01:27.295491,squared_error,15,,1000,360,1,COMPLETE
92,0.4258241131912082,0.3577797762934722,2024-03-17 07:21:47.666419,2024-03-17 07:21:51.600569,0 days 00:00:03.934150,squared_error,13,sqrt,400,220,1,COMPLETE
93,0.43434592934265376,0.3527042480854621,2024-03-17 07:21:51.600569,2024-03-17 07:22:43.426982,0 days 00:00:51.826413,friedman_mse,13,,200,340,1,COMPLETE
94,0.3855010991943251,0.3836702384105815,2024-03-17 07:22:43.426982,2024-03-17 07:23:12.824324,0 days 00:00:29.397342,squared_error,17,,100,240,1,COMPLETE
95,0.47694528100117556,0.32639254667646955,2024-03-17 07:23:12.825325,2024-03-17 07:23:50.895581,0 days 00:00:38.070256,friedman_mse,19,,400,200,1,COMPLETE
96,0.5006825897211634,0.3122382881659522,2024-03-17 07:23:50.896583,2024-03-17 07:25:05.443695,0 days 00:01:14.547112,friedman_mse,15,,900,320,1,COMPLETE
97,0.4867230001411283,0.3214892437824208,2024-03-17 07:25:05.443695,2024-03-17 08:21:16.563810,0 days 00:56:11.120115,absolute_error,17,,800,220,1,COMPLETE
98,0.40407057653696593,0.3764079126977671,2024-03-17 08:21:16.563810,2024-03-17 08:25:04.261008,0 days 00:03:47.697198,absolute_error,17,sqrt,400,200,1,COMPLETE
99,0.4626709087602057,0.33790960003134096,2024-03-17 08:25:04.261008,2024-03-17 08:29:41.523470,0 days 00:04:37.262462,absolute_error,17,sqrt,1000,240,1,COMPLETE
