number,values_0,values_1,datetime_start,datetime_complete,duration,params_criterion,params_max_depth,params_max_features,params_max_leaf_nodes,params_min_samples_leaf,params_min_samples_split,params_n_estimators,system_attrs_nsga2:generation,state
0,0.13253270254812283,0.5438450460207604,2024-03-13 17:05:25.588176,2024-03-13 17:05:29.343217,0 days 00:00:03.755041,friedman_mse,5,log2,300,5,6,100,0,COMPLETE
1,0.3246394014858054,0.4288035254356609,2024-03-13 17:05:29.343217,2024-03-13 17:07:17.319733,0 days 00:01:47.976516,absolute_error,9,sqrt,900,3,4,100,0,COMPLETE
2,0.2563439373561188,0.4676172135961208,2024-03-13 17:07:17.319733,2024-03-13 17:07:24.454039,0 days 00:00:07.134306,friedman_mse,5,,800,3,8,100,0,COMPLETE
3,0.13691698025973809,0.5436090354013374,2024-03-13 17:07:24.454039,2024-03-13 17:07:31.128790,0 days 00:00:06.674751,squared_error,3,,1000,3,4,160,0,COMPLETE
4,0.12241423224702228,0.5605737549057525,2024-03-13 17:07:31.128790,2024-03-13 17:35:35.953800,0 days 00:28:04.825010,absolute_error,3,,700,3,4,160,0,COMPLETE
5,0.13867905751473822,0.5397439564784569,2024-03-13 17:35:35.953800,2024-03-13 17:35:38.623056,0 days 00:00:02.669256,squared_error,5,log2,1000,1,10,180,0,COMPLETE
6,0.2904220987733005,0.4512655736114931,2024-03-13 17:35:38.624563,2024-03-13 17:37:49.557590,0 days 00:02:10.933027,absolute_error,9,log2,800,1,4,180,0,COMPLETE
7,0.25665373435850203,0.4674587811890952,2024-03-13 17:37:49.557590,2024-03-13 17:38:01.026524,0 days 00:00:11.468934,friedman_mse,5,,700,1,4,180,0,COMPLETE
8,0.12276720041498382,0.5605527896082052,2024-03-13 17:38:01.026524,2024-03-13 18:12:57.280136,0 days 00:34:56.253612,absolute_error,3,,700,3,2,200,0,COMPLETE
9,0.15019430837343975,0.5457412522090419,2024-03-13 18:12:57.281138,2024-03-13 18:15:51.664152,0 days 00:02:54.383014,absolute_error,5,sqrt,200,1,4,180,0,COMPLETE
10,0.2724872724992863,0.4548244679740849,2024-03-13 18:15:51.665155,2024-03-13 18:15:54.932038,0 days 00:00:03.266883,friedman_mse,7,sqrt,600,1,6,120,0,COMPLETE
11,0.1350757227872691,0.5420814997070904,2024-03-13 18:15:54.933040,2024-03-13 18:15:55.800138,0 days 00:00:00.867098,friedman_mse,5,log2,800,3,6,120,0,COMPLETE
12,0.12120411811224288,0.561277851565442,2024-03-13 18:15:55.802132,2024-03-13 18:40:37.083474,0 days 00:24:41.281342,absolute_error,3,,300,1,6,140,0,COMPLETE
13,0.1164260452217644,0.5685536332478376,2024-03-13 18:40:37.084475,2024-03-13 18:42:10.718374,0 days 00:01:33.633899,absolute_error,5,log2,100,1,8,140,0,COMPLETE
14,0.13731368172898817,0.5434396507445542,2024-03-13 18:42:10.719376,2024-03-13 18:42:16.533723,0 days 00:00:05.814347,friedman_mse,3,,1000,3,8,100,0,COMPLETE
15,0.2919080787944496,0.44298745623911084,2024-03-13 18:42:16.533723,2024-03-13 18:42:18.519537,0 days 00:00:01.985814,friedman_mse,9,log2,300,5,2,200,0,COMPLETE
16,0.4080217643058825,0.36996189900521786,2024-03-13 18:42:18.520607,2024-03-13 18:42:39.592062,0 days 00:00:21.071455,friedman_mse,9,,700,3,8,160,0,COMPLETE
17,0.3385311593234309,0.4136046567855519,2024-03-13 18:42:39.593079,2024-03-13 18:42:41.651138,0 days 00:00:02.058059,friedman_mse,9,sqrt,700,5,2,140,0,COMPLETE
18,0.40813934096746474,0.36950402622638284,2024-03-13 18:42:41.651138,2024-03-13 18:43:00.066508,0 days 00:00:18.415370,friedman_mse,9,,200,1,6,140,0,COMPLETE
19,0.350920857434592,0.40607372852566614,2024-03-13 18:43:00.067527,2024-03-13 18:43:10.093471,0 days 00:00:10.025944,friedman_mse,7,,800,3,8,100,0,COMPLETE
20,0.28416402866715307,0.45553266492074995,2024-03-13 18:43:10.093471,2024-03-13 18:44:39.046614,0 days 00:01:28.953143,absolute_error,9,log2,400,3,4,120,0,COMPLETE
21,0.3009729807887181,0.4369742507952507,2024-03-13 18:44:39.047616,2024-03-13 18:44:40.759234,0 days 00:00:01.711618,squared_error,9,log2,1000,3,8,160,0,COMPLETE
22,0.27119026376046657,0.45558071503694997,2024-03-13 18:44:40.760236,2024-03-13 18:44:42.232876,0 days 00:00:01.472640,squared_error,9,log2,100,1,4,160,0,COMPLETE
23,0.40483780418024323,0.37229518042803056,2024-03-13 18:44:42.233879,2024-03-13 18:45:02.026315,0 days 00:00:19.792436,friedman_mse,9,,700,5,6,160,0,COMPLETE
24,0.20755198895775973,0.5067099979618179,2024-03-13 18:45:02.027320,2024-03-13 18:46:10.451398,0 days 00:01:08.424078,absolute_error,7,log2,1000,1,10,100,0,COMPLETE
25,0.06277583605588963,0.5877970766236916,2024-03-13 18:46:10.451398,2024-03-13 18:46:11.262518,0 days 00:00:00.811120,squared_error,3,sqrt,1000,5,2,120,0,COMPLETE
26,0.2563032794930978,0.46775896899818814,2024-03-13 18:46:11.264519,2024-03-13 18:46:23.034984,0 days 00:00:11.770465,friedman_mse,5,,900,5,6,180,0,COMPLETE
27,0.03671152211689823,0.6046764373240601,2024-03-13 18:46:23.035960,2024-03-13 18:46:23.608345,0 days 00:00:00.572385,friedman_mse,3,log2,400,1,10,100,0,COMPLETE
28,0.13778120650922648,0.5404897560092113,2024-03-13 18:46:23.610387,2024-03-13 18:46:24.644258,0 days 00:00:01.033871,squared_error,5,log2,900,3,8,160,0,COMPLETE
29,0.25675268766277054,0.46740207333392225,2024-03-13 18:46:24.646260,2024-03-13 18:46:36.327230,0 days 00:00:11.680970,squared_error,5,,900,3,8,180,0,COMPLETE
30,0.25607396601555915,0.46786462929077144,2024-03-13 18:46:36.328229,2024-03-13 18:46:45.487149,0 days 00:00:09.158920,friedman_mse,5,,100,5,8,140,0,COMPLETE
31,0.24366302389947836,0.4829135544542127,2024-03-13 18:46:45.487149,2024-03-13 18:49:16.704054,0 days 00:02:31.216905,absolute_error,7,sqrt,300,1,10,140,0,COMPLETE
32,0.06696280515280166,0.5852259333223435,2024-03-13 18:49:16.705057,2024-03-13 18:49:17.664325,0 days 00:00:00.959268,friedman_mse,3,sqrt,700,3,8,160,0,COMPLETE
33,0.3234417573123536,0.42933308306624934,2024-03-13 18:49:17.664325,2024-03-13 18:52:57.198316,0 days 00:03:39.533991,absolute_error,9,sqrt,600,3,8,200,0,COMPLETE
34,0.409644921604821,0.368845430891699,2024-03-13 18:52:57.199319,2024-03-13 18:53:23.551588,0 days 00:00:26.352269,squared_error,9,,800,3,2,200,0,COMPLETE
35,0.13360470234894478,0.5430858669720264,2024-03-13 18:53:23.553789,2024-03-13 18:53:24.293567,0 days 00:00:00.739778,friedman_mse,5,log2,400,3,4,100,0,COMPLETE
36,0.4085680555050081,0.3695588803392712,2024-03-13 18:53:24.293567,2024-03-13 18:53:50.473925,0 days 00:00:26.180358,squared_error,9,,400,3,8,200,0,COMPLETE
37,0.042231848541483964,0.6180056209461549,2024-03-13 18:53:50.474927,2024-03-13 18:56:31.030673,0 days 00:02:40.555746,absolute_error,3,sqrt,800,5,8,200,0,COMPLETE
38,0.1150924655116901,0.5693342466636495,2024-03-13 18:56:31.031675,2024-03-13 18:58:39.406616,0 days 00:02:08.374941,absolute_error,5,log2,100,5,2,200,0,COMPLETE
39,0.3154958858384494,0.43347136390078456,2024-03-13 18:58:39.406616,2024-03-13 19:35:23.229869,0 days 00:36:43.823253,absolute_error,7,,700,5,8,160,0,COMPLETE
40,0.06277583605588963,0.5877970766236916,2024-03-13 19:35:23.230638,2024-03-13 19:35:24.392161,0 days 00:00:01.161523,friedman_mse,3,sqrt,800,5,2,120,0,COMPLETE
41,0.25669146433682416,0.46745514467690885,2024-03-13 19:35:24.394569,2024-03-13 19:35:39.500313,0 days 00:00:15.105744,friedman_mse,5,,500,3,10,200,0,COMPLETE
42,0.3492086116817067,0.4072507482158951,2024-03-13 19:35:39.501316,2024-03-13 19:35:54.911184,0 days 00:00:15.409868,squared_error,7,,800,5,6,160,0,COMPLETE
43,0.014916572974682563,0.6361978001269464,2024-03-13 19:35:54.912186,2024-03-13 19:36:57.690331,0 days 00:01:02.778145,absolute_error,3,log2,600,3,4,120,0,COMPLETE
44,0.04279799266566238,0.6176164240607692,2024-03-13 19:36:57.692850,2024-03-13 19:39:04.990691,0 days 00:02:07.297841,absolute_error,3,sqrt,300,5,4,160,0,COMPLETE
45,0.13884336693125363,0.5396894697327053,2024-03-13 19:39:04.991695,2024-03-13 19:39:06.113614,0 days 00:00:01.121919,squared_error,5,log2,100,1,8,180,0,COMPLETE
46,0.13869737867423898,0.5397765511819876,2024-03-13 19:39:06.115608,2024-03-13 19:39:07.264015,0 days 00:00:01.148407,squared_error,5,log2,1000,1,4,180,0,COMPLETE
47,0.04024117524721158,0.6024044872873295,2024-03-13 19:39:07.265177,2024-03-13 19:39:08.184517,0 days 00:00:00.919340,friedman_mse,3,log2,100,3,10,200,0,COMPLETE
48,0.1780402757466565,0.5151166131573577,2024-03-13 19:39:08.185519,2024-03-13 19:39:09.559003,0 days 00:00:01.373484,squared_error,5,sqrt,300,1,8,160,0,COMPLETE
49,0.3116002294675019,0.42988925417628243,2024-03-13 19:39:09.560525,2024-03-13 19:39:10.893350,0 days 00:00:01.332825,friedman_mse,9,log2,300,1,2,120,0,COMPLETE
50,0.13529075329823254,0.5419360300871252,2024-03-13 19:39:10.895304,2024-03-13 19:39:11.747995,0 days 00:00:00.852691,friedman_mse,5,log2,800,1,6,120,1,COMPLETE
51,0.3246394014858054,0.4288035254356609,2024-03-13 19:39:11.750003,2024-03-13 19:40:57.970205,0 days 00:01:46.220202,absolute_error,9,sqrt,900,3,4,100,1,COMPLETE
52,0.27296823912702606,0.45440048302561886,2024-03-13 19:40:57.972209,2024-03-13 19:40:59.191067,0 days 00:00:01.218858,friedman_mse,7,sqrt,600,1,6,100,1,COMPLETE
53,0.28858580055670746,0.4529530104802836,2024-03-13 19:40:59.193059,2024-03-13 19:43:48.962397,0 days 00:02:49.769338,absolute_error,9,sqrt,100,3,4,160,1,COMPLETE
54,0.24708710215720675,0.480233842985883,2024-03-13 19:43:48.963390,2024-03-13 19:47:16.880152,0 days 00:03:27.916762,absolute_error,7,sqrt,300,1,6,200,1,COMPLETE
55,0.35235292514762584,0.4044389131601552,2024-03-13 19:47:16.882156,2024-03-13 19:47:19.399441,0 days 00:00:02.517285,friedman_mse,9,sqrt,700,1,8,180,1,COMPLETE
56,0.23532358730772981,0.4858176845610692,2024-03-13 19:47:19.400441,2024-03-13 20:29:09.337189,0 days 00:41:49.936748,absolute_error,5,,500,5,10,200,1,COMPLETE
57,0.1377074155247797,0.5404493220656046,2024-03-13 20:29:09.338207,2024-03-13 20:29:10.914583,0 days 00:00:01.576376,friedman_mse,5,log2,700,5,6,180,1,COMPLETE
58,0.04024117524721158,0.6024044872873295,2024-03-13 20:29:10.915600,2024-03-13 20:29:14.132708,0 days 00:00:03.217108,friedman_mse,3,log2,100,3,10,200,1,COMPLETE
59,0.38007034868480527,0.3909861048849608,2024-03-13 20:29:14.133711,2024-03-13 21:07:32.661171,0 days 00:38:18.527460,absolute_error,9,,700,1,4,160,1,COMPLETE
60,0.13867881639430546,0.5397441100316784,2024-03-13 21:07:32.662173,2024-03-13 21:07:35.349907,0 days 00:00:02.687734,friedman_mse,5,log2,1000,1,10,180,1,COMPLETE
61,0.13692566230922842,0.5436047817448179,2024-03-13 21:07:35.351911,2024-03-13 21:07:43.603288,0 days 00:00:08.251377,squared_error,3,,300,5,6,160,1,COMPLETE
62,0.3491549067632369,0.4072971830835014,2024-03-13 21:07:43.604291,2024-03-13 21:07:57.263374,0 days 00:00:13.659083,friedman_mse,7,,700,5,2,140,1,COMPLETE
63,0.15008017718732075,0.5458203496640643,2024-03-13 21:07:57.263374,2024-03-13 21:10:57.066872,0 days 00:02:59.803498,absolute_error,5,sqrt,900,1,8,180,1,COMPLETE
64,0.2563855419024553,0.467593265566342,2024-03-13 21:10:57.067887,2024-03-13 21:11:03.816514,0 days 00:00:06.748627,squared_error,5,,1000,3,8,100,1,COMPLETE
65,0.4091990195515921,0.36916010067375693,2024-03-13 21:11:03.816514,2024-03-13 21:11:25.037951,0 days 00:00:21.221437,squared_error,9,,600,3,6,160,1,COMPLETE
66,0.2919080787944496,0.44298745623911084,2024-03-13 21:11:25.038949,2024-03-13 21:11:27.050058,0 days 00:00:02.011109,friedman_mse,9,log2,300,5,2,200,1,COMPLETE
67,0.3492086116817067,0.4072507482158951,2024-03-13 21:11:27.051072,2024-03-13 21:11:42.686237,0 days 00:00:15.635165,squared_error,7,,700,5,6,160,1,COMPLETE
68,0.2563404411049578,0.46773682383246884,2024-03-13 21:11:42.688258,2024-03-13 21:11:54.652947,0 days 00:00:11.964689,squared_error,5,,900,5,6,180,1,COMPLETE
69,0.3113646105197231,0.43019987588443465,2024-03-13 21:11:54.653949,2024-03-13 21:11:56.595330,0 days 00:00:01.941381,squared_error,9,log2,400,1,4,180,1,COMPLETE
70,0.256737002647105,0.4674124252358543,2024-03-13 21:11:56.595330,2024-03-13 21:12:08.824916,0 days 00:00:12.229586,friedman_mse,5,,100,3,10,180,1,COMPLETE
71,0.20935555557596244,0.5053283122851348,2024-03-13 21:12:08.824916,2024-03-13 21:13:20.241758,0 days 00:01:11.416842,absolute_error,7,log2,1000,1,2,100,1,COMPLETE
72,0.40787188889068354,0.36997955495119467,2024-03-13 21:13:20.242760,2024-03-13 21:13:46.321342,0 days 00:00:26.078582,friedman_mse,9,,200,3,8,200,1,COMPLETE
73,0.4080217643058825,0.36996189900521786,2024-03-13 21:13:46.322329,2024-03-13 21:14:07.266317,0 days 00:00:20.943988,friedman_mse,9,,900,3,8,160,1,COMPLETE
74,0.3779951320479384,0.39298007041768646,2024-03-13 21:14:07.267320,2024-03-13 22:02:32.051985,0 days 00:48:24.784665,absolute_error,9,,600,3,8,200,1,COMPLETE
75,0.23513933751435254,0.4857754308057921,2024-03-13 22:02:32.052988,2024-03-13 22:37:33.444262,0 days 00:35:01.391274,absolute_error,5,,1000,1,4,160,1,COMPLETE
76,0.3509297586074996,0.40600418619414647,2024-03-13 22:37:33.445263,2024-03-13 22:37:54.504279,0 days 00:00:21.059016,squared_error,7,,800,3,8,200,1,COMPLETE
77,0.24366302389947836,0.4829135544542127,2024-03-13 22:37:54.506272,2024-03-13 22:40:26.866153,0 days 00:02:32.359881,absolute_error,7,sqrt,600,1,10,140,1,COMPLETE
78,0.3492086116817067,0.4072507482158951,2024-03-13 22:40:26.866153,2024-03-13 22:40:42.414189,0 days 00:00:15.548036,squared_error,7,,400,5,6,160,1,COMPLETE
79,0.3477024148251192,0.4073397336330573,2024-03-13 22:40:42.414189,2024-03-13 22:40:44.250445,0 days 00:00:01.836256,friedman_mse,9,sqrt,800,3,2,120,1,COMPLETE
80,0.35077929617289916,0.40612464722771496,2024-03-13 22:40:44.252151,2024-03-13 22:40:59.947253,0 days 00:00:15.695102,squared_error,7,,700,3,8,160,1,COMPLETE
81,0.25667517991429295,0.4674474204926605,2024-03-13 22:40:59.947253,2024-03-13 22:41:11.890641,0 days 00:00:11.943388,squared_error,5,,800,1,4,180,1,COMPLETE
82,0.3003257347595496,0.4375927256684976,2024-03-13 22:41:11.891643,2024-03-13 22:41:13.041551,0 days 00:00:01.149908,friedman_mse,9,log2,1000,3,4,100,1,COMPLETE
83,0.0669358562772255,0.5852436493305658,2024-03-13 22:41:13.042552,2024-03-13 22:41:14.041077,0 days 00:00:00.998525,squared_error,3,sqrt,200,5,4,160,1,COMPLETE
84,0.3168689538414068,0.43250271212384667,2024-03-13 22:41:14.042078,2024-03-13 23:09:38.881400,0 days 00:28:24.839322,absolute_error,7,,400,3,8,120,1,COMPLETE
85,0.22305592410972253,0.4866950566010078,2024-03-13 23:09:38.883418,2024-03-13 23:09:41.798577,0 days 00:00:02.915159,squared_error,7,log2,1000,5,8,160,1,COMPLETE
86,0.30058528485759084,0.4371268952936269,2024-03-13 23:09:41.799593,2024-03-13 23:09:45.540689,0 days 00:00:03.741096,squared_error,9,log2,900,3,8,200,1,COMPLETE
87,0.13647388812973743,0.5438477547057372,2024-03-13 23:09:45.542684,2024-03-13 23:09:50.029418,0 days 00:00:04.486734,friedman_mse,3,,1000,3,8,120,1,COMPLETE
88,0.3078227640928546,0.432442645020403,2024-03-13 23:09:50.030418,2024-03-13 23:09:51.333488,0 days 00:00:01.303070,friedman_mse,9,log2,300,1,6,120,1,COMPLETE
89,0.13731368172898817,0.5434396507445542,2024-03-13 23:09:51.335484,2024-03-13 23:09:55.117973,0 days 00:00:03.782489,friedman_mse,3,,300,3,2,100,1,COMPLETE
90,0.409644921604821,0.368845430891699,2024-03-13 23:09:55.117973,2024-03-13 23:10:20.658946,0 days 00:00:25.540973,squared_error,9,,800,3,2,200,1,COMPLETE
91,0.40531654573086556,0.37209959667887954,2024-03-13 23:10:20.659948,2024-03-13 23:10:33.261411,0 days 00:00:12.601463,friedman_mse,9,,800,5,2,100,1,COMPLETE
92,0.3515856135744877,0.4054123999044591,2024-03-13 23:10:33.262413,2024-03-13 23:10:50.329939,0 days 00:00:17.067526,friedman_mse,7,,600,1,2,180,1,COMPLETE
93,0.3766149536054235,0.39378391346052066,2024-03-13 23:10:50.331960,2024-03-13 23:34:38.389542,0 days 00:23:48.057582,absolute_error,9,,700,3,8,100,1,COMPLETE
94,0.2564051760544019,0.46757750987716395,2024-03-13 23:34:38.390544,2024-03-13 23:34:46.488119,0 days 00:00:08.097575,squared_error,5,,1000,3,6,100,1,COMPLETE
95,0.2565435423551635,0.4675249044622996,2024-03-13 23:34:46.489124,2024-03-13 23:34:59.843938,0 days 00:00:13.354814,squared_error,5,,1000,1,10,180,1,COMPLETE
96,0.37404268652274275,0.3957479603167287,2024-03-13 23:34:59.844941,2024-03-14 00:04:41.481223,0 days 00:29:41.636282,absolute_error,9,,300,5,8,120,1,COMPLETE
97,0.1778057427809341,0.5152826090584632,2024-03-14 00:04:41.483267,2024-03-14 00:04:44.519529,0 days 00:00:03.036262,friedman_mse,5,sqrt,200,1,6,140,1,COMPLETE
98,0.3494565617896067,0.40712478090006404,2024-03-14 00:04:44.522041,2024-03-14 00:04:58.026747,0 days 00:00:13.504706,friedman_mse,7,,800,5,6,100,1,COMPLETE
99,0.13731368172898817,0.5434396507445542,2024-03-14 00:04:58.026747,2024-03-14 00:05:02.281748,0 days 00:00:04.255001,friedman_mse,3,,1000,3,8,100,1,COMPLETE
