number,value,datetime_start,datetime_complete,duration,params_alpha,params_booster,params_colsample_bytree,params_eta,params_gamma,params_grow_policy,params_lambda,params_max_depth,params_min_child_weight,params_n_estimators,params_normalize_type,params_rate_drop,params_sample_type,params_skip_drop,params_subsample,state
77,0.42346337220252667,2024-03-19 13:26:44.261746,2024-03-19 13:26:56.833185,0 days 00:00:12.571439,0.063085301362515,gbtree,0.6065637891724742,0.38665841468462664,0.0008112146528269899,lossguide,0.5017995140065153,11,2,180,,,,,0.8312021448883873,COMPLETE
78,0.4007799594743465,2024-03-19 13:26:56.834229,2024-03-19 13:27:03.869703,0 days 00:00:07.035474,0.0002152273334369171,gbtree,0.5283761935756652,0.15915336197736463,0.04268513012153562,lossguide,0.18453981987263918,9,3,200,,,,,0.20494588145643183,COMPLETE
79,-0.09622663283616939,2024-03-19 13:27:03.871697,2024-03-19 13:27:19.538147,0 days 00:00:15.666450,0.004065827621782831,gbtree,0.8939464198980525,5.990078158928251e-06,0.002865839335237417,lossguide,0.08296164676287791,11,2,160,,,,,0.8912998211902949,COMPLETE
80,0.5243225538570875,2024-03-19 13:27:19.539150,2024-03-19 13:27:24.643633,0 days 00:00:05.104483,0.3464509572113808,gbtree,0.49269102193139486,0.0637637443144737,0.10793391990784319,lossguide,0.14839944149927312,9,4,120,,,,,0.9217504899010829,COMPLETE
81,0.5279409957432394,2024-03-19 13:27:24.644636,2024-03-19 13:27:31.985976,0 days 00:00:07.341340,0.006584277126229216,gbtree,0.43608257833732533,0.10613824471696155,0.018982416830229915,lossguide,0.011668742765969433,11,2,140,,,,,0.9495980599809707,COMPLETE
82,0.5361038976581363,2024-03-19 13:27:31.986979,2024-03-19 13:27:38.650595,0 days 00:00:06.663616,0.016185008665475394,gbtree,0.3755190922661072,0.04730702573361973,2.784087593803307e-07,lossguide,0.03108948460876882,11,2,140,,,,,0.9440451448041565,COMPLETE
83,0.5369356145458815,2024-03-19 13:27:38.653355,2024-03-19 13:27:46.453627,0 days 00:00:07.800272,0.024899249404869195,gbtree,0.3843832133400289,0.029787633942042094,2.3831829356180763e-07,lossguide,0.06422929293536826,11,2,160,,,,,0.9774350855629158,COMPLETE
84,0.5315005631534983,2024-03-19 13:27:46.455622,2024-03-19 13:27:53.253090,0 days 00:00:06.797468,0.01982478947459468,gbtree,0.37621871917293104,0.027799228752475667,2.986416415103191e-07,lossguide,0.015177401025445902,11,2,140,,,,,0.9720138414540981,COMPLETE
85,0.5025709878684144,2024-03-19 13:27:53.254089,2024-03-19 13:28:07.242304,0 days 00:00:13.988215,0.010146208264447495,gbtree,0.4741591935447742,0.009713191119288044,5.8066792616786926e-08,lossguide,0.006095492514641143,11,3,240,,,,,0.9376384065833575,COMPLETE
86,0.540110195794154,2024-03-19 13:28:07.243264,2024-03-19 13:28:14.780147,0 days 00:00:07.536883,0.034250691701251536,gbtree,0.3656086736883324,0.04899764766221958,0.006922699699792126,lossguide,0.0329201532409642,11,3,160,,,,,0.8752790719281521,COMPLETE
87,0.5412329723762456,2024-03-19 13:28:14.782389,2024-03-19 13:28:22.499683,0 days 00:00:07.717294,0.04447576438654713,gbtree,0.36880104296101307,0.0461217977020104,0.0071455064102954,lossguide,0.03343966464022404,11,5,180,,,,,0.9786480159002182,COMPLETE
88,0.3379673472530393,2024-03-19 13:28:22.501677,2024-03-19 13:28:30.287561,0 days 00:00:07.785884,0.03294723044206438,gbtree,0.35517782710011736,0.005460963644409193,0.006386329715104841,lossguide,0.0008892353465945413,11,9,180,,,,,0.9787693877754803,COMPLETE
89,0.49249807413595015,2024-03-19 13:28:30.288564,2024-03-19 13:28:38.339199,0 days 00:00:08.050635,0.07386529973427919,gbtree,0.39066744204506865,0.016583500123996592,0.0015151242852829482,lossguide,0.9977675357983217,11,5,160,,,,,0.8759609093385551,COMPLETE
90,0.4759534768264321,2024-03-19 13:28:38.341204,2024-03-19 13:28:44.557605,0 days 00:00:06.216401,0.03889675927277049,gbtree,0.3123493651086029,0.28358059763302734,0.0002553989272672497,lossguide,0.0038361198894431496,11,4,160,,,,,0.9850420565492518,COMPLETE
91,0.5383222289172037,2024-03-19 13:28:44.559622,2024-03-19 13:28:51.426023,0 days 00:00:06.866401,0.01906138365605005,gbtree,0.37161742560286803,0.05101600430260003,0.004016330660085349,lossguide,0.03095782674037052,11,7,160,,,,,0.9590046369402402,COMPLETE
92,0.5279093297350606,2024-03-19 13:28:51.428029,2024-03-19 13:28:59.095464,0 days 00:00:07.667435,0.1716401116260365,gbtree,0.3481653200919953,0.03015970539507269,0.002000193619730402,lossguide,0.056284312638830984,11,7,180,,,,,0.9243143971241193,COMPLETE
93,0.5124243991179768,2024-03-19 13:28:59.096455,2024-03-19 13:29:07.534278,0 days 00:00:08.437823,0.025873294460411273,gbtree,0.4335355159499759,0.18610386460446063,0.004305706032127028,lossguide,0.036197739756707356,11,8,180,,,,,0.9603035659383388,COMPLETE
94,0.4494334679310749,2024-03-19 13:29:07.536638,2024-03-19 13:29:13.813030,0 days 00:00:06.276392,0.08420970153020578,gbtree,0.4059121989863406,0.01806705283166831,0.003705661635779733,lossguide,0.007143625795451745,11,6,160,,,,,0.2569343078253476,COMPLETE
95,0.53828949530968,2024-03-19 13:29:13.814783,2024-03-19 13:29:21.945712,0 days 00:00:08.130929,0.1231710258342873,gbtree,0.506280899641865,0.04938181907244016,0.02385278037767415,lossguide,0.014523449851806817,11,8,160,,,,,0.999585931700301,COMPLETE
96,0.5382912772535097,2024-03-19 13:29:21.947729,2024-03-19 13:29:30.097646,0 days 00:00:08.149917,0.15574030477769227,gbtree,0.49739179916671405,0.047486953974590115,0.008397691678375738,lossguide,0.002365404500506436,11,8,160,,,,,0.9976135708906239,COMPLETE
97,0.5419573067470133,2024-03-19 13:29:30.098647,2024-03-19 13:29:39.347349,0 days 00:00:09.248702,0.5467690660085771,gbtree,0.514213483673815,0.057089544129194855,0.027919983406430374,lossguide,0.0033363415413657552,11,8,180,,,,,0.9983755270221043,COMPLETE
98,0.41877509491894005,2024-03-19 13:29:39.348351,2024-03-19 13:29:50.216817,0 days 00:00:10.868466,0.13659341686506088,gbtree,0.5449862591709806,0.5443804504318109,0.06382803923602523,lossguide,0.002652321433912529,11,8,200,,,,,0.9993927134054497,COMPLETE
99,0.43418596862689396,2024-03-19 13:29:50.218626,2024-03-19 13:30:00.296381,0 days 00:00:10.077755,0.5029374869677972,gbtree,0.5081046343592431,0.009013484010498075,0.024049265596053002,lossguide,0.0016006241675130392,11,9,180,,,,,0.9579618813852379,COMPLETE
