number,values_0,values_1,datetime_start,datetime_complete,duration,params_criterion,params_max_leaf_nodes,params_min_samples_leaf,params_min_samples_split,params_n_estimators,system_attrs_nsga2:generation,state
0,0.4882240889477966,0.3206268628980933,2024-03-17 10:47:13.778704,2024-03-17 10:48:16.056140,0 days 00:01:02.277436,friedman_mse,1000,1,14,260,0,COMPLETE
1,0.42492033003691443,0.3631970069625279,2024-03-17 10:48:16.057143,2024-03-17 12:05:43.196556,0 days 01:17:27.139413,absolute_error,1000,9,8,320,0,COMPLETE
2,0.49696354294414996,0.31491092238835383,2024-03-17 12:05:43.197709,2024-03-17 12:06:57.796472,0 days 00:01:14.598763,friedman_mse,800,1,10,320,0,COMPLETE
3,0.4222950455906259,0.364916155738954,2024-03-17 12:06:57.796626,2024-03-17 13:24:45.396540,0 days 01:17:47.599914,absolute_error,1400,9,20,320,0,COMPLETE
4,0.5055153278450197,0.3094664360509958,2024-03-17 13:24:45.396540,2024-03-17 13:25:44.576232,0 days 00:00:59.179692,friedman_mse,1000,1,6,240,0,COMPLETE
5,0.484089456663264,0.3239544059123681,2024-03-17 13:25:44.576232,2024-03-17 13:26:58.111254,0 days 00:01:13.535022,squared_error,1200,3,14,360,0,COMPLETE
6,0.4840749618259254,0.32414585061663603,2024-03-17 13:26:58.111524,2024-03-17 13:27:59.333581,0 days 00:01:01.222057,friedman_mse,800,5,6,300,0,COMPLETE
7,0.45055623144915613,0.3451769522664962,2024-03-17 13:27:59.333581,2024-03-17 13:28:41.789097,0 days 00:00:42.455516,squared_error,600,9,8,240,0,COMPLETE
8,0.4589258021076362,0.3400944357795864,2024-03-17 13:28:41.789097,2024-03-17 13:29:28.615358,0 days 00:00:46.826261,friedman_mse,1000,7,18,260,0,COMPLETE
9,0.4241384398714219,0.3637176279552428,2024-03-17 13:29:28.615358,2024-03-17 14:15:51.510516,0 days 00:46:22.895158,absolute_error,800,9,4,200,0,COMPLETE
10,0.4246690803256902,0.36337100878935097,2024-03-17 14:15:51.512525,2024-03-17 15:25:26.188556,0 days 01:09:34.676031,absolute_error,1800,9,8,300,0,COMPLETE
11,0.4419530939949229,0.35236156131822866,2024-03-17 15:25:26.188556,2024-03-17 16:16:51.927290,0 days 00:51:25.738734,absolute_error,2000,7,14,220,0,COMPLETE
12,0.4660175636415763,0.33553830006026,2024-03-17 16:16:51.927290,2024-03-17 16:17:39.305255,0 days 00:00:47.377965,friedman_mse,1400,7,6,240,0,COMPLETE
13,0.447773537037361,0.3469368709887083,2024-03-17 16:17:39.305255,2024-03-17 16:18:29.280041,0 days 00:00:49.974786,squared_error,1000,9,20,280,0,COMPLETE
14,0.4843284487414866,0.3239800856600473,2024-03-17 16:18:29.280041,2024-03-17 16:19:23.021910,0 days 00:00:53.741869,friedman_mse,2000,5,10,260,0,COMPLETE
15,0.46473459054858574,0.33593711278999766,2024-03-17 16:19:23.021910,2024-03-17 17:12:38.776288,0 days 00:53:15.754378,absolute_error,1000,1,16,220,0,COMPLETE
16,0.4853156620866114,0.32222792424406965,2024-03-17 17:12:38.776288,2024-03-17 17:13:37.346453,0 days 00:00:58.570165,friedman_mse,600,1,14,280,0,COMPLETE
17,0.48423484661026206,0.32406426496856244,2024-03-17 17:13:37.346453,2024-03-17 17:14:44.432889,0 days 00:01:07.086436,squared_error,1000,5,10,320,0,COMPLETE
18,0.4506019855064066,0.3452768076996506,2024-03-17 17:14:44.432889,2024-03-17 17:15:19.817050,0 days 00:00:35.384161,squared_error,2000,9,10,200,0,COMPLETE
19,0.512275953771228,0.30526743697251674,2024-03-17 17:15:19.819964,2024-03-17 17:16:47.536003,0 days 00:01:27.716039,friedman_mse,1400,1,2,320,0,COMPLETE
20,0.43180672396501796,0.3587308949358611,2024-03-17 17:16:47.536003,2024-03-17 18:22:18.444261,0 days 01:05:30.908258,absolute_error,1200,7,20,280,0,COMPLETE
21,0.46616126745990727,0.33547352547803566,2024-03-17 18:22:18.444261,2024-03-17 18:23:26.726970,0 days 00:01:08.282709,squared_error,2000,7,8,360,0,COMPLETE
22,0.48457474383737054,0.3239062492718204,2024-03-17 18:23:26.726970,2024-03-17 18:24:13.157501,0 days 00:00:46.430531,squared_error,1400,5,6,220,0,COMPLETE
23,0.48457474383737054,0.3239062492718204,2024-03-17 18:24:13.157501,2024-03-17 18:24:58.705473,0 days 00:00:45.547972,squared_error,2000,5,6,220,0,COMPLETE
24,0.49142785857967564,0.31810791637568203,2024-03-17 18:24:58.708484,2024-03-17 18:26:11.802607,0 days 00:01:13.094123,friedman_mse,600,1,10,360,0,COMPLETE
25,0.4426399821430005,0.35196038407458347,2024-03-17 18:26:11.802607,2024-03-17 19:42:13.428799,0 days 01:16:01.626192,absolute_error,1200,7,4,320,0,COMPLETE
26,0.4620524154396806,0.33822975172008307,2024-03-17 19:42:13.429801,2024-03-17 19:42:51.837532,0 days 00:00:38.407731,squared_error,2000,5,20,200,0,COMPLETE
27,0.4501226605676183,0.34540852568092195,2024-03-17 19:42:51.840637,2024-03-17 19:43:42.103653,0 days 00:00:50.263016,squared_error,1000,9,10,280,0,COMPLETE
28,0.46569827695527455,0.33569619185259214,2024-03-17 19:43:42.104800,2024-03-17 19:44:34.285756,0 days 00:00:52.180956,friedman_mse,1600,7,2,280,0,COMPLETE
29,0.47945893455803024,0.3269525193497532,2024-03-17 19:44:34.288167,2024-03-17 19:45:20.363108,0 days 00:00:46.074941,squared_error,600,5,12,240,0,COMPLETE
30,0.42492033003691443,0.3631970069625279,2024-03-17 19:45:20.364111,2024-03-17 21:03:44.129750,0 days 01:18:23.765639,absolute_error,800,9,10,320,0,COMPLETE
31,0.4700639581330696,0.33244296042009325,2024-03-17 21:03:44.130753,2024-03-17 22:05:08.126592,0 days 01:01:23.995839,absolute_error,800,1,14,240,0,COMPLETE
32,0.4552913286044202,0.3418930477112578,2024-03-17 22:05:08.127595,2024-03-17 23:36:19.163979,0 days 01:31:11.036384,absolute_error,1800,1,20,360,0,COMPLETE
33,0.45055623144915613,0.3451769522664962,2024-03-17 23:36:19.164981,2024-03-17 23:37:03.723261,0 days 00:00:44.558280,squared_error,600,9,18,240,0,COMPLETE
34,0.49945422261656286,0.3139808316664422,2024-03-17 23:37:03.724265,2024-03-17 23:37:58.011307,0 days 00:00:54.287042,friedman_mse,800,3,4,240,0,COMPLETE
35,0.4844607683822755,0.32422944823753425,2024-03-17 23:37:58.012310,2024-03-18 00:48:30.307282,0 days 01:10:32.294972,absolute_error,1200,3,4,280,0,COMPLETE
36,0.4422912203187286,0.3521723483555691,2024-03-18 00:48:30.308286,2024-03-18 01:58:56.152841,0 days 01:10:25.844555,absolute_error,1000,7,6,300,0,COMPLETE
37,0.5028843259266358,0.3119807245617138,2024-03-18 01:58:56.153843,2024-03-18 02:00:18.391875,0 days 00:01:22.238032,squared_error,2000,3,6,320,0,COMPLETE
38,0.4485435839198157,0.3465592742246512,2024-03-18 02:00:18.392877,2024-03-18 02:01:01.178287,0 days 00:00:42.785410,friedman_mse,600,9,20,220,0,COMPLETE
39,0.4660499080237396,0.33551939335503167,2024-03-18 02:01:01.179488,2024-03-18 02:01:49.371199,0 days 00:00:48.191711,squared_error,1000,7,14,240,0,COMPLETE
40,0.4805831658494547,0.3263779474138381,2024-03-18 02:01:49.371199,2024-03-18 02:02:56.692543,0 days 00:01:07.321344,friedman_mse,1000,5,12,320,0,COMPLETE
41,0.49427858770318667,0.3160431862989958,2024-03-18 02:02:56.692543,2024-03-18 02:03:54.995679,0 days 00:00:58.303136,squared_error,600,1,6,280,0,COMPLETE
42,0.46757153244954264,0.3344510984490979,2024-03-18 02:03:54.996077,2024-03-18 02:04:55.018956,0 days 00:01:00.022879,friedman_mse,800,3,20,300,0,COMPLETE
43,0.49687910055312506,0.31484653367882415,2024-03-18 02:04:55.019052,2024-03-18 03:21:53.852993,0 days 01:16:58.833941,absolute_error,1200,1,2,320,0,COMPLETE
44,0.42498475526235746,0.3631257048971429,2024-03-18 03:21:53.853997,2024-03-18 04:39:43.218883,0 days 01:17:49.364886,absolute_error,600,9,6,340,0,COMPLETE
45,0.45427244512974935,0.34304458414714506,2024-03-18 04:39:43.219886,2024-03-18 04:40:37.892472,0 days 00:00:54.672586,squared_error,1800,7,20,280,0,COMPLETE
46,0.44288655900133805,0.3517727557173044,2024-03-18 04:40:37.892472,2024-03-18 05:58:59.569455,0 days 01:18:21.676983,absolute_error,600,7,4,340,0,COMPLETE
47,0.4241384398714219,0.3637176279552428,2024-03-18 05:58:59.569455,2024-03-18 06:44:42.388778,0 days 00:45:42.819323,absolute_error,800,9,2,200,0,COMPLETE
48,0.4422912203187286,0.3521723483555691,2024-03-18 06:44:42.389781,2024-03-18 07:53:45.889835,0 days 01:09:03.500054,absolute_error,1600,7,10,300,0,COMPLETE
49,0.4882230409213847,0.3206745273626637,2024-03-18 07:53:45.890339,2024-03-18 07:55:05.800150,0 days 00:01:19.909811,friedman_mse,1600,1,14,340,0,COMPLETE
50,0.48085087587426995,0.3261911103921483,2024-03-18 07:55:05.800150,2024-03-18 07:56:04.095676,0 days 00:00:58.295526,friedman_mse,2000,5,12,260,1,COMPLETE
51,0.44999206111233764,0.3455367296021192,2024-03-18 07:56:04.095676,2024-03-18 07:57:03.802183,0 days 00:00:59.706507,squared_error,1000,9,2,320,1,COMPLETE
52,0.4417480111934021,0.35251673359243324,2024-03-18 07:57:03.802183,2024-03-18 08:43:11.447380,0 days 00:46:07.645197,absolute_error,1000,7,12,200,1,COMPLETE
53,0.46620268083619365,0.335491544887223,2024-03-18 08:43:11.448576,2024-03-18 08:43:56.831216,0 days 00:00:45.382640,squared_error,600,7,14,220,1,COMPLETE
54,0.47598053806289603,0.3292656626038791,2024-03-18 08:43:56.831216,2024-03-18 08:44:43.468143,0 days 00:00:46.636927,friedman_mse,600,5,14,220,1,COMPLETE
55,0.499493198743569,0.31393110290604176,2024-03-18 08:44:43.468143,2024-03-18 08:45:44.108986,0 days 00:01:00.640843,friedman_mse,800,3,4,260,1,COMPLETE
56,0.4912056199419796,0.3182317546827013,2024-03-18 08:45:44.110998,2024-03-18 08:46:53.215422,0 days 00:01:09.104424,friedman_mse,600,1,10,320,1,COMPLETE
57,0.5026039931188355,0.31211621725942107,2024-03-18 08:46:53.216423,2024-03-18 08:48:03.375564,0 days 00:01:10.159141,friedman_mse,1600,3,2,280,1,COMPLETE
58,0.4426399821430005,0.35196038407458347,2024-03-18 08:48:03.375564,2024-03-18 10:01:44.768096,0 days 01:13:41.392532,absolute_error,1600,7,12,320,1,COMPLETE
59,0.4708313178875332,0.33183029023435584,2024-03-18 10:01:44.768096,2024-03-18 10:02:41.491236,0 days 00:00:56.723140,squared_error,1000,1,20,280,1,COMPLETE
60,0.44856611012407477,0.346545493155055,2024-03-18 10:02:41.492239,2024-03-18 10:03:21.131820,0 days 00:00:39.639581,squared_error,2000,9,20,220,1,COMPLETE
61,0.46573622423270766,0.33570220003200535,2024-03-18 10:03:21.131820,2024-03-18 10:04:21.359361,0 days 00:01:00.227541,friedman_mse,1600,7,14,320,1,COMPLETE
62,0.4505341653936575,0.34519499580589297,2024-03-18 10:04:21.359361,2024-03-18 10:05:03.097456,0 days 00:00:41.738095,friedman_mse,600,9,6,240,1,COMPLETE
63,0.5024631196375964,0.3123192153810642,2024-03-18 10:05:03.097456,2024-03-18 10:05:54.761630,0 days 00:00:51.664174,friedman_mse,1400,3,6,220,1,COMPLETE
64,0.466094972927457,0.3354833972163537,2024-03-18 10:05:54.763636,2024-03-18 10:06:43.786137,0 days 00:00:49.022501,squared_error,1000,7,14,260,1,COMPLETE
65,0.4505341653936575,0.34519499580589297,2024-03-18 10:06:43.786137,2024-03-18 10:07:26.253193,0 days 00:00:42.467056,friedman_mse,1400,9,6,240,1,COMPLETE
66,0.4631249209849401,0.33863214821139487,2024-03-18 10:07:26.254209,2024-03-18 11:26:41.971823,0 days 01:19:15.717614,absolute_error,1200,5,4,320,1,COMPLETE
67,0.5083656422954683,0.30786568931851815,2024-03-18 11:26:41.972825,2024-03-18 11:28:00.491449,0 days 00:01:18.518624,squared_error,1800,1,6,320,1,COMPLETE
68,0.4671253881779818,0.3348983754251636,2024-03-18 11:28:00.492452,2024-03-18 11:28:49.863843,0 days 00:00:49.371391,squared_error,2000,5,18,260,1,COMPLETE
69,0.4839029420195649,0.3240467367476401,2024-03-18 11:28:49.865871,2024-03-18 11:29:38.316632,0 days 00:00:48.450761,friedman_mse,1400,3,14,240,1,COMPLETE
70,0.46757153244954264,0.3344510984490979,2024-03-18 11:29:38.316632,2024-03-18 11:30:34.535857,0 days 00:00:56.219225,friedman_mse,800,3,20,300,1,COMPLETE
71,0.4884424842781766,0.32016427665831415,2024-03-18 11:30:34.535857,2024-03-18 11:31:23.226509,0 days 00:00:48.690652,squared_error,600,1,12,240,1,COMPLETE
72,0.4506019855064066,0.3452768076996506,2024-03-18 11:31:23.227499,2024-03-18 11:31:58.587690,0 days 00:00:35.360191,squared_error,2000,9,6,200,1,COMPLETE
73,0.46616126745990727,0.33547352547803566,2024-03-18 11:31:58.587690,2024-03-18 11:33:05.962379,0 days 00:01:07.374689,squared_error,2000,7,8,360,1,COMPLETE
74,0.4422912203187286,0.3521723483555691,2024-03-18 11:33:05.963381,2024-03-18 12:46:31.746785,0 days 01:13:25.783404,absolute_error,800,7,4,300,1,COMPLETE
75,0.45007567580961594,0.34551868224098664,2024-03-18 12:46:31.747772,2024-03-18 12:47:34.305306,0 days 00:01:02.557534,friedman_mse,1800,9,8,360,1,COMPLETE
76,0.467622265613969,0.3344147858980033,2024-03-18 12:47:34.305306,2024-03-18 12:48:32.015006,0 days 00:00:57.709700,squared_error,800,3,20,300,1,COMPLETE
77,0.45403028537689866,0.3444583475927273,2024-03-18 12:48:32.016008,2024-03-18 13:47:59.640982,0 days 00:59:27.624974,absolute_error,800,5,14,240,1,COMPLETE
78,0.4708083047327767,0.3318418201376384,2024-03-18 13:47:59.640982,2024-03-18 13:48:56.585578,0 days 00:00:56.944596,friedman_mse,600,1,20,280,1,COMPLETE
79,0.4552373367548648,0.3419841177249504,2024-03-18 13:48:56.586579,2024-03-18 15:02:15.147275,0 days 01:13:18.560696,absolute_error,1800,1,20,280,1,COMPLETE
80,0.4826659614401428,0.32423796925443094,2024-03-18 15:02:15.148290,2024-03-18 15:03:10.723794,0 days 00:00:55.575504,friedman_mse,1800,1,16,240,1,COMPLETE
81,0.4843284487414866,0.3239800856600473,2024-03-18 15:03:10.723794,2024-03-18 15:04:07.927266,0 days 00:00:57.203472,friedman_mse,1200,5,6,260,1,COMPLETE
82,0.4983530668508146,0.3141122706829715,2024-03-18 15:04:07.927266,2024-03-18 15:05:10.314611,0 days 00:01:02.387345,friedman_mse,1000,1,10,260,1,COMPLETE
83,0.46606429216708933,0.33550054630277254,2024-03-18 15:05:10.315613,2024-03-18 15:06:00.142571,0 days 00:00:49.826958,friedman_mse,1000,7,14,260,1,COMPLETE
84,0.49293644117279956,0.3177739542393824,2024-03-18 15:06:00.143571,2024-03-18 15:06:51.640319,0 days 00:00:51.496748,friedman_mse,600,3,4,240,1,COMPLETE
85,0.4709217201028624,0.33177565808048326,2024-03-18 15:06:51.640319,2024-03-18 15:07:41.321386,0 days 00:00:49.681067,friedman_mse,800,1,20,240,1,COMPLETE
86,0.4842277155619129,0.32405377263344887,2024-03-18 15:07:41.321386,2024-03-18 15:08:54.042578,0 days 00:01:12.721192,friedman_mse,800,5,6,340,1,COMPLETE
87,0.4882230409213847,0.3206745273626637,2024-03-18 15:08:54.042578,2024-03-18 15:10:10.016073,0 days 00:01:15.973495,friedman_mse,1600,1,14,340,1,COMPLETE
88,0.4477017842270019,0.347052888389731,2024-03-18 15:10:10.016073,2024-03-18 15:11:11.571937,0 days 00:01:01.555864,friedman_mse,1400,9,20,360,1,COMPLETE
89,0.48411404243320194,0.324064673764325,2024-03-18 15:11:11.571937,2024-03-18 15:12:08.378754,0 days 00:00:56.806817,friedman_mse,1000,5,2,280,1,COMPLETE
90,0.46300181939713686,0.3387190163921912,2024-03-18 15:12:08.378754,2024-03-18 16:23:38.560897,0 days 01:11:30.182143,absolute_error,800,5,6,280,1,COMPLETE
91,0.48820803778765576,0.3206807216509795,2024-03-18 16:23:38.560897,2024-03-18 16:24:55.705190,0 days 00:01:17.144293,friedman_mse,800,1,14,340,1,COMPLETE
92,0.5076034025869692,0.30832878934965907,2024-03-18 16:24:55.706193,2024-03-18 16:25:56.933380,0 days 00:01:01.227187,squared_error,1800,1,6,220,1,COMPLETE
93,0.4552913286044202,0.3418930477112578,2024-03-18 16:25:56.933380,2024-03-18 17:57:27.551806,0 days 01:31:30.618426,absolute_error,1200,1,20,360,1,COMPLETE
94,0.43607538117413613,0.35603726695934546,2024-03-18 17:57:27.553537,2024-03-18 19:15:52.212220,0 days 01:18:24.658683,absolute_error,1200,7,18,340,1,COMPLETE
95,0.48810063066016235,0.32076825859932984,2024-03-18 19:15:52.212220,2024-03-18 19:17:05.967526,0 days 00:01:13.755306,squared_error,1400,1,14,320,1,COMPLETE
96,0.4506019855064066,0.3452768076996506,2024-03-18 19:17:05.967526,2024-03-18 19:17:45.220486,0 days 00:00:39.252960,squared_error,1400,9,10,200,1,COMPLETE
97,0.46255953699487284,0.33899230899508154,2024-03-18 19:17:45.222684,2024-03-18 20:16:26.482971,0 days 00:58:41.260287,absolute_error,1000,5,10,240,1,COMPLETE
98,0.48449989442401387,0.32393279463216734,2024-03-18 20:16:26.482971,2024-03-18 20:17:42.594978,0 days 00:01:16.112007,squared_error,2000,5,8,360,1,COMPLETE
99,0.4649123824124309,0.3369258709640647,2024-03-18 20:17:42.597986,2024-03-18 21:48:10.477828,0 days 01:30:27.879842,absolute_error,1200,3,14,360,1,COMPLETE
