number,value,datetime_start,datetime_complete,duration,params_alpha,params_booster,params_colsample_bytree,params_eta,params_gamma,params_grow_policy,params_lambda,params_max_depth,params_min_child_weight,params_n_estimators,params_normalize_type,params_rate_drop,params_sample_type,params_skip_drop,params_subsample,state
0,0.48744531950558934,2024-03-19 13:48:00.607424,2024-03-19 13:49:02.739261,0 days 00:01:02.131837,3.650215811940407e-05,dart,0.3925633841261233,0.23775877196879336,5.700244053774642e-07,depthwise,0.003213658837833819,11,10,220,forest,0.0002603229984694911,uniform,2.6478634389997138e-05,0.8912408334334938,COMPLETE
1,0.47107664129755855,2024-03-19 13:49:02.741267,2024-03-19 13:49:51.754515,0 days 00:00:49.013248,0.03333976917905981,dart,0.9405108113641145,0.2661322307870216,0.3812872718172304,depthwise,0.0007926688385370917,13,3,160,tree,0.0039943845192103354,uniform,1.3054931009899812e-06,0.6319034094403448,COMPLETE
2,0.44973674553080595,2024-03-19 13:49:51.755516,2024-03-19 13:50:59.749382,0 days 00:01:07.993866,7.343212284571563e-05,dart,0.6890723804749329,0.17124342008273313,1.0541077730726709e-07,lossguide,0.00025407147564811505,15,5,200,tree,8.590170193242322e-07,weighted,1.677848585922727e-08,0.43404376442766196,COMPLETE
3,0.24269707809964164,2024-03-19 13:50:59.750386,2024-03-19 13:51:07.976635,0 days 00:00:08.226249,1.0382756532172878e-08,gbtree,0.2553364724042842,0.003903271151145514,6.665917070191286e-05,depthwise,0.01037943323670606,11,8,210,,,,,0.407305626596391,COMPLETE
4,0.4443753051221093,2024-03-19 13:51:07.978213,2024-03-19 13:51:47.826116,0 days 00:00:39.847903,0.049830544414518264,dart,0.7089243862007475,0.28856943820129866,4.672242484976764e-08,depthwise,4.477112889564242e-05,11,9,160,forest,6.784278983765763e-06,uniform,2.9628789948242117e-07,0.6001302887089144,COMPLETE
5,0.5127509584959622,2024-03-19 13:51:47.827185,2024-03-19 13:51:58.586287,0 days 00:00:10.759102,7.213663118909715e-06,gbtree,0.20935096624136307,0.016158856019522525,0.2229974503197513,depthwise,0.027198895357897834,15,4,230,,,,,0.8792198684218049,COMPLETE
6,0.5170431938489122,2024-03-19 13:51:58.588292,2024-03-19 13:52:58.937127,0 days 00:01:00.348835,9.909569686973295e-08,dart,0.8632606753139271,0.019739807334618116,0.9377849825750767,depthwise,0.34990510256957574,13,2,180,forest,0.0002550783899021281,uniform,0.00012499165251263976,0.5702154532803699,COMPLETE
7,0.46119976167823334,2024-03-19 13:52:58.938178,2024-03-19 13:53:04.747284,0 days 00:00:05.809106,0.00010504683950008143,gbtree,0.21541545243479546,0.017611162279540054,3.342547351365088e-08,depthwise,1.5137107167829747e-06,11,3,210,,,,,0.24582226991344927,COMPLETE
8,-0.03867473677383979,2024-03-19 13:53:04.748286,2024-03-19 13:53:27.725195,0 days 00:00:22.976909,7.138402215941896e-06,gbtree,0.8877750682355483,0.7549280398539762,0.006749260231253754,lossguide,0.18926241420171946,11,6,240,,,,,0.6112203399199987,COMPLETE
9,0.5277646420756884,2024-03-19 13:53:27.726199,2024-03-19 13:53:46.470862,0 days 00:00:18.744663,6.810884386971104e-05,gbtree,0.6987470303484511,0.08720541394008866,0.013017627981676005,lossguide,0.023413073956379003,15,6,180,,,,,0.9122220528033265,COMPLETE
10,0.09258569849733489,2024-03-19 13:53:46.472993,2024-03-19 13:53:52.098054,0 days 00:00:05.625061,0.002125534009475356,gbtree,0.5123899961885159,0.0018894398783754548,0.0005982657296219562,lossguide,2.174620658444728e-08,7,7,180,,,,,0.9904768132859185,COMPLETE
11,0.5039970966845547,2024-03-19 13:53:52.099058,2024-03-19 13:54:33.379642,0 days 00:00:41.280584,3.822835946534543e-08,dart,0.7556126483964711,0.04916577146410011,0.017858727694418118,lossguide,0.820567699826419,13,2,180,forest,0.5282372242353628,weighted,0.06745817398444118,0.7194923704291454,COMPLETE
12,0.5334170301156674,2024-03-19 13:54:33.380645,2024-03-19 13:54:56.047791,0 days 00:00:22.667146,4.964642099669489e-07,gbtree,0.8121775486444721,0.060536136604829476,0.6984732618841607,lossguide,0.10775085153018674,15,5,180,,,,,0.7647418848319462,COMPLETE
13,0.5317812438445754,2024-03-19 13:54:56.049786,2024-03-19 13:55:14.558986,0 days 00:00:18.509200,4.292973985931874e-07,gbtree,0.5880980690765896,0.06960982458753152,0.02345024710691976,lossguide,0.037427765210843185,15,6,190,,,,,0.7952318251607189,COMPLETE
14,0.3020771399127793,2024-03-19 13:55:14.559989,2024-03-19 13:55:21.430792,0 days 00:00:06.870803,9.33450172295534e-07,gbtree,0.5482062116216954,0.005946508650724731,2.7562253016843918e-05,lossguide,9.794886049285225e-06,7,5,190,,,,,0.7745217829785741,COMPLETE
15,0.5401367521469125,2024-03-19 13:55:21.431795,2024-03-19 13:55:36.827099,0 days 00:00:15.395304,4.221846687939638e-07,gbtree,0.44752599926752046,0.05962208888180515,0.05728801465403238,lossguide,0.07120031810242128,15,7,200,,,,,0.7674080983748567,COMPLETE
16,-0.014863092408054413,2024-03-19 13:55:36.828097,2024-03-19 13:55:45.010266,0 days 00:00:08.182169,6.79540496085696e-07,gbtree,0.43302568060686786,0.8829335755699795,0.0014222171442472467,lossguide,0.0016270486880978808,9,8,200,,,,,0.7179304751364642,COMPLETE
17,0.5208071241065629,2024-03-19 13:55:45.011268,2024-03-19 13:55:54.564988,0 days 00:00:09.553720,0.0031456998127261417,gbtree,0.35758597233561823,0.034087817038833575,2.9889524021867797e-06,lossguide,4.6428596393404325e-07,13,7,170,,,,,0.4941968443161428,COMPLETE
18,0.4730302281943362,2024-03-19 13:55:54.566994,2024-03-19 13:56:26.843373,0 days 00:00:32.276379,2.5433679071184802e-06,gbtree,0.9909908273020273,0.0071541689142186025,0.09051681021035213,lossguide,0.1308960090289161,15,5,210,,,,,0.8060212460008347,COMPLETE
19,0.5314509117826982,2024-03-19 13:56:26.845378,2024-03-19 13:56:39.662887,0 days 00:00:12.817509,0.5899062972900687,gbtree,0.807921201002197,0.1110692969626167,0.001063700337681922,lossguide,5.3185362687359387e-05,9,7,190,,,,,0.6771280732293553,COMPLETE
20,0.5090930395686398,2024-03-19 13:56:39.664904,2024-03-19 13:56:48.283490,0 days 00:00:08.618586,1.1672243653805505e-07,gbtree,0.4774321011235657,0.03992116302406973,0.07104270724789184,lossguide,0.00808918814237583,13,4,170,,,,,0.22448533197342824,COMPLETE
21,0.5290583457574085,2024-03-19 13:56:48.284491,2024-03-19 13:57:06.563562,0 days 00:00:18.279071,3.3848838728350535e-07,gbtree,0.5976338121325258,0.07605386801809305,0.045922743256589724,lossguide,0.059342678687610166,15,6,190,,,,,0.807095017347566,COMPLETE
22,0.5411492543947751,2024-03-19 13:57:06.566234,2024-03-19 13:57:24.125851,0 days 00:00:17.559617,4.9110018814418975e-06,gbtree,0.6239951170482747,0.05953060293157982,0.49986689334534484,lossguide,0.8761908336937981,15,8,200,,,,,0.985789824170024,COMPLETE
23,0.5252441363629575,2024-03-19 13:57:24.127857,2024-03-19 13:57:43.158380,0 days 00:00:19.030523,1.2649201429638931e-05,gbtree,0.6352454921471802,0.02496758224592792,0.9396368702013723,lossguide,0.8117365318995292,15,8,200,,,,,0.9360519490005059,COMPLETE
24,0.4863455936023282,2024-03-19 13:57:43.160384,2024-03-19 13:57:54.260689,0 days 00:00:11.100305,0.0003990465829074002,gbtree,0.32916558157205156,0.010790868136012696,0.004247109522990157,lossguide,0.15350134602139293,13,9,220,,,,,0.9737800272875916,COMPLETE
25,0.5260338792569323,2024-03-19 13:57:54.261706,2024-03-19 13:58:09.006868,0 days 00:00:14.745162,2.571715391420622e-06,gbtree,0.46049324224641863,0.14666785487735814,0.19307720313601398,lossguide,0.8534750294648142,15,9,200,,,,,0.8384461323939869,COMPLETE
26,0.40709174245402036,2024-03-19 13:58:09.007870,2024-03-19 13:58:31.120573,0 days 00:00:22.112703,1.4725083659932325e-08,gbtree,0.8119997489831212,0.3907393933615088,0.0002222020935394795,lossguide,0.007941373921748618,13,10,220,,,,,0.7317959621464953,COMPLETE
27,0.5383151875866243,2024-03-19 13:58:31.121596,2024-03-19 13:58:48.066014,0 days 00:00:16.944418,9.65523164724272e-08,gbtree,0.6407730679276709,0.048810736930484266,0.2723323879798454,lossguide,0.10811630121894682,15,7,170,,,,,0.525927609792458,COMPLETE
28,0.5354239104971692,2024-03-19 13:58:48.067090,2024-03-19 13:59:02.568376,0 days 00:00:14.501286,9.376777438096903e-08,gbtree,0.526832022758007,0.03233601390685264,0.15608129530048592,lossguide,0.000345704198736638,15,7,170,,,,,0.5151131411127292,COMPLETE
29,0.4404022706006286,2024-03-19 13:59:02.569379,2024-03-19 14:00:15.706594,0 days 00:01:13.137215,2.0604796988510196e-05,dart,0.634482421197121,0.1716322103340107,0.004609245783006854,lossguide,0.0026867844618635684,13,10,230,tree,1.2152254597140182e-08,weighted,0.8458804565193626,0.3340887676588401,COMPLETE
30,0.44695209003844905,2024-03-19 14:00:15.707598,2024-03-19 14:00:23.759524,0 days 00:00:08.051926,2.272366803933655e-06,gbtree,0.4117864814059158,0.011132094552834653,0.04693024528088897,lossguide,0.2799233226086938,9,8,210,,,,,0.8703870912187288,COMPLETE
31,0.5308636379388402,2024-03-19 14:00:23.760512,2024-03-19 14:00:38.648122,0 days 00:00:14.887610,1.1372910152039664e-07,gbtree,0.5377168644394412,0.02992019835098095,0.21824568688698034,lossguide,5.184451282520209e-06,15,7,170,,,,,0.5257895168117183,COMPLETE
32,0.5349641833916186,2024-03-19 14:00:38.649133,2024-03-19 14:00:51.447516,0 days 00:00:12.798383,3.4949762679320744e-08,gbtree,0.5071794482482834,0.04584936863732015,0.1433404572925795,lossguide,0.00023831306895152727,15,7,160,,,,,0.47117332998099337,COMPLETE
33,0.48724055306703506,2024-03-19 14:00:51.449759,2024-03-19 14:01:05.253285,0 days 00:00:13.803526,1.432264252386708e-07,gbtree,0.6480522518783167,0.1345288120806078,0.30390608900318355,lossguide,0.0001983061595767499,15,8,170,,,,,0.3730436834843635,COMPLETE
34,0.374381814165599,2024-03-19 14:01:05.254288,2024-03-19 14:01:39.143093,0 days 00:00:33.888805,2.3531502575766333e-08,dart,0.5567045119399711,0.08583743321422882,1.9216746490599805e-06,depthwise,0.0008179113477376145,15,7,160,tree,0.4847386061189793,weighted,0.002529670911711411,0.5515244545217781,COMPLETE
35,0.46508946281591557,2024-03-19 14:01:39.144098,2024-03-19 14:01:48.759539,0 days 00:00:09.615441,1.4969435112200843e-06,gbtree,0.3646860950809697,0.2377244399909842,0.05230543848109747,lossguide,0.013377353846262886,13,9,170,,,,,0.6572783806686873,COMPLETE
36,0.4821792404775983,2024-03-19 14:01:48.760543,2024-03-19 14:02:24.515683,0 days 00:00:35.755140,5.2298161125502236e-08,dart,0.29311794312142114,0.02635182170986465,0.5836680081007681,depthwise,0.0043763345772859265,13,8,160,forest,2.4242670018331624e-08,weighted,0.0025735585897856436,0.4209877848773403,COMPLETE
37,0.502826525232303,2024-03-19 14:02:24.517688,2024-03-19 14:02:46.435732,0 days 00:00:21.918044,3.0828555678328873e-07,gbtree,0.7519484441126683,0.012123147448929653,0.0254493977755766,lossguide,0.0007581364713799896,15,6,190,,,,,0.49543584691646614,COMPLETE
38,0.5175402140283784,2024-03-19 14:02:46.436731,2024-03-19 14:03:00.886373,0 days 00:00:14.449642,3.872322498184329e-06,gbtree,0.6626890571397291,0.051305580393003376,0.3328212758065456,depthwise,0.050594277398164945,15,9,200,,,,,0.31370055493031174,COMPLETE
39,0.04654813995438787,2024-03-19 14:03:00.887372,2024-03-19 14:04:07.800719,0 days 00:01:06.913347,1.0177980952432862e-08,dart,0.585426184516028,0.00102286643627517,1.0830378887677022e-08,lossguide,7.361959204188085e-08,13,8,210,tree,0.010122386195491948,uniform,1.4839195093669973e-08,0.5966092694648499,COMPLETE
40,0.47509673431423644,2024-03-19 14:04:07.801776,2024-03-19 14:04:21.639053,0 days 00:00:13.837277,1.8203499452408232e-07,gbtree,0.4764459898006441,0.21583597025418802,3.741746133221728e-05,depthwise,0.341629797652406,11,7,240,,,,,0.6764174671292162,COMPLETE
41,0.5336876435547471,2024-03-19 14:04:21.640055,2024-03-19 14:04:34.697724,0 days 00:00:13.057669,4.6332098660084536e-08,gbtree,0.5039203977025214,0.0468226547872149,0.13481303078273948,lossguide,0.0001995368759478818,15,7,160,,,,,0.49285130446615116,COMPLETE
42,0.5135520005541432,2024-03-19 14:04:34.699110,2024-03-19 14:04:46.118757,0 days 00:00:11.419647,7.079080859208591e-08,gbtree,0.4135684540217324,0.022235751452629793,0.009062820263175035,lossguide,2.5203085821396717e-05,15,6,160,,,,,0.46911610586248254,COMPLETE
43,0.5306313620690015,2024-03-19 14:04:46.121486,2024-03-19 14:04:59.123335,0 days 00:00:13.001849,3.0368303651878474e-08,gbtree,0.5069484300514789,0.038247092051731345,0.10255709357452618,lossguide,0.0006443338586870551,15,7,170,,,,,0.4381211378160063,COMPLETE
44,0.5240813184358752,2024-03-19 14:04:59.124333,2024-03-19 14:05:19.915493,0 days 00:00:20.791160,9.834880236446207e-07,gbtree,0.7378836369707715,0.10044391565581973,0.435184524499587,lossguide,0.016856145440063124,15,6,180,,,,,0.5542104260132841,COMPLETE
45,0.4977432845246278,2024-03-19 14:05:19.916497,2024-03-19 14:05:37.256725,0 days 00:00:17.340228,2.165865814576301e-07,gbtree,0.6731882385362292,0.01620520907708752,0.9320916895415474,lossguide,0.05946040615482492,15,7,160,,,,,0.6234579927921723,COMPLETE
46,0.22553230411683556,2024-03-19 14:05:37.257724,2024-03-19 14:05:49.549283,0 days 00:00:12.291559,6.902502714743939e-06,gbtree,0.5651167884273988,0.382659481324792,0.030592166422025478,lossguide,0.00011631680567753149,13,8,180,,,,,0.39116713826680954,COMPLETE
47,0.538755642838483,2024-03-19 14:05:49.550276,2024-03-19 14:06:05.932609,0 days 00:00:16.382333,0.00019246278011250854,gbtree,0.6175782052593314,0.033010758322375655,0.002542266129020484,lossguide,0.44511834647274706,15,8,170,,,,,0.5899039658417471,COMPLETE
48,0.5419459935960862,2024-03-19 14:06:05.934055,2024-03-19 14:07:03.116739,0 days 00:00:57.182684,0.0004085788343888298,dart,0.7231878514801464,0.06114341047926526,0.0023629147414357178,lossguide,0.4364051261255168,15,8,180,forest,9.866836297925632e-07,uniform,8.033744751780248e-06,0.5749108990613643,COMPLETE
49,0.5335922824924101,2024-03-19 14:07:03.117743,2024-03-19 14:07:55.439925,0 days 00:00:52.322182,0.000308044413259742,dart,0.6997290766249517,0.06640948701805914,0.0027019570193342946,depthwise,0.4404220668853419,13,9,180,forest,4.6800073596137205e-07,uniform,5.641814691715699e-06,0.5788323725220214,COMPLETE
50,0.537980694178448,2024-03-19 14:07:55.440927,2024-03-19 14:08:56.980498,0 days 00:01:01.539571,0.0021851580944871564,dart,0.620151879390313,0.05864972696599497,0.0003144381726783002,lossguide,0.11276533794933316,15,8,190,forest,8.731482022277922e-06,uniform,0.00032498993380465955,0.6379169642699019,COMPLETE
51,0.540019890008785,2024-03-19 14:08:56.981501,2024-03-19 14:09:59.967030,0 days 00:01:02.985529,0.0046841041708758436,dart,0.6091369791340235,0.05924343817431919,0.00027012337730950107,lossguide,0.08002317055531098,15,8,190,forest,1.0237047655843182e-05,uniform,0.003181727348195008,0.6359586545600358,COMPLETE
52,0.5253917630120107,2024-03-19 14:09:59.968032,2024-03-19 14:11:09.681712,0 days 00:01:09.713680,0.004621892605045395,dart,0.7278131091982042,0.09359184711018145,0.00023172741210848358,lossguide,0.44155984232397283,15,8,200,forest,3.558114621348878e-07,uniform,0.0104749246755232,0.686321590664143,COMPLETE
53,0.5140020335947455,2024-03-19 14:11:09.682715,2024-03-19 14:12:12.954035,0 days 00:01:03.271320,0.019260228243559312,dart,0.7692345408141279,0.12019684740896629,0.00010239349018175889,lossguide,0.026950815842853377,15,9,190,forest,1.971024634888879e-05,uniform,3.4712816180988546e-05,0.6018969293016594,COMPLETE
54,0.5308595385148985,2024-03-19 14:12:12.956001,2024-03-19 14:13:09.070302,0 days 00:00:56.114301,0.0006861251263091764,dart,0.6828928154906946,0.0707672152411598,0.001454631119150812,lossguide,0.2294712203353576,15,9,180,forest,1.1475645099852728e-07,uniform,0.0005698969244671562,0.5567712715424155,COMPLETE
55,0.5461295930901974,2024-03-19 14:13:09.071305,2024-03-19 14:14:14.686934,0 days 00:01:05.615629,0.00010193631615581248,dart,0.6020393004770318,0.036280348292751195,0.014065020296791256,lossguide,0.08257018144661389,15,8,200,forest,4.591122696407229e-05,uniform,0.12352043874027736,0.7497785841102638,COMPLETE
56,0.5359699554231806,2024-03-19 14:14:14.688297,2024-03-19 14:15:26.570142,0 days 00:01:11.881845,9.279206282137853e-05,dart,0.6054007699252136,0.01937982435388845,0.01218556129554219,lossguide,0.8797809193079519,15,8,210,forest,4.1069685198276545e-05,uniform,0.22373990043214043,0.7491994571128672,COMPLETE
57,0.5406249192143026,2024-03-19 14:15:26.571145,2024-03-19 14:16:31.016414,0 days 00:01:04.445269,0.00019212509181329302,dart,0.862745386594068,0.03614445104367538,0.0009477679758924834,lossguide,0.07678882421066785,13,10,200,forest,1.6759781726931293e-06,uniform,0.019813480857932383,0.8386778106630447,COMPLETE
58,0.5393030789614759,2024-03-19 14:16:31.017401,2024-03-19 14:17:37.416298,0 days 00:01:06.398897,0.007740285724599865,dart,0.8306916146572053,0.06102656919197715,0.000590184839728344,lossguide,0.05179271427133251,13,10,200,forest,2.3392560872011503e-06,uniform,0.027189738869579434,0.8501111060981594,COMPLETE
59,0.539040152899142,2024-03-19 14:17:37.417297,2024-03-19 14:18:36.771980,0 days 00:00:59.354683,0.0010074352004096762,dart,0.8871504054481821,0.04019444463177718,1.787140162663566e-05,lossguide,0.025314139455704567,11,9,200,forest,2.8648741956736614e-06,uniform,0.005550295341327616,0.8203310460378571,COMPLETE
60,0.5068484639594037,2024-03-19 14:18:36.773985,2024-03-19 14:19:35.935334,0 days 00:00:59.161349,3.493955361789996e-05,dart,0.9776532356894905,0.15945252895464315,0.0005778492762401114,lossguide,0.0054283306287889665,13,10,190,forest,0.00010035284405577526,uniform,0.09140818767296781,0.9543589877752665,COMPLETE
61,0.5394835519073814,2024-03-19 14:19:35.936335,2024-03-19 14:20:34.941921,0 days 00:00:59.005586,0.00866867848762297,dart,0.9300403814867222,0.057295228557954575,9.54150286661468e-05,lossguide,0.08668870882130938,11,10,200,forest,1.7004024741688545e-06,uniform,0.02503684719043345,0.8549607213792035,COMPLETE
62,0.5375671425288688,2024-03-19 14:20:34.943928,2024-03-19 14:21:33.018017,0 days 00:00:58.074089,0.109263513734034,dart,0.9355113292264076,0.08242789268745035,7.156749908568864e-05,lossguide,0.08157513779877627,11,10,200,forest,1.3747204063673798e-06,uniform,0.33332373347103605,0.925256663684698,COMPLETE
63,0.5278992052545559,2024-03-19 14:21:33.020022,2024-03-19 14:22:38.963071,0 days 00:01:05.943049,4.909704489321703e-05,dart,0.9454069465104242,0.02556076642893666,1.4720824738590159e-05,lossguide,0.20950904499806405,11,10,210,forest,7.801726532571796e-08,uniform,0.020540889079168664,0.8997091110509398,COMPLETE
64,0.5354649414089708,2024-03-19 14:22:38.964086,2024-03-19 14:23:28.703642,0 days 00:00:49.739556,0.00013941890615737116,dart,0.8515101525988956,0.06068603390190838,0.0010551890577220834,lossguide,0.1635882270444662,9,9,190,forest,1.4732890455760325e-05,uniform,0.060594736474913063,0.8741125722676442,COMPLETE
65,0.5306355227403401,2024-03-19 14:23:28.704645,2024-03-19 14:24:31.003884,0 days 00:01:02.299239,0.013183937274112307,dart,0.950115790563352,0.10733696349791128,0.006108232635586649,lossguide,0.029186729425430113,11,10,200,forest,1.9484883481138658e-07,uniform,0.0013522707991342265,0.7791481145847727,COMPLETE
66,0.5411378345749587,2024-03-19 14:24:31.004887,2024-03-19 14:25:38.428645,0 days 00:01:07.423758,0.0015029602063283854,dart,0.7869946182941371,0.039307350136957415,6.625104804577398e-06,lossguide,0.49990330743434247,13,9,210,forest,3.38092721449617e-06,uniform,0.013736685749170316,0.9890746809451475,COMPLETE
67,0.5414477145947763,2024-03-19 14:25:38.430664,2024-03-19 14:26:45.067374,0 days 00:01:06.636710,0.0010196506868539441,dart,0.7874976041235184,0.03994137920429664,3.6889456801454034e-07,lossguide,0.6639798568732159,13,9,210,forest,4.133587201282e-05,uniform,0.004229675929173934,0.9981205152998537,COMPLETE
68,0.5194964130895057,2024-03-19 14:26:45.069369,2024-03-19 14:27:59.343858,0 days 00:01:14.274489,0.00041457381760258443,dart,0.779310621236552,0.014415320251670301,7.88006299931228e-08,lossguide,0.9313444362330924,13,9,220,forest,7.229088485306123e-05,uniform,0.2776682941784707,0.9973698497392862,COMPLETE
69,0.5420118101911406,2024-03-19 14:27:59.345876,2024-03-19 14:29:09.353195,0 days 00:01:10.007319,0.0001973142640074042,dart,0.7857407973704833,0.04060189478975636,2.877018576885015e-07,depthwise,0.5199786567276939,13,9,210,forest,0.0026235407857356746,uniform,1.2717967710029641e-05,0.9661542468913723,COMPLETE
70,0.5298793407658609,2024-03-19 14:29:09.355296,2024-03-19 14:30:16.516873,0 days 00:01:07.161577,0.0012935258051316625,dart,0.7898527795177402,0.020809901727265125,3.910263229705322e-07,depthwise,0.6625462822410065,13,9,210,forest,0.0019450237387598369,uniform,4.9842561402868685e-06,0.9815414728561784,COMPLETE
71,0.5432291505886273,2024-03-19 14:30:16.517872,2024-03-19 14:31:22.780220,0 days 00:01:06.262348,0.0001786009355424227,dart,0.8690791080333554,0.04068492273674044,4.735134501649544e-07,depthwise,0.3130269552265522,13,9,210,forest,0.00011793606578702321,uniform,1.575638779531409e-05,0.9480810021145621,COMPLETE
72,0.5405791479164022,2024-03-19 14:31:22.781221,2024-03-19 14:32:28.723358,0 days 00:01:05.942137,0.00022437109744311075,dart,0.8869457439698338,0.03801327842415191,3.153016371068463e-07,depthwise,0.30923818511481027,13,9,210,forest,0.0008978275273181598,uniform,1.9026272511657666e-05,0.9563983259663953,COMPLETE
73,0.5433323715408579,2024-03-19 14:32:28.725218,2024-03-19 14:33:39.624094,0 days 00:01:10.898876,0.0006414287743379431,dart,0.853501708351237,0.04355008049940566,1.1173114076516367e-06,depthwise,0.5530939573043057,13,10,220,forest,0.020160109575433998,uniform,1.112532218234989e-05,0.9602919011109052,COMPLETE
