number,value,datetime_start,datetime_complete,duration,params_alpha,params_booster,params_colsample_bytree,params_eta,params_gamma,params_grow_policy,params_lambda,params_max_depth,params_min_child_weight,params_n_estimators,params_normalize_type,params_rate_drop,params_sample_type,params_skip_drop,params_subsample,state
0,-0.0972157699755238,2024-03-19 20:59:49.587505,2024-03-19 20:59:56.275458,0 days 00:00:06.687953,1.619654239663187e-07,gbtree,0.4264599204913303,3.582126128839186e-07,2.2620360486961993e-07,depthwise,1.217131640359479e-05,3,10,100,,,,,0.7335722160412415,COMPLETE
1,-0.0972161771766634,2024-03-19 20:59:56.275458,2024-03-19 21:01:27.915550,0 days 00:01:31.640092,0.004050226202795057,dart,0.6324343756133657,1.525594277300844e-07,1.5882772288227096e-06,depthwise,4.800800132130793e-07,7,6,120,forest,3.069182364552554e-06,weighted,4.129297606597395e-07,0.623433378650931,COMPLETE
2,0.19290214252115434,2024-03-19 21:01:27.915550,2024-03-19 21:05:13.409670,0 days 00:03:45.494120,7.314517969960152e-05,dart,0.611215542064727,0.007243661356001192,1.5109176417225968e-06,lossguide,0.002020023434510685,5,6,200,forest,4.561746132637624e-08,uniform,3.067687287358708e-08,0.7068331812833415,COMPLETE
3,-0.0915012020769129,2024-03-19 21:05:13.409670,2024-03-19 21:13:31.976033,0 days 00:08:18.566363,0.09326024829726516,dart,0.7720907643110357,3.353859677892568e-05,0.00039311226604503825,lossguide,0.00043095814060606054,9,9,280,forest,2.7688000058272026e-07,weighted,0.0006877443920004946,0.4167308886100305,COMPLETE
4,0.3491458577558176,2024-03-19 21:13:31.977032,2024-03-19 21:19:12.787538,0 days 00:05:40.810506,0.002435734642089989,dart,0.6264941386085511,0.345043707261129,0.0002834994768887795,lossguide,0.0008742030995940948,9,6,240,forest,0.10589797478786019,weighted,0.003393167156365594,0.5429084510440527,COMPLETE
5,-0.09722379878901584,2024-03-19 21:19:12.788538,2024-03-19 21:19:36.954044,0 days 00:00:24.165506,1.2317129378274405e-06,gbtree,0.6213519313216619,1.0269435244868074e-08,0.03011208088083249,lossguide,5.327447032168677e-06,9,8,120,,,,,0.3038517391813198,COMPLETE
6,-0.09689173142215876,2024-03-19 21:19:36.954044,2024-03-19 21:22:22.954602,0 days 00:02:46.000558,0.05611152332459058,dart,0.9894717144034,6.035847434342929e-06,5.6630907496524845e-05,depthwise,3.394079988427291e-07,3,10,160,forest,3.208350851896542e-08,weighted,0.021153088969110598,0.9958041341135564,COMPLETE
7,-0.005927856620959448,2024-03-19 21:22:22.955610,2024-03-19 21:22:35.164197,0 days 00:00:12.208587,0.7137667642822043,gbtree,0.28798665433628134,0.0018980933081502716,0.04998751758847624,lossguide,0.0032635999211438485,7,6,140,,,,,0.23480702373338103,COMPLETE
8,0.46800314214888505,2024-03-19 21:22:35.165238,2024-03-19 21:32:30.338990,0 days 00:09:55.173752,4.1950347834822534e-08,dart,0.9999056886715769,0.06790484642932942,8.257665362378833e-08,depthwise,3.0410820307258155e-07,7,5,300,forest,2.2442074794355962e-08,weighted,8.019641968000112e-06,0.6851511361492606,COMPLETE
9,-0.09680262953218093,2024-03-19 21:32:30.339993,2024-03-19 21:34:43.428197,0 days 00:02:13.088204,1.05111889911202e-06,dart,0.6818063105762417,6.526621465179933e-06,1.8187499714678758e-08,depthwise,1.2489348561488123e-05,5,9,140,forest,0.013219215805817969,uniform,7.862267053316207e-06,0.6921924268571975,COMPLETE
10,0.45135575838384,2024-03-19 21:34:43.429199,2024-03-19 21:36:14.926322,0 days 00:01:31.497123,1.0016857492943745e-08,gbtree,0.9816790792750771,0.32504233747692657,0.6319364136367749,depthwise,0.041725747340674975,7,3,300,,,,,0.9237050774987179,COMPLETE
11,0.30051914210599173,2024-03-19 21:36:14.927323,2024-03-19 21:37:47.698762,0 days 00:01:32.771439,1.26656235404459e-08,gbtree,0.9812675671650561,0.7828222222045678,0.980453408423247,depthwise,0.19291285183764412,7,3,300,,,,,0.9115206617283235,COMPLETE
12,0.37600874679880875,2024-03-19 21:37:47.698762,2024-03-19 21:38:54.240797,0 days 00:01:06.542035,1.0922931270769211e-08,gbtree,0.8421854846742399,0.014775864776318242,1.7126879712080595e-05,depthwise,1.108538284067988e-08,7,3,260,,,,,0.8273935785883918,COMPLETE
13,0.40321799941755776,2024-03-19 21:38:54.242332,2024-03-19 21:39:36.190967,0 days 00:00:41.948635,2.648835455450393e-05,gbtree,0.8723003887903085,0.05839141325595449,0.0063180602898959826,depthwise,0.7622913862635332,5,4,220,,,,,0.8233634703331829,COMPLETE
14,-9.786200850581128e-05,2024-03-19 21:39:36.190967,2024-03-19 21:49:08.356455,0 days 00:09:32.165488,1.598022844287051e-07,dart,0.9075447936558966,0.0006362950595206313,1.0556962412826002e-08,depthwise,0.05800069898969645,7,2,300,tree,0.000171445149782334,weighted,0.6362432997720852,0.49993168816281924,COMPLETE
15,0.4200093166237643,2024-03-19 21:49:08.358544,2024-03-19 21:49:38.516774,0 days 00:00:30.158230,4.440557299384766e-06,gbtree,0.4772936849941102,0.08773683366813666,0.5071027980120819,depthwise,0.01659732348029082,5,4,260,,,,,0.9974177168513632,COMPLETE
16,-0.056212445427919075,2024-03-19 21:49:38.517777,2024-03-19 21:50:39.191230,0 days 00:01:00.673453,1.008706738390807e-07,gbtree,0.7569158962127448,0.0003138290252388623,0.0011725770999061827,depthwise,3.153603586046788e-08,9,4,200,,,,,0.8358737545232523,COMPLETE
17,0.4578063872934556,2024-03-19 21:50:39.191230,2024-03-19 21:59:52.847827,0 days 00:09:13.656597,4.4709310903437314e-08,dart,0.9299617651888943,0.08048729333655714,1.943812160393533e-07,depthwise,8.102364018440188e-05,7,5,300,tree,7.107190775176751e-05,uniform,7.426181991465085e-06,0.42163465741895945,COMPLETE
18,0.20510668850731265,2024-03-19 21:59:52.848825,2024-03-19 22:06:39.340332,0 days 00:06:46.491507,0.000663687908710349,dart,0.7866541533876464,0.006342475198336352,1.7704802102969296e-07,depthwise,6.997091796506995e-05,5,7,260,tree,0.00010779904436270253,uniform,9.212567642850126e-06,0.3922590224260655,COMPLETE
19,0.4440900609843673,2024-03-19 22:06:39.341335,2024-03-19 22:10:38.440771,0 days 00:03:59.099436,7.401168650300974e-06,dart,0.9026809391794219,0.048256380335221984,3.1481931656979084e-06,depthwise,8.916196732470256e-07,9,5,180,tree,6.47048113928343e-06,uniform,2.3370010174757943e-05,0.45540225969354303,COMPLETE
20,-0.08922200563131191,2024-03-19 22:10:38.441772,2024-03-19 22:18:21.230708,0 days 00:07:42.788936,8.504505522937661e-08,dart,0.41997962835873104,6.015610013932609e-05,1.8349463747181577e-07,depthwise,9.791681123874449e-05,7,5,280,tree,0.0034124678561508067,uniform,5.046844100335709e-07,0.583813610700453,COMPLETE
21,-0.4992348919985212,2024-03-19 22:18:21.232377,2024-03-19 22:27:35.868518,0 days 00:09:14.636141,2.589024525320022e-08,dart,0.9953866664313562,0.9938131513294152,5.002678311727272e-08,depthwise,0.01744238410686886,7,2,300,tree,4.42703408599725e-06,uniform,0.00012415441268560088,0.6329527747798565,COMPLETE
22,0.4165125119663543,2024-03-19 22:27:35.869519,2024-03-19 22:35:43.233047,0 days 00:08:07.363528,6.097019628199737e-07,dart,0.926323639943048,0.20990817680391874,1.1029111047214614e-05,depthwise,6.048204885152715e-08,7,5,280,tree,0.0011168732794263787,weighted,7.10455800568739e-07,0.35848026786644904,COMPLETE
23,0.39892148270796024,2024-03-19 22:35:43.234271,2024-03-19 22:36:44.402007,0 days 00:01:01.167736,4.50380780811501e-08,gbtree,0.8264425560163979,0.02130888889296176,2.74394438930806e-07,depthwise,0.0001873435926403681,7,3,240,,,,,0.9053863560329798,COMPLETE
24,0.10951028997316989,2024-03-19 22:36:44.402993,2024-03-19 22:41:21.580847,0 days 00:04:37.177854,4.864999286342391e-07,dart,0.9393299363667358,0.0024636052836209117,0.11473387669260322,depthwise,4.414352197229413e-06,5,7,300,forest,0.5736908712978652,weighted,2.573297888711625e-08,0.7775168487112846,COMPLETE
25,0.45929479044717725,2024-03-19 22:41:21.581861,2024-03-19 22:49:20.835667,0 days 00:07:59.253806,3.1762717901815597e-06,dart,0.7049131758970069,0.1608308792185211,0.003758329817839006,depthwise,3.716840229116126e-05,7,4,280,tree,7.430666356549884e-07,uniform,0.00015455877885493842,0.5088755554793648,COMPLETE
26,0.474750348647852,2024-03-19 22:49:20.836670,2024-03-19 22:55:39.655340,0 days 00:06:18.818670,5.837348609278334e-06,dart,0.7201453809285062,0.12082750838735482,0.004718049923651277,lossguide,4.397233479548732e-05,9,5,240,tree,2.784110828802232e-07,uniform,0.00018549648085050717,0.5095329732723048,COMPLETE
27,0.1102630706849977,2024-03-19 22:55:39.656857,2024-03-19 23:01:42.042419,0 days 00:06:02.385562,6.0248997247036844e-06,dart,0.5371840993250756,0.0020242656657506472,0.002802704180315347,lossguide,1.4790712660062093e-06,9,7,240,tree,3.373295975488479e-07,uniform,0.0002409629520958067,0.523466190095902,COMPLETE
28,-0.05197938894842906,2024-03-19 23:01:42.043745,2024-03-19 23:07:19.554092,0 days 00:05:37.510347,0.00016204768703578424,dart,0.6890512160025661,0.0003354974798087404,0.008611209414543755,lossguide,1.2521403366311376e-07,9,4,220,tree,1.3172629909204978e-08,uniform,0.002635439047839577,0.5779817759668195,COMPLETE
29,0.25966665398761724,2024-03-19 23:07:19.555092,2024-03-19 23:13:41.315115,0 days 00:06:21.760023,3.674926559723681e-05,dart,0.5318580469837944,0.025052769326889227,0.00011355240562395605,lossguide,2.1430304008911134e-05,3,5,260,tree,4.257796556508241e-07,uniform,3.95839593785195e-05,0.6602895439058624,COMPLETE
30,0.47450020511988616,2024-03-19 23:13:41.317111,2024-03-19 23:21:56.347862,0 days 00:08:15.030751,2.9159534259692493e-06,dart,0.7061162340883765,0.11455380145470141,0.0015640846276472435,lossguide,2.9521922450677093e-06,9,4,280,tree,1.8535250050567898e-07,uniform,0.0012682125842135553,0.48930241731483776,COMPLETE
31,0.4613483284372446,2024-03-19 23:21:56.349369,2024-03-19 23:30:12.072601,0 days 00:08:15.723232,1.8594760456053865e-06,dart,0.7076116846248938,0.16215641887437662,0.0013861144219099258,lossguide,3.2968561257228432e-06,9,4,280,tree,1.1805499070756288e-07,uniform,0.0009534139302667441,0.4885666059836703,COMPLETE
32,0.3447156136471369,2024-03-19 23:30:12.073603,2024-03-19 23:38:17.805597,0 days 00:08:05.731994,1.4601712355005017e-05,dart,0.7191359438192818,0.008108877641295476,0.0008910350361403024,lossguide,2.6216250005573943e-06,9,5,280,tree,6.368169175202967e-08,uniform,0.017924087711682208,0.46228008590941744,COMPLETE
33,0.43420110930017647,2024-03-19 23:38:17.807602,2024-03-19 23:43:03.598112,0 days 00:04:45.790510,3.767376056755732e-07,dart,0.3689904454994655,0.17903171376901963,0.02581354084111089,lossguide,2.808384013191019e-07,9,4,220,tree,1.0717828645145116e-07,uniform,0.0012807491700887958,0.359131506270396,COMPLETE
34,0.16467180513009855,2024-03-19 23:43:03.598570,2024-03-19 23:49:45.858060,0 days 00:06:42.259490,0.00020755846186269272,dart,0.5642880230906568,0.6127419097564195,0.0003228126899470719,lossguide,5.3846865023497575e-06,9,6,260,tree,1.8609241314417305e-06,uniform,0.022873381788456618,0.5729451847875817,COMPLETE
35,0.4624900885457087,2024-03-19 23:49:45.859104,2024-03-19 23:55:21.635157,0 days 00:05:35.776053,2.1319977443575076e-06,dart,0.6538003055534168,0.03583991704962318,0.0012785751377834605,lossguide,8.99092932561317e-07,9,3,240,forest,1.6582459499643067e-08,weighted,0.00046313600575158823,0.7330932589136993,COMPLETE
36,0.45957418709289877,2024-03-19 23:55:21.637233,2024-03-20 00:01:13.665809,0 days 00:05:52.028576,2.1680310476290343e-05,dart,0.6545615535009301,0.030174015012036277,9.628144626181024e-05,lossguide,8.52641475000237e-07,9,2,240,forest,1.1052019347763756e-08,weighted,1.5995714937237237e-06,0.772246757340352,COMPLETE
37,0.2476570293616415,2024-03-20 00:01:13.667819,2024-03-20 00:05:31.047911,0 days 00:04:17.380092,6.676639476045823e-05,dart,0.5857848591713359,0.005193866010889276,0.01471279918107217,lossguide,2.0365340677372505e-07,9,3,200,forest,1.789013264888536e-05,weighted,0.007731877477372785,0.7385185720137921,COMPLETE
38,-0.09661343592215163,2024-03-20 00:05:31.048915,2024-03-20 00:11:33.306980,0 days 00:06:02.258065,2.5831882332446875e-07,dart,0.7835681514829154,3.824141649213798e-06,0.1511918594415655,lossguide,1.0690293492799377e-05,9,6,240,forest,1.1416059141964722e-08,weighted,0.09911981158489307,0.6315835401432418,COMPLETE
39,-0.09722318214049586,2024-03-20 00:11:33.306980,2024-03-20 00:16:01.780419,0 days 00:04:28.473439,0.0076204874520650785,dart,0.22048020155297932,4.733348991956667e-08,2.0364520066741923e-05,lossguide,0.00035179854618055733,9,3,220,forest,7.640894144758046e-07,weighted,0.00036963642125415066,0.6919132613797716,COMPLETE
40,0.3612023505016175,2024-03-20 00:16:01.781421,2024-03-20 00:19:30.010115,0 days 00:03:28.228694,0.0004793844679079717,dart,0.6521265376387952,0.013635436096501563,0.00022941594261872308,lossguide,5.95912848489539e-07,9,6,180,forest,9.718976093635874e-08,weighted,3.1326475244102594e-05,0.6551135394427224,COMPLETE
41,0.4746196770297086,2024-03-20 00:19:30.010115,2024-03-20 00:26:57.007912,0 days 00:07:26.997797,1.7769032371568068e-06,dart,0.7343589011484258,0.10399989953534153,0.0009843295726483306,lossguide,2.1260998534887673e-06,9,4,280,tree,1.580884083468425e-07,uniform,0.0004056599471508952,0.4776227295835681,COMPLETE
42,0.33417928454749973,2024-03-20 00:26:57.010420,2024-03-20 00:33:44.520641,0 days 00:06:47.510221,1.4813550618039906e-06,dart,0.7493270375799309,0.41557461279500474,0.0006724015120878862,lossguide,8.744476143110522e-08,9,5,260,forest,3.470168451769765e-08,weighted,5.546902917634096e-05,0.5394183064422277,COMPLETE
43,0.4062294995233005,2024-03-20 00:33:44.522080,2024-03-20 00:35:00.310146,0 days 00:01:15.788066,1.1188820765138788e-05,dart,0.8306821176190855,0.07441533880698838,0.003518297601327459,lossguide,1.8392888263724523e-06,9,4,100,tree,1.4252561551465412e-06,uniform,0.000453418652711705,0.27236575792938755,COMPLETE
44,0.46991128665169335,2024-03-20 00:35:00.312518,2024-03-20 00:42:24.648170,0 days 00:07:24.335652,2.8644595717695623e-06,dart,0.6620722107264415,0.03557135652296763,0.0023070002712357665,lossguide,1.074082852082604e-05,9,3,280,forest,1.8551850327498457e-07,uniform,2.9404961439703056e-06,0.7288156151180787,COMPLETE
45,0.38272285858256183,2024-03-20 00:42:24.648170,2024-03-20 00:50:02.859276,0 days 00:07:38.211106,7.815137922674252e-07,dart,0.6191373346923186,0.3716474818123131,0.011550960404964236,lossguide,9.616049077090616e-06,9,5,280,forest,1.7050999058715567e-07,uniform,2.2496452144201088e-06,0.6090461193943228,COMPLETE
46,0.368564917422664,2024-03-20 00:50:02.862789,2024-03-20 00:57:28.353836,0 days 00:07:25.491047,2.5148634215168036e-07,dart,0.742102405877732,0.11361699964546108,4.984573926872846e-05,lossguide,2.2481419204965215e-05,3,2,300,forest,3.0843727731079544e-07,uniform,1.8441977600953104e-07,0.43198581242761264,COMPLETE
47,-0.09401098880280875,2024-03-20 00:57:28.357095,2024-03-20 01:05:28.284619,0 days 00:07:59.927524,4.137502106270265e-06,dart,0.8173362470995165,1.7239092643414277e-05,0.04175832416364617,lossguide,0.002047386672131279,9,3,280,tree,4.2656207306897756e-08,uniform,1.8107852764722273e-07,0.5461871989919194,COMPLETE
48,-0.0971637364987501,2024-03-20 01:05:28.284619,2024-03-20 01:11:49.540525,0 days 00:06:21.255906,4.11523690123662e-05,dart,0.5852579262840162,4.410040255589835e-07,0.000176844620230878,lossguide,4.148831838632434e-05,7,4,260,forest,1.2445507631530229e-05,uniform,9.602381817091055e-06,0.4704429698074644,COMPLETE
49,0.2606964536874689,2024-03-20 01:11:49.540525,2024-03-20 01:20:14.600803,0 days 00:08:25.060278,1.23319805237852e-06,dart,0.8712240568358458,0.004133666335139658,0.002583280348089338,lossguide,3.703055320797621e-08,9,6,300,tree,1.177024651224967e-06,uniform,3.773678957525787e-06,0.386504716757444,COMPLETE
50,-0.022517126767998864,2024-03-20 01:20:14.602334,2024-03-20 01:21:02.210987,0 days 00:00:47.608653,1.141765467949187e-05,gbtree,0.7913515946235938,0.0005947259338422106,1.4051287037871784e-06,lossguide,0.0005368568749950902,7,4,260,,,,,0.3080561722596957,COMPLETE
51,0.47564060565085137,2024-03-20 01:21:02.210987,2024-03-20 01:28:43.417844,0 days 00:07:41.206857,3.219486099912527e-06,dart,0.6633213161235807,0.04331825847283144,0.0005072980570337086,lossguide,3.4595350671036493e-07,9,3,280,forest,2.8773655474689188e-08,weighted,0.0019019444873586472,0.7204438613096856,COMPLETE
52,0.4100485954380976,2024-03-20 01:28:43.417844,2024-03-20 01:36:19.418505,0 days 00:07:36.000661,3.405919369253653e-06,dart,0.6707627903413524,0.013117603419741993,0.000620844895922516,lossguide,4.380797335070854e-07,9,3,280,forest,3.6975108643890134e-08,weighted,0.002491004708095826,0.696454660591768,COMPLETE
53,0.47559574507600144,2024-03-20 01:36:19.420501,2024-03-20 01:45:10.163852,0 days 00:08:50.743351,1.5155486156008707e-07,dart,0.7319253624837566,0.06133307683421009,0.006143363077074334,lossguide,1.6212336297176683e-07,9,10,300,forest,2.2973758295498058e-07,weighted,0.008807109563458336,0.7801015415989506,COMPLETE
54,0.47188472654629443,2024-03-20 01:45:10.164991,2024-03-20 01:53:39.199333,0 days 00:08:29.034342,1.4333999580957026e-07,dart,0.7293982321659506,0.045531473704047365,0.004217536509963968,lossguide,1.419116792191955e-07,9,8,300,forest,2.281525664522648e-07,uniform,0.007493342748678249,0.7985088363563648,COMPLETE
55,0.43877788467508355,2024-03-20 01:53:39.199333,2024-03-20 02:02:29.728590,0 days 00:08:50.529257,1.1532763737166087e-07,dart,0.723058146346754,0.34367450567406965,0.09359078215943667,lossguide,1.3034797494363109e-08,9,10,300,forest,5.406206598621667e-07,weighted,0.045013773066024734,0.7950186384910558,COMPLETE
56,0.4827484387018089,2024-03-20 02:02:29.729582,2024-03-20 02:10:53.963795,0 days 00:08:24.234213,2.3480853114935667e-08,dart,0.762923071161118,0.06449905177005022,0.018130561000928216,lossguide,1.336294836975049e-07,9,9,300,forest,2.5085891440525144e-06,uniform,0.008264911751789764,0.8948802067358038,COMPLETE
57,0.4883017573341564,2024-03-20 02:10:53.963795,2024-03-20 02:18:42.825869,0 days 00:07:48.862074,2.4280605508260122e-08,dart,0.7676025184513405,0.09971398794184795,0.018868052527738897,lossguide,5.8213595882309726e-08,9,10,280,tree,2.3786872684392397e-06,uniform,0.005332534693017628,0.8803211119434041,COMPLETE
58,0.40216934403272153,2024-03-20 02:18:42.826856,2024-03-20 02:20:11.070326,0 days 00:01:28.243470,2.321442020947365e-08,gbtree,0.798622885355177,0.012472840487596991,0.019898048916839904,lossguide,2.9399267525469822e-08,9,9,300,,,,,0.8573346339856613,COMPLETE
59,0.1445828959722282,2024-03-20 02:20:11.070326,2024-03-20 02:28:03.350537,0 days 00:07:52.280211,2.066544813765036e-08,dart,0.7623945070227183,0.9529072367509938,0.006643853820396742,lossguide,5.719964395204263e-08,9,9,280,forest,3.980833978455555e-06,weighted,0.008427316122464674,0.9565619371171888,COMPLETE
60,0.48589859938087815,2024-03-20 02:28:03.350537,2024-03-20 02:35:01.254408,0 days 00:06:57.903871,0.5116131132215037,dart,0.8550178688469374,0.22023720060873755,0.05840155610776586,lossguide,1.4349352022502236e-08,9,10,260,tree,5.073199428806122e-05,uniform,0.15846507489089434,0.867166531710478,COMPLETE
61,0.4716894215653854,2024-03-20 02:35:01.257523,2024-03-20 02:41:34.112624,0 days 00:06:32.855101,0.037246529806325354,dart,0.8520977193959802,0.2409681445307091,0.21321140401252123,lossguide,1.8599813556498692e-08,9,10,260,tree,4.395631334555396e-05,uniform,0.30015510871994333,0.8940585709215276,COMPLETE
62,0.48719065697267927,2024-03-20 02:41:34.112624,2024-03-20 02:50:24.832358,0 days 00:08:50.719734,0.6977748855005917,dart,0.7617129828103294,0.09236942595884935,0.37114213434719134,lossguide,8.437287026843397e-08,9,10,300,tree,7.1761821477410096e-06,uniform,0.13395580578578928,0.8708798470290685,COMPLETE
63,0.40904312553477695,2024-03-20 02:50:24.833375,2024-03-20 02:59:19.466356,0 days 00:08:54.632981,0.2702809057566469,dart,0.8062833241502688,0.470731735122464,0.3034583757227587,lossguide,6.80880521276194e-08,9,10,300,tree,1.8662152518673762e-05,uniform,0.22075308765039414,0.8654181292432507,COMPLETE
64,0.47920373970638386,2024-03-20 02:59:19.466356,2024-03-20 03:07:58.937851,0 days 00:08:39.471495,0.6851774971324238,dart,0.7707817931826573,0.05927839160965102,0.05169269053888991,lossguide,1.046054522285338e-08,9,10,300,tree,0.0002322233974801843,uniform,0.7640920696347899,0.9437503875856462,COMPLETE
65,0.47804606122204396,2024-03-20 03:07:58.937851,2024-03-20 03:17:10.253957,0 days 00:09:11.316106,0.7989215653279662,dart,0.8641226104557157,0.06223645973216732,0.06526931072114493,lossguide,1.0870878050692577e-08,9,10,300,tree,0.0004203586760299561,uniform,0.54737067028596,0.9577571217600087,COMPLETE
66,0.44097555303362057,2024-03-20 03:17:10.253957,2024-03-20 03:25:48.042035,0 days 00:08:37.788078,0.5646392804103587,dart,0.9120055086766442,0.025326490836225193,0.07177919139603227,lossguide,3.408060474519984e-08,9,9,300,tree,0.0003533066149704128,uniform,0.6019759304347378,0.9587590521001619,COMPLETE
67,0.09415504339933087,2024-03-20 03:25:48.042035,2024-03-20 03:27:27.564769,0 days 00:01:39.522734,0.13618828347228643,gbtree,0.9570967585205934,0.0012214048659460494,0.4131461678789839,lossguide,1.1344745124768658e-08,9,9,300,,,,,0.9449066174311308,COMPLETE
68,0.47459235876763606,2024-03-20 03:27:27.566763,2024-03-20 03:35:01.090142,0 days 00:07:33.523379,0.6981961211909701,dart,0.8804637072765742,0.2239294266541936,0.7618598388491621,lossguide,2.019517895757323e-08,7,10,280,tree,0.0006412316557337042,uniform,0.8411280685599518,0.877897205735334,COMPLETE
69,0.37237327218053046,2024-03-20 03:35:01.092145,2024-03-20 03:43:20.696172,0 days 00:08:19.604027,0.03717268293230672,dart,0.8508175203889532,0.008894777198904972,0.19235566431469367,lossguide,1.0170161524428787e-08,9,8,300,tree,0.003258982081446808,uniform,0.08905821616320188,0.9774777592702665,COMPLETE
