number,value,datetime_start,datetime_complete,duration,params_alpha,params_booster,params_colsample_bytree,params_gamma,params_grow_policy,params_lambda,params_max_depth,params_min_child_weight,params_n_estimators,params_normalize_type,params_rate_drop,params_sample_type,params_skip_drop,params_subsample,state
75,0.5101874464248124,2024-03-21 00:46:18.159190,2024-03-21 01:01:27.317382,0 days 00:15:09.158192,0.04675208876720606,dart,0.4141209844698999,1.1118727848195486e-05,depthwise,5.691113653935421e-08,13,7,400,forest,0.0025332720609781544,uniform,3.413224474093017e-08,0.946064431124713,COMPLETE
76,0.519136002782165,2024-03-21 01:01:27.318384,2024-03-21 01:15:29.054275,0 days 00:14:01.735891,1.7290559254098054e-07,dart,0.508250592145288,2.510369329339912e-05,depthwise,3.0616975171013984e-06,13,7,380,forest,0.013418039668681674,weighted,6.041111595446207e-08,0.9753624238671067,COMPLETE
77,0.46178148148408116,2024-03-21 01:15:29.056264,2024-03-21 01:28:58.829336,0 days 00:13:29.773072,8.026754158420914e-08,dart,0.502243702420581,4.4243784029209355e-06,depthwise,2.004926346121448e-07,13,8,400,tree,0.08119930754804719,weighted,1.8611746650421833e-08,0.9177941480929681,COMPLETE
78,0.5166849708591483,2024-03-21 01:28:58.830115,2024-03-21 01:42:55.574254,0 days 00:13:56.744139,9.508244121276352e-08,dart,0.4813715373792668,2.3471625409976363e-05,depthwise,3.6712716183574895e-06,13,7,380,forest,0.010801407238120123,weighted,9.50712656369379e-08,0.972348721989053,COMPLETE
79,0.513820014831507,2024-03-21 01:42:55.576259,2024-03-21 01:44:51.147850,0 days 00:01:55.571591,0.9732802690290238,gbtree,0.5839570333280752,0.00011946303018481674,depthwise,1.1088224119447864e-05,13,12,380,,,,,0.9810941977002504,COMPLETE
80,0.47593726321419094,2024-03-21 01:44:51.148836,2024-03-21 01:56:07.673396,0 days 00:11:16.524560,0.17216770723041538,dart,0.3770077246081709,8.901466601225158e-06,depthwise,1.676365835743705e-06,7,7,360,forest,4.563068364602752e-05,weighted,2.164456918595641e-07,0.9106188936801588,COMPLETE
81,0.5171721175006122,2024-03-21 01:56:07.675325,2024-03-21 02:09:54.428767,0 days 00:13:46.753442,1.805535464780157e-06,dart,0.5379645364636714,2.0335346760547015e-06,depthwise,8.526293593183428e-07,13,7,380,forest,0.013925490841030558,weighted,8.483762279995887e-08,0.9541476999708147,COMPLETE
82,0.4992848365609325,2024-03-21 02:09:54.430471,2024-03-21 02:23:28.217626,0 days 00:13:33.787155,5.6673516917848535e-06,dart,0.5128176976158098,3.7222841093308995e-07,depthwise,1.101258389310372e-07,13,7,380,forest,0.02549030927608523,uniform,5.917105785592524e-08,0.49584747544449764,COMPLETE
83,0.5126114306105009,2024-03-21 02:23:28.219631,2024-03-21 02:38:01.837951,0 days 00:14:33.618320,0.017844610535100888,dart,0.4562846141030504,5.346908658147632e-06,depthwise,2.3370100509069473e-05,13,7,400,forest,0.00911430409929619,weighted,2.5014018049270332e-08,0.935504802637665,COMPLETE
84,0.5187269267648025,2024-03-21 02:38:01.838969,2024-03-21 02:51:42.264059,0 days 00:13:40.425090,0.558904896149908,dart,0.534104605368712,6.197143156899373e-07,depthwise,2.161500325477262e-06,13,8,380,forest,0.003054577517638373,uniform,4.83137955543031e-08,0.8375311288247884,COMPLETE
85,0.5188928006337681,2024-03-21 02:51:42.266064,2024-03-21 03:05:16.758941,0 days 00:13:34.492877,0.6271666592811745,dart,0.8789148152796389,6.501197317354279e-07,depthwise,2.0674379226681303e-06,13,8,360,forest,0.0012432419360128236,uniform,2.9915090766272317e-07,0.8250643588471981,COMPLETE
86,0.5099255157551934,2024-03-21 03:05:16.759943,2024-03-21 03:17:56.252074,0 days 00:12:39.492131,0.06394138879197579,dart,0.8969548787199028,2.821648448588295e-07,depthwise,5.071449548129626e-06,13,8,360,forest,0.00136101959644807,uniform,3.0523856087830134e-07,0.8966274435285974,COMPLETE
87,0.506158707193833,2024-03-21 03:17:56.253076,2024-03-21 03:24:46.769730,0 days 00:06:50.516654,0.26192431374819825,dart,0.99218303326074,1.907267411488961e-07,depthwise,0.00010544942555311706,13,9,240,forest,0.0006886372587069311,uniform,5.623460187723636e-07,0.8602214039972136,COMPLETE
88,0.5048966508912656,2024-03-21 03:24:46.771725,2024-03-21 03:37:33.001364,0 days 00:12:46.229639,3.098206330048182e-05,dart,0.9004319587470814,2.5308618289440617e-05,depthwise,3.724001552428608e-07,13,10,360,tree,0.004712338513395887,uniform,1.372450938298163e-08,0.9843855639513341,COMPLETE
89,0.5177928559661437,2024-03-21 03:37:33.002608,2024-03-21 03:50:55.629792,0 days 00:13:22.627184,0.37407813294552306,dart,0.8248674213025549,6.908387623261522e-07,depthwise,1.0297326777821512e-05,13,6,360,forest,4.8615412859829294e-08,weighted,1.0098079687966145e-06,0.8286065979577452,COMPLETE
90,0.5090625660129753,2024-03-21 03:50:55.630794,2024-03-21 04:01:58.081744,0 days 00:11:02.450950,0.13419304570870688,dart,0.881550521070086,3.735369624775816e-06,depthwise,4.787057595451302e-05,11,6,340,forest,0.0014010262819204138,uniform,1.7501259434876663e-07,0.9339924815447168,COMPLETE
91,0.5186117765108678,2024-03-21 04:01:58.082747,2024-03-21 04:17:12.526787,0 days 00:15:14.444040,0.6151151960825996,dart,0.9187678009522648,5.255419880824746e-07,depthwise,2.2911761907306896e-06,13,8,380,forest,0.0030909983382188338,uniform,5.5873272238805336e-08,0.8385562972419769,COMPLETE
92,0.4969995816819518,2024-03-21 04:17:12.528891,2024-03-21 04:32:03.896901,0 days 00:14:51.368010,0.5489754545529066,dart,0.9541117661032791,8.784765868424389e-07,depthwise,4.422227007700093e-06,13,8,380,forest,0.0074622835919215865,uniform,3.037624982073463e-08,0.39474843239580015,COMPLETE
93,0.5214982092766905,2024-03-21 04:32:03.897905,2024-03-21 04:44:30.871237,0 days 00:12:26.973332,0.2730753012848938,dart,0.5432241253483517,1.7171878322933933e-06,depthwise,1.3149681911024866e-06,13,7,360,forest,0.02274343527202894,uniform,3.1548082096227514e-07,0.8741118203984192,COMPLETE
94,0.5189245068266671,2024-03-21 04:44:30.872704,2024-03-21 04:56:56.671443,0 days 00:12:25.798739,0.06918889929139423,dart,0.5454861216708616,1.846484812270076e-06,depthwise,1.1165699398527864e-06,13,7,360,forest,0.02263447990702305,uniform,3.2613321670177753e-07,0.8762665115282914,COMPLETE
95,0.4808564822188779,2024-03-21 04:56:56.672445,2024-03-21 05:08:01.218158,0 days 00:11:04.545713,0.06434670256225836,dart,0.5476911966516567,2.0275201610698428e-06,depthwise,1.3602980862018388e-06,13,7,360,forest,0.15627641896457448,uniform,1.0657999093371092e-07,0.8760547910198564,COMPLETE
96,0.5096025452883064,2024-03-21 05:08:01.218932,2024-03-21 05:09:29.646262,0 days 00:01:28.427330,0.02282569203265279,gbtree,0.49104516466244613,7.361089059116318e-06,depthwise,4.586693419156485e-07,13,7,340,,,,,0.9591547071054098,COMPLETE
97,0.510841882692322,2024-03-21 05:09:29.647265,2024-03-21 05:24:34.735759,0 days 00:15:05.088494,0.012716242134429859,dart,0.5682497607747526,6.82194949596235e-05,depthwise,2.3358936985403002e-07,13,7,400,forest,0.06406026763587813,uniform,7.264560156373083e-07,0.9015051110240024,COMPLETE
98,0.5228414250104303,2024-03-21 05:24:34.737764,2024-03-21 05:36:47.627916,0 days 00:12:12.890152,0.11381435219647004,dart,0.4681223839418681,1.5971956450187075e-06,depthwise,1.2206384090695741e-06,13,6,360,forest,0.023851061899308346,uniform,1.6215134450106286e-06,0.9945562364873398,COMPLETE
99,0.5150461832373708,2024-03-21 05:36:47.628919,2024-03-21 05:49:51.430763,0 days 00:13:03.801844,0.11885142546227849,dart,0.4680012023367397,0.001119218040316785,depthwise,7.625920393313356e-08,13,6,380,forest,0.06011399290455706,uniform,8.623144408195304e-06,0.9947841699835989,COMPLETE
