number,values_0,values_1,values_2,values_3,datetime_start,datetime_complete,duration,params_alpha,params_booster,params_colsample_bytree,params_gamma,params_grow_policy,params_lambda,params_max_depth,params_min_child_weight,params_n_estimators,params_normalize_type,params_rate_drop,params_sample_type,params_skip_drop,params_subsample,system_attrs_nsga2:generation,state
0,0.4243094100884127,0.38350271643616785,0.3677646969547561,0.3962293248440542,2024-03-13 09:59:07.437575,2024-03-13 10:00:15.927941,0 days 00:01:08.490366,0.0016106524130146424,gbtree,0.6290122465574897,1.2640467186020439e-08,depthwise,0.0006246057270614547,5,5,100,,,,,0.22500784045281713,0,COMPLETE
1,0.5487926825053038,0.3005767941450411,0.4861339550813854,0.32218025535917627,2024-03-13 10:00:15.927941,2024-03-13 10:39:24.096578,0 days 00:39:08.168637,0.003772265430755739,dart,0.9908363348606495,0.0007927152387422568,lossguide,8.627198233986646e-08,5,9,300,tree,0.00010623658938834154,weighted,0.8695064373909027,0.5413092820143226,0,COMPLETE
2,0.5058713034989443,0.32916935016485227,0.4615539839986604,0.3385246046311555,2024-03-13 10:39:24.096578,2024-03-13 10:58:59.084617,0 days 00:19:34.988039,2.59299274363008e-06,dart,0.9388759654465182,4.715408893849338e-08,depthwise,1.2554938055963243e-06,5,5,200,tree,1.1804375431655736e-06,weighted,0.00025647213590373184,0.5007544187225705,0,COMPLETE
3,0.5077243189024181,0.3279349432572469,0.44993064949504824,0.34475659549216997,2024-03-13 10:58:59.084617,2024-03-13 11:05:34.977205,0 days 00:06:35.892588,8.504289839951567e-05,dart,0.346029373988307,3.2492665406774477e-07,lossguide,0.0009109867446457034,9,2,120,tree,2.0260209957180262e-05,weighted,1.1814845966635835e-08,0.2693029783733886,0,COMPLETE
4,0.5286877931819067,0.3139698907220677,0.4807818402997068,0.3263064486080422,2024-03-13 11:05:34.978208,2024-03-13 11:30:20.506737,0 days 00:24:45.528529,0.03684781631680017,dart,0.25588787499447935,0.0002918364834373307,lossguide,0.07037844886010812,5,5,260,forest,1.756379841647008e-07,uniform,0.006077041047648419,0.7442968087303552,0,COMPLETE
5,0.49044657463612895,0.33944470557771306,0.42871781410837456,0.3576546654927951,2024-03-13 11:30:20.506737,2024-03-13 11:33:25.211019,0 days 00:03:04.704282,0.04901726355899309,gbtree,0.6531135096833924,6.429896977699614e-07,depthwise,0.029649547081027905,5,2,160,,,,,0.41660762620544506,0,COMPLETE
6,0.5222117219197018,0.318283997925507,0.4694742764614899,0.33244049671921133,2024-03-13 11:33:25.213025,2024-03-13 11:38:14.977370,0 days 00:04:49.764345,5.4880992808808366e-08,gbtree,0.5990485001132356,2.1971750636998386e-08,depthwise,2.3048640517824998e-05,5,3,240,,,,,0.5093094618191822,0,COMPLETE
7,0.5407058114717134,0.3059639536074308,0.4900307450115555,0.3204879987362049,2024-03-13 11:38:14.977370,2024-03-13 11:48:54.523425,0 days 00:10:39.546055,0.014495214376522918,dart,0.8924157851926127,9.631317391129026e-05,lossguide,1.7690108816312577e-08,7,6,120,tree,0.0072213202378553125,uniform,0.0014414831067255502,0.7258284197492038,0,COMPLETE
8,0.5589969546938037,0.29377910425376674,0.5114054387128838,0.3070631000167333,2024-03-13 11:48:54.523425,2024-03-13 12:05:40.530904,0 days 00:16:46.007479,0.037792669736379056,dart,0.31334886482604346,0.09611449873561989,depthwise,0.040633040219553884,7,4,200,forest,2.4578072036924115e-05,weighted,0.005354168655664486,0.6690803742269056,0,COMPLETE
9,0.46678217838373215,0.3552090074521102,0.41487806287931894,0.3678142869257765,2024-03-13 12:05:40.530904,2024-03-13 12:06:43.587881,0 days 00:01:03.056977,1.9211950952439766e-08,gbtree,0.22222399516470157,0.5712968810434835,depthwise,0.000968577520784937,5,5,100,,,,,0.7579732366593108,0,COMPLETE
10,0.551914117321803,0.2984974154782998,0.5122766601868062,0.30667309893263084,2024-03-13 12:06:43.587881,2024-03-13 12:28:06.148820,0 days 00:21:22.560939,0.037806440111197076,dart,0.910120692241623,0.02169766953703813,depthwise,8.252288998748084e-08,7,4,180,forest,0.04214115524427597,uniform,3.978683471447674e-07,0.859151299359362,0,COMPLETE
11,0.566527995267156,0.2887622174606108,0.5344611223617999,0.29249694369881796,2024-03-13 12:28:06.149823,2024-03-13 12:38:46.033077,0 days 00:10:39.883254,2.5485742144963183e-07,gbtree,0.7898067575557783,0.0070174707193109585,lossguide,0.041086228495656,9,9,180,,,,,0.718584372167397,0,COMPLETE
12,0.5330403099511667,0.31107041306237293,0.4803000012365802,0.3261822897427163,2024-03-13 12:38:46.041232,2024-03-13 13:09:38.466785,0 days 00:30:52.425553,0.001106153105195913,dart,0.5106937831224456,0.2187043528035654,lossguide,0.0007847236069988169,5,9,280,tree,1.5117220890701853e-08,uniform,2.3820164483724893e-06,0.6098120546253809,0,COMPLETE
13,0.5050632003195206,0.32970767712363974,0.4561127928816623,0.3401866407826381,2024-03-13 13:09:38.467787,2024-03-13 13:14:52.914804,0 days 00:05:14.447017,1.3926880592701897e-07,gbtree,0.8529183743531623,0.00043536826781254763,lossguide,0.06773846604000551,5,6,280,,,,,0.29670526745395026,0,COMPLETE
14,0.49294734514581184,0.3377787893712415,0.43928216987457913,0.35111825371891736,2024-03-13 13:14:52.916809,2024-03-13 13:18:36.057336,0 days 00:03:43.140527,2.0606630910733856e-05,gbtree,0.7017560405015768,0.13617263600446436,lossguide,0.00014609891119329619,5,4,160,,,,,0.5063393084128154,0,COMPLETE
15,0.49102402051263605,0.33906003355750625,0.43873000895753683,0.3515681200775686,2024-03-13 13:18:36.059342,2024-03-13 13:34:02.183076,0 days 00:15:26.123734,1.8885384736478263e-08,dart,0.4841409701809011,0.00010999242095489029,lossguide,3.317861639912362e-08,5,7,200,forest,0.005621191702676143,weighted,1.1004741831927652e-05,0.32967125155785104,0,COMPLETE
16,0.5803240473969358,0.2795718232443738,0.5400404392641046,0.2891910734269817,2024-03-13 13:34:02.184079,2024-03-13 13:47:00.573084,0 days 00:12:58.389005,5.965346832119681e-06,gbtree,0.7295911276220814,7.372146242868912e-08,lossguide,0.00022108641594017995,9,4,220,,,,,0.926368451515968,0,COMPLETE
17,0.5539084327989834,0.297168879948395,0.5134421010742479,0.30522359129412086,2024-03-13 13:47:00.574086,2024-03-13 14:12:37.264431,0 days 00:25:36.690345,3.4863370885171464e-08,dart,0.576585024543925,0.00030810186675188367,lossguide,9.293424355759397e-07,7,9,240,forest,0.015606328932374527,weighted,1.4689528005700777e-06,0.6129945332239704,0,COMPLETE
18,0.5040153997936985,0.33040568114694285,0.4485932052214401,0.3464266614983635,2024-03-13 14:12:37.265433,2024-03-13 14:14:39.821036,0 days 00:02:02.555603,0.0006663495515692385,gbtree,0.31556727854376476,0.028507691281496453,lossguide,1.2975394672037373e-07,5,6,180,,,,,0.5063588888916966,0,COMPLETE
19,0.5586317139306765,0.2940224134675478,0.5148301822424778,0.30510502288501284,2024-03-13 14:14:39.821036,2024-03-13 14:44:55.017652,0 days 00:30:15.196616,2.3398285528850657e-05,dart,0.26170641472142314,0.0851632144683284,lossguide,3.0440460556469043e-06,7,2,280,tree,0.00021167567038578067,uniform,3.8693394237971214e-08,0.5649790542738571,0,COMPLETE
