number,values_0,values_1,datetime_start,datetime_complete,duration,params_alpha,params_booster,params_colsample_bytree,params_gamma,params_grow_policy,params_lambda,params_max_depth,params_min_child_weight,params_n_estimators,params_normalize_type,params_rate_drop,params_sample_type,params_skip_drop,params_subsample,system_attrs_nsga2:generation,state
0,0.49803857778127797,0.3144695391425866,2024-03-12 16:26:10.494854,2024-03-12 16:35:25.629633,0 days 00:09:15.134779,3.0682852715451994e-08,dart,0.9874927842304573,3.796829104716798e-05,depthwise,7.990426732497969e-07,9,4,100,tree,1.6660011449142231e-06,uniform,9.6498783514257e-05,0.510345655782361,0,COMPLETE
1,0.4817195360317087,0.32560336733490836,2024-03-12 16:35:25.630635,2024-03-12 16:41:35.956769,0 days 00:06:10.326134,0.05186932178555722,gbtree,0.755474324129876,0.0009720175221866907,depthwise,0.00013218189808526803,5,4,240,,,,,0.6218217933954813,0,COMPLETE
2,0.5129478303495855,0.30559386872442607,2024-03-12 16:41:35.957772,2024-03-12 16:55:53.373221,0 days 00:14:17.415449,6.2850661573892e-05,dart,0.9265359156846327,0.7374382126468132,depthwise,3.2330765711193644e-07,9,9,140,tree,9.650650225194901e-08,uniform,0.002401560826792236,0.6268706842715517,0,COMPLETE
3,0.48376782933656787,0.32414664105496876,2024-03-12 16:55:53.373704,2024-03-12 17:02:18.517951,0 days 00:06:25.144247,1.0428099760888768e-06,gbtree,0.706675789848507,9.119080327171422e-06,lossguide,1.3423168438589482e-06,5,5,260,,,,,0.6575149600813949,0,COMPLETE
4,0.2098360359567101,0.4960773087352067,2024-03-12 17:02:18.518953,2024-03-12 17:11:46.621149,0 days 00:09:28.102196,0.15668318443929194,dart,0.6233030479168968,1.2460797178659953e-07,depthwise,0.004590436417775004,9,10,160,tree,0.44076743315035055,weighted,3.460915363634094e-05,0.3181734997822734,0,COMPLETE
5,0.43260099104398647,0.3566081714012547,2024-03-12 17:11:46.622153,2024-03-12 17:21:34.333387,0 days 00:09:47.711234,0.3688641315744046,dart,0.32445545005378656,5.500464222922406e-06,depthwise,1.0982414727998664e-07,5,9,160,tree,0.0003883172703186387,weighted,3.937281663639861e-05,0.40293627249366293,0,COMPLETE
6,0.49175037356995244,0.3189965733719634,2024-03-12 17:21:34.334853,2024-03-12 17:27:12.253217,0 days 00:05:37.918364,0.0011999986916701863,gbtree,0.828866446303385,0.022594877618096698,depthwise,0.004811159731674341,7,8,120,,,,,0.8423235606039201,0,COMPLETE
7,0.4827967693464488,0.32413524541715794,2024-03-12 17:27:12.254232,2024-03-12 17:29:20.713690,0 days 00:02:08.459458,2.8141742158410676e-06,gbtree,0.2346694630879468,2.462752161277058e-06,lossguide,0.7189694087588965,7,7,280,,,,,0.2876526910015145,0,COMPLETE
8,0.4755198549737262,0.33015339923095816,2024-03-12 17:29:20.714706,2024-03-12 17:42:14.385692,0 days 00:12:53.670986,0.08285631433185021,dart,0.9667794831860779,2.2072505473682072e-08,depthwise,0.0033621420181718887,7,9,160,tree,3.411247541666188e-06,uniform,4.508480902059559e-08,0.35422299924099854,0,COMPLETE
9,0.3761810974659718,0.3915158661539383,2024-03-12 17:42:14.385692,2024-03-12 17:42:51.993037,0 days 00:00:37.607345,0.00010037550864801779,gbtree,0.26008853044045277,0.2872047230909357,lossguide,0.4554915959289609,5,6,100,,,,,0.24369355036257867,0,COMPLETE
10,0.5364125036002069,0.2912707770457832,2024-03-12 17:42:51.993037,2024-03-12 17:46:50.951305,0 days 00:03:58.958268,0.022675274339004542,gbtree,0.2245855664529664,0.021947660819052476,depthwise,3.4615858358416435e-05,9,2,220,,,,,0.846599679634797,0,COMPLETE
11,0.47374346310243187,0.3309930111581658,2024-03-12 17:46:50.952308,2024-03-12 17:48:23.636851,0 days 00:01:32.684543,0.6049149390176977,gbtree,0.26185169787785584,0.08135320859094725,depthwise,0.000340882558394995,7,7,120,,,,,0.48793722749924245,0,COMPLETE
12,0.45956432451232,0.3394856332817804,2024-03-12 17:48:23.637845,2024-03-12 18:02:23.176849,0 days 00:13:59.539004,0.8862808933852644,dart,0.8799635784884503,3.333145781288037e-07,depthwise,5.571232415046894e-07,5,9,160,forest,3.0488720402681414e-05,weighted,6.940096075866122e-08,0.898331815251912,0,COMPLETE
13,0.48182379612499415,0.3260558335504372,2024-03-12 18:02:23.177851,2024-03-12 18:09:14.916763,0 days 00:06:51.738912,0.18920932740089488,gbtree,0.6563256479155506,0.0014231334125836507,lossguide,0.030390699476143535,5,8,240,,,,,0.937218533670819,0,COMPLETE
14,0.4640113826891808,0.3366505991190734,2024-03-12 18:09:14.916763,2024-03-12 18:14:17.923478,0 days 00:05:03.006715,0.12422866458345448,gbtree,0.6396365129081198,0.5929143447058486,depthwise,4.426754843125983e-07,5,5,180,,,,,0.9530951506184588,0,COMPLETE
15,0.5114305868209763,0.30728713312669814,2024-03-12 18:14:17.924481,2024-03-12 18:16:53.070460,0 days 00:02:35.145979,7.645818384618213e-07,gbtree,0.2389645625929788,0.0005431635474151538,lossguide,0.014727849952424724,7,4,200,,,,,0.6304921832834243,0,COMPLETE
16,0.45936185769295285,0.3380389458160392,2024-03-12 18:16:53.071439,2024-03-12 18:19:25.017519,0 days 00:02:31.946080,2.709504991596487e-08,gbtree,0.44035058992013304,1.620938217899725e-05,lossguide,0.00011480788238920039,9,2,160,,,,,0.23132634460944823,0,COMPLETE
17,0.49168819414707643,0.3190676538088729,2024-03-12 18:19:25.018518,2024-03-12 18:23:05.310445,0 days 00:03:40.291927,0.21571512737210566,gbtree,0.5062101101893474,0.002361192739217942,lossguide,1.153002758877379e-05,7,3,160,,,,,0.47823151051916446,0,COMPLETE
18,0.5257115316082122,0.2978878592264686,2024-03-12 18:23:05.311448,2024-03-12 18:35:37.016629,0 days 00:12:31.705181,3.15616446888055e-08,gbtree,0.9685857726909226,3.412908565617921e-07,depthwise,0.03478031062499618,7,5,260,,,,,0.6566532792349309,0,COMPLETE
19,0.5069104421446579,0.30997179620226223,2024-03-12 18:35:37.017634,2024-03-12 19:06:12.603291,0 days 00:30:35.585657,0.510956266000613,dart,0.7348729790709108,1.293780495483875e-08,lossguide,0.009927078243784183,7,5,280,forest,2.8642265687524493e-05,uniform,0.00029286281443745147,0.36232350979737565,0,COMPLETE
20,0.5044433959758388,0.3109242104617021,2024-03-12 19:06:12.604291,2024-03-12 19:13:23.240998,0 days 00:07:10.636707,0.0024430774918895097,gbtree,0.9454408954549658,0.000598159411686443,lossguide,0.5240774802375029,7,4,140,,,,,0.7516414664527582,0,COMPLETE
21,0.4571891651259411,0.34121828231240736,2024-03-12 19:13:23.242003,2024-03-12 19:16:35.454835,0 days 00:03:12.212832,2.2733638228877402e-08,gbtree,0.7261032906790303,2.2488616286004592e-05,depthwise,2.4123501253187086e-06,7,8,180,,,,,0.22381167643015631,0,COMPLETE
22,0.4928896446304982,0.3185289725816168,2024-03-12 19:16:35.455851,2024-03-12 19:26:42.540821,0 days 00:10:07.084970,3.23717945433999e-07,dart,0.7619110615165878,0.010657514592208059,lossguide,8.972739463726429e-05,7,9,120,forest,2.8605276751790075e-07,weighted,0.10037397213848899,0.8894730467436793,0,COMPLETE
23,0.5341270214772809,0.29289573309831635,2024-03-12 19:26:42.541838,2024-03-12 19:36:14.180980,0 days 00:09:31.639142,0.061327443850730114,gbtree,0.7407990764744972,7.56734520243043e-05,lossguide,2.492518161523625e-07,9,10,180,,,,,0.7740097492700369,0,COMPLETE
24,0.4591436387532079,0.33904949258065925,2024-03-12 19:36:14.182031,2024-03-12 19:38:35.263223,0 days 00:02:21.081192,0.0002581616677660431,gbtree,0.5519203164304851,0.00013106654753950332,lossguide,0.004163579651988602,7,4,100,,,,,0.4332846280350602,0,COMPLETE
25,0.5139547903475608,0.3055465168429786,2024-03-12 19:38:35.264225,2024-03-12 19:49:19.409473,0 days 00:10:44.145248,1.2235203209531351e-07,gbtree,0.9932398299558318,0.012678904752301436,depthwise,1.2464472161743803e-07,7,5,220,,,,,0.5926537507049527,0,COMPLETE
26,0.5184280271196151,0.3030775415010062,2024-03-12 19:49:19.410014,2024-03-12 19:59:18.246617,0 days 00:09:58.836603,0.4522705898521391,gbtree,0.8735704717202759,0.10719331952102797,lossguide,2.1555015192800466e-08,7,4,240,,,,,0.5455661310501939,0,COMPLETE
27,0.4339047792308657,0.35472200733064957,2024-03-12 19:59:18.246617,2024-03-12 20:00:26.361118,0 days 00:01:08.114501,0.07046243756053487,gbtree,0.20642878166511336,0.010436726225044306,depthwise,0.0006234197112952594,5,7,200,,,,,0.33578820605672943,0,COMPLETE
28,0.4790878241143906,0.3263869955573794,2024-03-12 20:00:26.363137,2024-03-12 20:08:51.099108,0 days 00:08:24.735971,1.844172357401714e-05,dart,0.7338190462974457,0.2938069262103764,depthwise,1.9686439907179634e-07,7,5,120,tree,0.00029390019692557946,weighted,0.0007874033332754357,0.5410887107762488,0,COMPLETE
29,0.4761427880037652,0.3287784301963542,2024-03-12 20:08:51.101113,2024-03-12 20:12:44.704737,0 days 00:03:53.603624,2.8921453252479028e-08,gbtree,0.830879383434562,1.2313027697697246e-06,depthwise,0.49909996459611494,9,4,100,,,,,0.3888674006134026,0,COMPLETE
30,0.432895441075945,0.35509812032171995,2024-03-12 20:12:44.706776,2024-03-12 20:22:54.054490,0 days 00:10:09.347714,5.312304912910034e-05,dart,0.5948824133654714,3.349317077148651e-05,depthwise,0.9778905144113269,5,4,160,forest,0.0015396542412550013,uniform,0.3108367162122713,0.38822715889824044,0,COMPLETE
31,0.530636385860714,0.29525138103757403,2024-03-12 20:22:54.055493,2024-03-12 20:40:30.773498,0 days 00:17:36.718005,0.00526085452495062,dart,0.854010857380995,3.152431116859794e-08,depthwise,0.5355552524143135,9,3,160,forest,3.619472867774257e-08,weighted,0.1314926246597179,0.7384602411704688,0,COMPLETE
32,0.4094212313566121,0.37092140206897545,2024-03-12 20:40:30.775488,2024-03-12 20:46:10.069168,0 days 00:05:39.293680,1.5193981502828926e-05,dart,0.8599251619952175,0.27357576793625543,lossguide,6.717164924819507e-05,5,7,100,tree,9.567117419003016e-07,weighted,0.01824021965290225,0.49513836641197706,0,COMPLETE
33,0.5444666840386513,0.2872294181950119,2024-03-12 20:46:10.070878,2024-03-12 20:55:30.043963,0 days 00:09:19.973085,0.06849253548118749,gbtree,0.4454578743740933,4.573166376785842e-07,lossguide,0.0012296184872160466,9,2,260,,,,,0.9770556272795639,0,COMPLETE
34,0.5292560671029964,0.29532988009654815,2024-03-12 20:55:30.046243,2024-03-12 21:04:46.701034,0 days 00:09:16.654791,1.3172167075024377e-08,gbtree,0.5991754084080294,1.0256865635247242e-08,lossguide,2.2196277322950976e-07,9,6,240,,,,,0.6294016113753381,0,COMPLETE
35,0.5269664572427161,0.29668634557323603,2024-03-12 21:04:46.702038,2024-03-12 21:15:06.295843,0 days 00:10:19.593805,0.0005117146450235762,gbtree,0.5743271102934663,0.6586428314880345,depthwise,4.736644732150851e-08,9,10,300,,,,,0.5878121814144786,0,COMPLETE
36,0.5228302617511283,0.2994617683171753,2024-03-12 21:15:06.297098,2024-03-12 21:33:03.079344,0 days 00:17:56.782246,1.648500074354704e-08,dart,0.9816846662775858,0.003761476321765908,lossguide,0.029924085469264016,9,2,160,tree,0.012863024682941478,uniform,0.00048180144827618274,0.6870671243087196,0,COMPLETE
37,0.5023593985966597,0.3130991621776663,2024-03-12 21:33:03.080347,2024-03-12 21:35:46.113361,0 days 00:02:43.033014,0.0010716653289190529,gbtree,0.2503537429355621,0.0010019880671814309,lossguide,1.3533746384042098e-06,9,3,220,,,,,0.3729862321018586,0,COMPLETE
38,0.5404519643134486,0.2890670176953084,2024-03-12 21:35:46.114363,2024-03-12 22:12:53.119852,0 days 00:37:07.005489,1.9121457111035146e-05,dart,0.7049254940328618,1.9350539185090931e-07,lossguide,8.911971514579691e-08,9,6,280,tree,0.00014546388837167925,weighted,2.8938495611350572e-08,0.7824969924192744,0,COMPLETE
39,0.5327211547689894,0.2931667766484059,2024-03-12 22:12:53.121798,2024-03-12 22:25:02.314734,0 days 00:12:09.192936,1.5654849576876337e-07,gbtree,0.678125273373543,1.9384786015711595e-07,depthwise,1.4541994879460808e-07,7,8,300,,,,,0.8864264221466767,0,COMPLETE
40,0.3985533502556978,0.37755017681403014,2024-03-12 22:25:02.315300,2024-03-12 22:30:50.974219,0 days 00:05:48.658919,9.650867857353448e-06,dart,0.4289289960928659,0.13569214285018985,lossguide,3.735005829341373e-08,5,5,120,tree,0.011843244049712669,weighted,5.792570279015483e-07,0.3387984923504168,0,COMPLETE
41,0.4641222659737311,0.3354440895778342,2024-03-12 22:30:50.976225,2024-03-12 22:34:24.475539,0 days 00:03:33.499314,0.3798354745823331,gbtree,0.6933538754235333,0.1782570151053409,lossguide,0.006121631487283113,7,8,180,,,,,0.2834134078838917,0,COMPLETE
42,0.4055287767721719,0.37228383246954727,2024-03-12 22:34:24.476547,2024-03-12 22:36:55.325552,0 days 00:02:30.849005,3.572969184149984e-05,gbtree,0.8834544966816711,0.014002637912064098,depthwise,0.03611287495112471,5,2,120,,,,,0.3456771350816342,0,COMPLETE
43,0.4707549281027429,0.3314571633479002,2024-03-12 22:36:55.326555,2024-03-12 22:45:31.376789,0 days 00:08:36.050234,0.00019926929279827862,dart,0.4787159732762775,6.272828961021098e-07,depthwise,5.640654328863425e-07,9,10,140,tree,0.0003015768862080947,weighted,0.5289276754668689,0.3268271316570137,0,COMPLETE
44,0.4376650042102961,0.3525573516554753,2024-03-12 22:45:31.377792,2024-03-12 22:49:01.729879,0 days 00:03:30.352087,0.0004346754140540445,gbtree,0.7484238259291993,3.901522757573161e-06,depthwise,0.2048542601182657,5,5,260,,,,,0.23858406769251142,0,COMPLETE
45,0.43162941351354894,0.35616897785455853,2024-03-12 22:49:01.731788,2024-03-12 22:53:20.524849,0 days 00:04:18.793061,3.6857866423274195e-07,dart,0.32224084878820136,0.00017990184259145936,lossguide,0.004830605208251734,7,2,100,tree,1.7029793207251162e-08,weighted,0.00018518355889849894,0.33455544472084287,0,COMPLETE
46,0.537465564338166,0.2902933550718184,2024-03-12 22:53:20.526117,2024-03-12 23:22:42.526817,0 days 00:29:22.000700,0.00035092243579784484,dart,0.4961494665636617,3.3091140821515656e-08,lossguide,0.03466832927616068,9,2,260,forest,0.002600565979757144,weighted,4.720626233738089e-05,0.7690593887130881,0,COMPLETE
47,0.5435914896915939,0.28761944265045747,2024-03-12 23:22:42.527819,2024-03-12 23:59:21.070730,0 days 00:36:38.542911,0.050129161841147754,dart,0.4576027202633934,0.19327902684278284,depthwise,0.008044314473836823,9,6,300,tree,2.875751003203073e-08,weighted,0.18710703635220102,0.9408466758482725,0,COMPLETE
48,0.5124265869308863,0.30633673683762813,2024-03-12 23:59:21.071890,2024-03-13 00:19:16.024469,0 days 00:19:54.952579,0.004655142064719634,dart,0.831706816018519,0.004281263026932305,lossguide,4.5353309154877857e-07,7,7,200,forest,0.014535654791889044,weighted,0.00011575886780182393,0.6845022625322299,0,COMPLETE
49,0.4146899388295059,0.36703619639328355,2024-03-13 00:19:16.026474,2024-03-13 00:30:50.535586,0 days 00:11:34.509112,0.005741983594878784,dart,0.9354732263767878,0.028917934888108093,depthwise,5.2269948901899626e-08,5,2,160,forest,0.1372112148584062,weighted,8.651178281084334e-07,0.614922100746648,0,COMPLETE
