number,values_0,values_1,datetime_start,datetime_complete,duration,params_alpha,params_booster,params_colsample_bytree,params_eta,params_gamma,params_grow_policy,params_lambda,params_max_depth,params_min_child_weight,params_n_estimators,params_normalize_type,params_rate_drop,params_sample_type,params_skip_drop,params_subsample,system_attrs_nsga2:generation,state
0,0.40805771864270896,0.3699467972571925,2024-03-09 14:17:41.195501,2024-03-09 14:29:27.437219,0 days 00:11:46.241718,4.771346364719175e-05,dart,0.333586241327942,0.15619551499544634,0.07785028045007336,depthwise,0.002130775537299379,7,7,180,tree,9.782122975177611e-05,uniform,0.0006307784998775277,0.2994536945508974,0,COMPLETE
1,-0.09705850133258971,0.6886055112426738,2024-03-09 14:29:27.439236,2024-03-09 14:33:27.661626,0 days 00:04:00.222390,0.2807132521410156,gbtree,0.44617466173646936,8.778758047490354e-07,1.6911932140690066e-05,lossguide,0.007714008683579473,7,7,280,,,,,0.31129072883099695,0,COMPLETE
2,-0.09721089203105446,0.6887008651149714,2024-03-09 14:33:27.662630,2024-03-09 14:37:07.856831,0 days 00:03:40.194201,0.00047799116813024425,gbtree,0.6385407171758031,1.2915531949292957e-07,0.0009275423513280933,lossguide,0.7570860868863649,3,6,300,,,,,0.5457164597155926,0,COMPLETE
3,-0.06683854525289568,0.6692611511090494,2024-03-09 14:37:07.857832,2024-03-09 14:40:19.491174,0 days 00:03:11.633342,2.758604116228163e-06,gbtree,0.908975692614896,0.0005236405739617829,6.693981534894989e-05,depthwise,0.0011089615128937625,3,6,160,,,,,0.7964906745652243,0,COMPLETE
4,0.40920200070561236,0.3713661201186761,2024-03-09 14:40:19.492190,2024-03-09 14:49:25.194923,0 days 00:09:05.702733,0.0038385343198659924,dart,0.4169397231211666,0.10422316494249655,0.04986543873397221,depthwise,1.9647709131928346e-07,3,5,160,forest,7.557618968567328e-08,uniform,2.0318867735472887e-08,0.7731074512495635,0,COMPLETE
5,-0.09718959154798665,0.6886880704400336,2024-03-09 14:49:25.195924,2024-03-09 14:53:36.188890,0 days 00:04:10.992966,0.07929375377291031,dart,0.46422458998824645,6.174035325582675e-07,5.1410396987933253e-05,depthwise,0.0016389629401490707,5,6,100,forest,4.697904313453145e-08,weighted,1.2685164825468245e-07,0.32714629747020385,0,COMPLETE
6,-0.09701669734612683,0.6885797172426187,2024-03-09 14:53:36.190923,2024-03-09 15:10:06.160795,0 days 00:16:29.969872,1.5522244576923914e-05,dart,0.7616621325338822,1.429560240996937e-06,1.7835923428670912e-05,lossguide,0.00017149395162199062,7,10,220,forest,0.1254750877834888,uniform,0.00129724463273521,0.2174173266590419,0,COMPLETE
7,-0.0971997990529577,0.6886940492745813,2024-03-09 15:10:06.161797,2024-03-09 15:23:23.905713,0 days 00:13:17.743916,0.006256148579052095,dart,0.36177798343444967,3.438786005267805e-07,1.5663663088374645e-08,lossguide,0.0001765937421095327,3,7,200,tree,0.0002524580042266706,weighted,0.0005290176509659743,0.6551071321101207,0,COMPLETE
8,0.10246386849536357,0.5617090698834846,2024-03-09 15:23:23.906715,2024-03-09 15:26:55.423596,0 days 00:03:31.516881,9.085750785301884e-06,gbtree,0.5350194376760122,0.0030718446521686015,1.0853153520489054e-05,lossguide,1.9412942047176848e-08,3,9,280,,,,,0.8666474072967767,0,COMPLETE
9,-0.09535893294795046,0.6875267385404621,2024-03-09 15:26:55.424596,2024-03-09 15:31:01.953363,0 days 00:04:06.528767,6.766191932450977e-07,gbtree,0.87587207793859,1.205055809464742e-05,0.1069962671602826,lossguide,0.07112697275711163,5,8,280,,,,,0.21580408752118246,0,COMPLETE
10,0.27517971871819336,0.45413411631043477,2024-03-09 15:31:01.954365,2024-03-09 15:40:08.335483,0 days 00:09:06.381118,6.961188446238116e-05,dart,0.42948145235624546,0.0072236449761651006,0.0007904437283309101,lossguide,0.8708772633621661,7,9,140,forest,1.7582558809413224e-05,uniform,0.01330806725720273,0.7078329942049246,0,COMPLETE
11,-0.09718436324475803,0.6886837638739662,2024-03-09 15:40:08.336484,2024-03-09 15:56:26.738503,0 days 00:16:18.402019,0.023447783361628356,dart,0.27690635590873014,9.176438769775504e-06,1.1709930722868039e-05,depthwise,0.0017759003191941225,3,9,280,tree,0.6117450056830634,weighted,1.226552867786495e-08,0.8956875975411036,0,COMPLETE
12,0.3203364847969233,0.4252125442162426,2024-03-09 15:56:26.739802,2024-03-09 16:01:21.924679,0 days 00:04:55.184877,0.004346831491095884,gbtree,0.2971202099053729,0.004220530366989789,2.4419252801801155e-05,depthwise,0.0001613960597989757,7,5,300,,,,,0.728321494262149,0,COMPLETE
13,-0.09721834116379546,0.6887063776192628,2024-03-09 16:01:21.925682,2024-03-09 16:15:27.490328,0 days 00:14:05.564646,0.0008933726109676465,dart,0.716475334700333,3.082350045640914e-07,0.0021559533731299926,depthwise,0.003000812207431847,5,3,180,tree,0.09029512797576189,uniform,7.023808340982011e-07,0.651501209808099,0,COMPLETE
14,0.4861927174074506,0.3224433052179908,2024-03-09 16:15:27.491330,2024-03-09 16:51:14.038683,0 days 00:35:46.547353,0.22461964962413392,dart,0.9643879895715253,0.05507558529432227,2.1255827559197746e-05,depthwise,0.00016522388903972757,5,2,300,forest,6.011744865173161e-08,weighted,0.0017113910861378105,0.5111515087186029,0,COMPLETE
15,0.2851346057909659,0.44748842037684733,2024-03-09 16:51:14.039698,2024-03-09 16:56:36.294263,0 days 00:05:22.254565,0.11861583926100333,gbtree,0.9027675315866919,0.008660697808038818,5.31103171964554e-08,lossguide,7.810165979136746e-06,5,8,180,,,,,0.5421459936549349,0,COMPLETE
16,-0.0945788382847967,0.6870258541349421,2024-03-09 16:56:36.295265,2024-03-09 17:05:52.222959,0 days 00:09:15.927694,0.5661969026408644,gbtree,0.8469374768400935,1.4800112810493611e-05,1.3177900779458745e-07,depthwise,2.4093613350298075e-07,5,5,300,,,,,0.7036831165711597,0,COMPLETE
17,-0.09591886141498143,0.6878787147032683,2024-03-09 17:05:52.224516,2024-03-09 17:29:06.497602,0 days 00:23:14.273086,1.0258443747333188e-06,dart,0.8501005677298119,9.687000551375115e-06,0.01701128961117606,depthwise,0.001056491341309208,5,8,220,forest,5.667050787134266e-06,uniform,1.1969874162941557e-06,0.9980577575304108,0,COMPLETE
18,-0.09646092479444039,0.6882274599088862,2024-03-09 17:29:06.498605,2024-03-09 17:32:44.967322,0 days 00:03:38.468717,0.03780016710233546,gbtree,0.4717153019665272,4.096412047978105e-06,1.0396630604069703e-07,depthwise,1.9057479538832302e-05,7,4,280,,,,,0.25420445864902397,0,COMPLETE
19,-0.03708022181847781,0.6507562472201867,2024-03-09 17:32:44.969326,2024-03-09 17:37:40.571640,0 days 00:04:55.602314,1.9796856303780546e-06,gbtree,0.9990905805512409,0.0007574380848092142,0.07500646447774295,depthwise,1.591026660486733e-05,7,10,120,,,,,0.4628990729144432,0,COMPLETE
20,0.010720443182288486,0.6195191438774369,2024-03-09 17:37:40.572643,2024-03-09 18:06:01.682733,0 days 00:28:21.110090,2.6186830002293746e-06,dart,0.29431553745200284,0.0012747802167786197,3.328907440983689e-05,depthwise,3.136629158005088e-05,3,2,300,tree,0.0017208201325700952,uniform,5.96206016037642e-06,0.9653506260775142,0,COMPLETE
21,-0.09722131054403378,0.6887082434564282,2024-03-09 18:06:01.683735,2024-03-09 18:12:11.014720,0 days 00:06:09.330985,0.03225302888680037,dart,0.8563361271694017,4.991669224002019e-07,0.0012046068909874043,depthwise,0.0002812913426071446,3,3,140,tree,0.22183680101261222,weighted,0.0012872148251917624,0.2859388863978278,0,COMPLETE
22,0.3950951791373522,0.3797814427267797,2024-03-09 18:12:11.015722,2024-03-09 18:17:48.170333,0 days 00:05:37.154611,0.020867817379744476,dart,0.30843625123097884,0.03818339123580162,0.004504463537250344,depthwise,0.01409061355105301,5,2,120,forest,2.2200997915744396e-08,uniform,1.0445186351215705e-08,0.5026178374364831,0,COMPLETE
23,-0.08885168946912456,0.6833804828053835,2024-03-09 18:17:48.172325,2024-03-09 18:23:01.243686,0 days 00:05:13.071361,1.2364739277973508e-06,gbtree,0.6709371726546332,6.460339959466644e-05,0.00011194267011674732,depthwise,8.38099204457312e-07,5,3,220,,,,,0.6426955119016897,0,COMPLETE
24,0.513867295183239,0.3058895129321203,2024-03-09 18:23:01.244683,2024-03-09 18:30:47.464332,0 days 00:07:46.219649,7.681165288806858e-08,gbtree,0.672207359398822,0.040700873975775806,1.7540044406323828e-05,lossguide,3.85104280797621e-06,7,10,200,,,,,0.9174452875869381,0,COMPLETE
25,-0.096321143954742,0.6881349191905726,2024-03-09 18:30:47.465335,2024-03-09 18:32:20.901909,0 days 00:01:33.436574,0.0010262493685666786,gbtree,0.3357357248605579,1.538986227322145e-05,0.0016329567223160248,lossguide,4.641971345594242e-05,5,7,100,,,,,0.9849771271742374,0,COMPLETE
26,-0.08931593832279909,0.6672376705012312,2024-03-09 18:32:20.903909,2024-03-09 18:38:02.089331,0 days 00:05:41.185422,0.01664520693256511,dart,0.723248699958204,0.7548845307642305,0.5337499697226323,depthwise,3.8333624322618344e-07,3,2,120,forest,0.001858620802020731,uniform,3.0597109748532555e-08,0.3915141079347846,0,COMPLETE
27,0.4205058758866544,0.3622403989612876,2024-03-09 18:38:02.091416,2024-03-09 18:59:17.345182,0 days 00:21:15.253766,0.00557391599282582,dart,0.3708807938961347,0.17749960044444962,0.09098041309281624,depthwise,4.912660870221868e-08,3,4,260,tree,0.00024570410975234373,weighted,0.017825155374451306,0.5059477297711013,0,COMPLETE
28,-0.0972220026414052,0.6887085808233164,2024-03-09 18:59:17.345182,2024-03-09 19:20:18.614684,0 days 00:21:01.269502,0.05246835408202981,dart,0.20996913974710615,7.427132802621175e-08,6.864788722326466e-06,lossguide,0.0013970163803287898,5,4,260,tree,0.020697709870134563,uniform,0.034084501072937985,0.4755531636641296,0,COMPLETE
29,-0.09722379878901584,0.6887098810153556,2024-03-09 19:20:18.615860,2024-03-09 19:28:23.459541,0 days 00:08:04.843681,6.13299561599565e-07,gbtree,0.8190323649660527,1.178950797314729e-08,9.78724059486901e-08,lossguide,2.2831355139109817e-07,7,3,180,,,,,0.7896186784204471,0,COMPLETE
30,-0.06714518512982834,0.6695786709953417,2024-03-09 19:28:23.460540,2024-03-09 19:54:11.637208,0 days 00:25:48.176668,0.6314567793566942,dart,0.41970357437979944,0.00019878009793050706,2.420260037671136e-08,lossguide,8.534312597077937e-07,5,2,280,forest,0.008210691043222664,uniform,0.04115492324610911,0.3756258406889861,0,COMPLETE
31,-0.09713383647420937,0.6886519298028785,2024-03-09 19:54:11.637208,2024-03-09 19:55:27.444092,0 days 00:01:15.806884,6.293938703022598e-05,gbtree,0.3298673628717891,1.7193251929980533e-06,5.856809074273429e-07,lossguide,0.03297100815059258,3,4,140,,,,,0.9970601285756575,0,COMPLETE
32,-0.09722379878901584,0.6887098810153556,2024-03-09 19:55:27.445094,2024-03-09 20:01:06.599347,0 days 00:05:39.154253,0.001195171510834914,dart,0.5188765963628119,2.4752897689217273e-08,5.8609370022107485e-08,lossguide,3.0916387699987576e-08,3,2,120,forest,0.0020538663408615552,uniform,1.7425942092987573e-06,0.7375725975700642,0,COMPLETE
33,0.49276278164641507,0.31845984986506937,2024-03-09 20:01:06.607397,2024-03-09 20:34:09.772054,0 days 00:33:03.164657,0.003248255399924014,dart,0.6403280387338683,0.11077950067426404,1.2049398266358858e-05,depthwise,0.003947019882399287,5,10,300,forest,0.007025439106611178,weighted,1.8448679078409036e-07,0.4871180401993928,0,COMPLETE
34,-0.09702197298735737,0.6885797967315574,2024-03-09 20:34:09.773056,2024-03-09 20:35:14.308003,0 days 00:01:04.534947,0.01689287437256059,gbtree,0.20279564169430175,2.321397623607735e-06,5.529930608593912e-07,lossguide,7.068620519095441e-08,3,3,240,,,,,0.4255952735737563,0,COMPLETE
35,0.24187309484831188,0.4710709932176602,2024-03-09 20:35:14.309005,2024-03-09 20:38:54.122361,0 days 00:03:39.813356,0.1461985654198905,gbtree,0.4128320152862685,0.3054123717456592,8.726583060656449e-08,lossguide,0.0001633533279217977,7,7,240,,,,,0.3424973459656837,0,COMPLETE
36,-0.09696691337548402,0.6885471474600529,2024-03-09 20:38:54.123364,2024-03-09 20:47:01.459992,0 days 00:08:07.336628,0.00022581315039562136,gbtree,0.5370811042557442,1.4375556825289208e-06,0.006477128744396121,depthwise,9.217229951805554e-06,7,7,240,,,,,0.881481277256283,0,COMPLETE
37,-0.09719348228280271,0.6886907622513181,2024-03-09 20:47:01.461500,2024-03-09 21:01:24.084249,0 days 00:14:22.622749,2.765040041043712e-07,dart,0.6377913991400914,2.7820114109346156e-07,8.982159296835027e-06,depthwise,1.650850900465041e-06,5,8,180,forest,5.2742281905438565e-05,weighted,3.27895163452087e-08,0.7415331547564639,0,COMPLETE
38,-0.0968027511629634,0.6884416077378599,2024-03-09 21:01:24.085095,2024-03-09 21:06:19.871813,0 days 00:04:55.786718,5.781438415409605e-06,gbtree,0.647967038011211,2.986625483563942e-06,3.31514534100364e-06,lossguide,0.00024652773594671684,5,5,240,,,,,0.5212553903644972,0,COMPLETE
39,0.19473035980683615,0.5046947682478933,2024-03-09 21:06:19.872803,2024-03-09 21:10:04.615449,0 days 00:03:44.742646,0.30122538470964016,dart,0.27983346511911933,0.017756008819003428,0.0001260105901926106,depthwise,0.06559613512739929,3,4,100,tree,1.5375940012381664e-07,uniform,2.8177237417366833e-08,0.7584320156608357,0,COMPLETE
40,-0.09523794471509431,0.6874507449884991,2024-03-09 21:10:04.615449,2024-03-09 21:17:41.842770,0 days 00:07:37.227321,4.573379653749709e-05,dart,0.8584299892977403,2.7033289885404723e-05,0.002126128447378764,depthwise,9.771858111378402e-07,7,8,100,forest,6.260924741546632e-07,uniform,8.935065543586065e-08,0.7712461094718337,0,COMPLETE
41,0.16629451853204696,0.5221354168948761,2024-03-09 21:17:41.842770,2024-03-09 21:20:02.963903,0 days 00:02:21.121133,0.000975312034035248,gbtree,0.796308115344166,0.009750923872912072,0.23378698533003012,depthwise,4.507658107196218e-08,3,8,140,,,,,0.6934741306384741,0,COMPLETE
42,0.09276018301989275,0.5680123592608671,2024-03-09 21:20:02.964906,2024-03-09 21:27:49.194498,0 days 00:07:46.229592,2.2256457876084095e-05,dart,0.5489459037020195,0.005697644270990217,2.6172611199866765e-06,lossguide,1.073020363229856e-06,3,9,140,tree,5.5345112299188494e-08,weighted,0.0002664518707668516,0.9637948390755309,0,COMPLETE
43,0.5222610726506517,0.3006781319036089,2024-03-09 21:27:49.196503,2024-03-09 21:37:18.414507,0 days 00:09:29.218004,3.494630585079505e-08,gbtree,0.6671642506348463,0.05845655958323326,0.0014314784337936153,lossguide,0.0024327791452268487,7,10,260,,,,,0.8258370202096919,0,COMPLETE
44,-0.09430130740020926,0.6868570581352198,2024-03-09 21:37:18.416233,2024-03-09 21:45:04.856540,0 days 00:07:46.440307,0.001462119018080526,gbtree,0.6830171243253244,1.3875865210583586e-05,1.3048915350629525e-05,depthwise,2.796686471589e-08,7,2,300,,,,,0.4063348546892114,0,COMPLETE
45,0.2076628527227938,0.49618400401831675,2024-03-09 21:45:04.857314,2024-03-09 21:48:22.938040,0 days 00:03:18.080726,0.0002875473321699266,dart,0.7650037567942802,0.3029334545827099,5.948427828507932e-06,lossguide,7.679992452201878e-08,3,4,100,forest,0.4956108669022848,uniform,0.0023497530888944604,0.6449514187643419,0,COMPLETE
46,-0.08400357913407679,0.6803833345261783,2024-03-09 21:48:22.939042,2024-03-09 22:13:58.827538,0 days 00:25:35.888496,0.00027726786385975314,dart,0.5611486574777653,0.0010098770308307964,2.0183889293327094e-06,depthwise,0.02681986683599216,7,8,300,tree,0.3450282065192075,weighted,3.520625480626134e-07,0.35683849948868734,0,COMPLETE
47,-0.09722364732739766,0.6887097728381498,2024-03-09 22:13:58.827538,2024-03-09 22:27:54.894051,0 days 00:13:56.066513,0.00012452769864459932,dart,0.33391764053068607,1.1859338638426586e-07,4.262740704383536e-06,lossguide,0.000836553125049396,7,8,240,tree,0.6164665792810613,weighted,1.1888513884386932e-06,0.4385125970327277,0,COMPLETE
48,-0.0969822693430121,0.6885569258367107,2024-03-09 22:27:54.894051,2024-03-09 22:44:27.751189,0 days 00:16:32.857138,0.36453364992937715,dart,0.9716229769064442,1.8879987131779035e-06,0.003817146014214114,depthwise,0.0011062515685809791,7,2,180,tree,1.550720538059521e-06,uniform,2.59159188688172e-07,0.4431945483456887,0,COMPLETE
49,-0.07858081242890598,0.6767107830133334,2024-03-09 22:44:27.751189,2024-03-09 22:46:55.515613,0 days 00:02:27.764424,5.657597514740865e-07,gbtree,0.7311419970605237,0.00023074992263553547,4.700718542563148e-08,depthwise,1.3563327114885502e-06,3,2,220,,,,,0.376237895814979,0,COMPLETE
50,-0.09721123123130604,0.6887010533088578,2024-03-09 22:46:55.515613,2024-03-09 23:14:41.458496,0 days 00:27:45.942883,0.00047799116813024425,dart,0.27690635590873014,1.2915531949292957e-07,0.0009275423513280933,depthwise,0.0017759003191941225,3,6,300,forest,1.4591785394435396e-06,uniform,3.610712273641663e-05,0.5457164597155926,1,COMPLETE
51,-0.09463832700583867,0.6870641011029937,2024-03-09 23:14:41.458496,2024-03-09 23:19:33.692592,0 days 00:04:52.234096,0.5661969026408644,gbtree,0.4128320152862685,1.4800112810493611e-05,8.726583060656449e-08,lossguide,2.4093613350298075e-07,5,2,300,,,,,0.7036831165711597,1,COMPLETE
52,-0.09591890114780059,0.6878787423561492,2024-03-09 23:19:33.692592,2024-03-09 23:42:06.553386,0 days 00:22:32.860794,1.0258443747333188e-06,dart,0.8501005677298119,9.687000551375115e-06,0.0014314784337936153,depthwise,0.0024327791452268487,5,8,220,forest,0.0005011538393998017,uniform,3.6291945023056283e-07,0.9980577575304108,1,COMPLETE
53,0.23858400379333009,0.47775347017985154,2024-03-09 23:42:06.554754,2024-03-09 23:45:49.473303,0 days 00:03:42.918549,9.085750785301884e-06,gbtree,0.5474429572148476,0.008660697808038818,5.31103171964554e-08,lossguide,7.810165979136746e-06,3,8,280,,,,,0.8666474072967767,1,COMPLETE
54,0.1675681948412149,0.5213514879541138,2024-03-09 23:45:49.473303,2024-03-09 23:47:51.406510,0 days 00:02:01.933207,1.9796856303780546e-06,gbtree,0.796308115344166,0.009750923872912072,0.23378698533003012,depthwise,4.507658107196218e-08,3,10,140,,,,,0.4628990729144432,1,COMPLETE
55,0.3715016237444558,0.3947882853033413,2024-03-09 23:47:51.406510,2024-03-09 23:49:37.789787,0 days 00:01:46.383277,0.020867817379744476,gbtree,0.30843625123097884,0.03818339123580162,1.0853153520489054e-05,lossguide,1.9412942047176848e-08,3,9,280,,,,,0.5026178374364831,1,COMPLETE
56,-0.09205027194215325,0.6854318479225265,2024-03-09 23:49:37.790790,2024-03-10 00:19:23.673055,0 days 00:29:45.882265,3.494630585079505e-08,dart,0.6671642506348463,2.7033289885404723e-05,0.0014314784337936153,depthwise,0.0024327791452268487,7,8,260,forest,0.0016640252143072607,weighted,2.084728743489025e-07,0.8258370202096919,1,COMPLETE
57,0.3048568153003376,0.4354112155022711,2024-03-10 00:19:23.673055,2024-03-10 00:39:44.399430,0 days 00:20:20.726375,7.681165288806858e-08,dart,0.672207359398822,0.005697644270990217,1.7540044406323828e-05,lossguide,1.073020363229856e-06,7,9,200,forest,1.0517544144123416e-05,weighted,1.6188406482505734e-08,0.9637948390755309,1,COMPLETE
58,-0.09686222843144639,0.6884810511482231,2024-03-10 00:39:44.399430,2024-03-10 00:49:24.428615,0 days 00:09:40.029185,3.494630585079505e-08,gbtree,0.6671642506348463,1.8879987131779035e-06,0.0014314784337936153,depthwise,0.0011062515685809791,7,10,260,,,,,0.8258370202096919,1,COMPLETE
59,0.11251349716454835,0.555871943189024,2024-03-10 00:49:24.429598,2024-03-10 00:59:42.827473,0 days 00:10:18.397875,0.001462119018080526,gbtree,0.6830171243253244,0.0012747802167786197,1.3048915350629525e-05,depthwise,0.00012210829959467316,7,2,300,,,,,0.6525871394380691,1,COMPLETE
60,0.186403518286343,0.5088768976527474,2024-03-10 00:59:42.828476,2024-03-10 01:04:25.834696,0 days 00:04:43.006220,9.085750785301884e-06,gbtree,0.5350194376760122,0.0030718446521686015,0.004504463537250344,lossguide,1.9412942047176848e-08,5,2,280,,,,,0.5026178374364831,1,COMPLETE
61,0.16701599384679458,0.5215151969014278,2024-03-10 01:04:25.835700,2024-03-10 01:08:23.413633,0 days 00:03:57.577933,2.2256457876084095e-05,dart,0.5489459037020195,0.005697644270990217,0.002126128447378764,depthwise,1.073020363229856e-06,7,9,100,forest,0.9316052040303092,weighted,0.03101662012099995,0.9637948390755309,1,COMPLETE
62,0.48991519596775623,0.31972130282323324,2024-03-10 01:08:23.414633,2024-03-10 01:41:29.347276,0 days 00:33:05.932643,0.003248255399924014,dart,0.6403280387338683,0.11077950067426404,1.2049398266358858e-05,lossguide,7.810165979136746e-06,5,10,300,forest,0.00020464979343352773,weighted,1.594116565937532e-06,0.5421459936549349,1,COMPLETE
63,-0.20867876221176082,0.7473255555004025,2024-03-10 01:41:29.348293,2024-03-10 01:47:04.835989,0 days 00:05:35.487696,0.01664520693256511,dart,0.7311419970605237,0.7548845307642305,4.700718542563148e-08,depthwise,3.8333624322618344e-07,3,2,120,tree,8.954817279866095e-06,uniform,0.0005009268226754373,0.376237895814979,1,COMPLETE
64,0.47720425530666055,0.32914147941231153,2024-03-10 01:47:04.836991,2024-03-10 02:16:53.482136,0 days 00:29:48.645145,2.6186830002293746e-06,dart,0.30843625123097884,0.03818339123580162,3.328907440983689e-05,depthwise,0.01409061355105301,5,9,300,tree,9.331169508337948e-08,uniform,5.350212566770297e-05,0.9653506260775142,1,COMPLETE
65,0.5021525507069851,0.3126780504577362,2024-03-10 02:16:53.482136,2024-03-10 02:23:45.661927,0 days 00:06:52.179791,0.22461964962413392,gbtree,0.9643879895715253,0.05507558529432227,0.06433455663981615,depthwise,0.00016522388903972757,7,9,140,,,,,0.7078329942049246,1,COMPLETE
66,-0.09696691337548402,0.6885471474600529,2024-03-10 02:23:45.661927,2024-03-10 02:31:11.898455,0 days 00:07:26.236528,0.00022581315039562136,gbtree,0.5370811042557442,1.4375556825289208e-06,0.006477128744396121,depthwise,9.217229951805554e-06,7,7,240,,,,,0.881481277256283,1,COMPLETE
67,0.2743261249418582,0.4504470769090313,2024-03-10 02:31:11.898455,2024-03-10 02:34:49.629741,0 days 00:03:37.731286,0.020867817379744476,gbtree,0.947137202263828,0.3054123717456592,7.662030275272564e-08,depthwise,0.01409061355105301,7,9,120,,,,,0.3424973459656837,1,COMPLETE
